status_id,status_message,link_name,status_type,status_link,status_published,num_reactions,num_comments,num_shares,num_likes,num_loves,num_wows,num_hahas,num_sads,num_angrys,num_special
10606591490_10155109959021491,"Referencing recent terror attacks in Britain, U.K. Prime Minister Theresa May remarks at the United Nations General Assembly that ""the terrorists did not win.""",Theresa May: The Terrorists Did Not Win,video,https://www.facebook.com/time/videos/10155109959021491/,2017-09-21 02:30:01,479,100,61,407,47,2,17,1,5,0
10606591490_10155109160546491,"At least 9 dead after ""extremely violent"" Hurricane Maria makes landfall. http://ti.me/2xSPKDh",Hurricane Maria Batters Puerto Rico,video,https://www.facebook.com/time/videos/10155109160546491/,2017-09-20 17:00:44,1013,54,544,333,26,99,4,550,1,0
10606591490_10155108462331491,‘It’s gone.’ Video captures family’s home being swallowed by a sinkhole. http://ti.me/2hi71OR,Video Captures Family’s Florida Home Being Swallowed by Sinkhole,video,https://www.facebook.com/time/videos/10155108462331491/,2017-09-20 14:30:00,2229,393,350,426,8,1127,3,662,3,0
10606591490_10155108038961491,'We can hear small noises.' Rescuers search for survivors at elementary school destroyed by Mexico City earthquake http://ti.me/2fzJ9mg,School Destroyed in Mexico City Earthquake,video,https://www.facebook.com/time/videos/10155108038961491/,2017-09-20 09:31:11,6490,264,1847,1400,30,271,3,4775,11,0
10606591490_10155028466700668,Tossing and turning all night? This might be why.,5 Expert Tips For Better Sleep,video,https://www.facebook.com/time/videos/10155028466700668/,2017-09-19 20:30:00,401,61,318,378,18,4,1,0,0,0
10606591490_10155104186251491,Top Democrat Nancy Pelosi gets shut down by young immigrants over DACA deal. http://ti.me/2fv2nt9,Young Immigrants Shut Down Nancy Pelosi Over DACA Deal,video,https://www.facebook.com/time/videos/10155104186251491/,2017-09-19 05:00:00,659,230,101,430,60,16,99,12,42,0
10606591490_1698547893512027,10 retailers that are at serious risk of bankruptcy. http://money.us/2rdAIAQ,10 Retailers That Are at Serious Risk of Bankruptcy,video,https://www.facebook.com/time/videos/1698547893512027/,2017-09-18 22:30:00,657,61,265,400,6,142,0,108,1,0
10606591490_10155103663011491,"President Trump has said that he is a considering a military parade similar to the Bastille Day parade in France. Speaking at a meeting with French President at the United Nations, President Trump praised the annual French military parade and said he is planning to hold a similar parade in Washington D.C. along Pennsylvania Avenue on July 4. President Donald Trump and Melania Trump attended the Bastille Parade in Paris in July this year. http://ti.me/2xMStOo",Trump: Considering Military Parade on July 4,video,https://www.facebook.com/time/videos/10155103663011491/,2017-09-18 20:01:02,825,354,111,367,28,25,180,19,206,0
10606591490_10155102611421491,Interior Secretary recommends shrinking 6 national monuments. http://ti.me/2fuZ5pV,6 National Monuments Could Be Reduced,video,https://www.facebook.com/time/videos/10155102611421491/,2017-09-18 11:31:20,1640,277,452,190,6,34,4,198,1208,0
10606591490_10155087197138163,These are the safest states in the U.S. http://ti.me/2sTIS1N,These Are the Safest States in the U.S.,video,https://www.facebook.com/time/videos/10155087197138163/,2017-09-18 07:29:20,373,77,126,335,19,13,5,1,0,0
10606591490_10155100239411491,He appeared in more than 200 movies and TV shows in a career dating to the mid-1950s. http://ti.me/2y7ZRAf,Harry Dean Stanton Has Died at 91,video,https://www.facebook.com/time/videos/10155100239411491/,2017-09-17 13:31:03,2483,44,460,1432,172,20,1,858,0,0
10606591490_10155353776147949,Watch how Starbucks has evolved through the years.,Watch How Starbucks Has Evolved,video,https://www.facebook.com/time/videos/10155353776147949/,2017-09-17 07:00:00,341,17,125,305,20,16,0,0,0,0
10606591490_1691646334202183,"Honeymoons are expensive, here's how you can save some money.",Save Money on Your Honeymoon,video,https://www.facebook.com/time/videos/1691646334202183/,2017-09-17 06:00:00,119,26,20,110,6,0,3,0,0,0
10606591490_10155353748942949,Take a look at SpaceX’s reusable spaceship.,Take a look at SpaceX​’s reusable spaceship,video,https://www.facebook.com/time/videos/10155353748942949/,2017-09-17 05:00:00,579,13,104,526,29,24,0,0,0,0
10606591490_1691649660868517,Are you popular at work? Research says it matters. http://money.us/2scjx6I,Being Popular At Work Matters,video,https://www.facebook.com/time/videos/1691649660868517/,2017-09-16 20:00:00,155,7,57,141,8,3,2,0,1,0
10606591490_10155009645400668,Who knew coffee could do so much? http://trib.al/UyPHXLf,7 Beauty Uses for Coffee,video,https://www.facebook.com/time/videos/10155009645400668/,2017-09-16 19:00:00,587,54,501,534,27,20,5,0,1,0
10606591490_1691645574202259,These apps will help you earn money while you're on vacation. http://money.us/2pDuVHh,Four Apps That Make You Money While Traveling,video,https://www.facebook.com/time/videos/1691645574202259/,2017-09-16 18:00:00,278,25,168,259,10,9,0,0,0,0
10606591490_10155097688731491,Peaceful protests turned violent http://ti.me/2x7A0ce,St. Louis protests continue after officer's acquittal,video,https://www.facebook.com/time/videos/10155097688731491/,2017-09-16 14:31:06,350,174,75,195,10,13,9,77,46,0
10606591490_1426857924076842,The purple food has some pretty big health benefits.,What's the Big Deal with Ube,video,https://www.facebook.com/time/videos/1426857924076842/,2017-09-15 22:30:00,2961,370,1160,2503,356,88,13,1,0,0
10606591490_1428027763959858,Are bananas herbs or fruit? http://trib.al/THgz3rD,Are Bananas Herbs or Fruit?,video,https://www.facebook.com/time/videos/1428027763959858/,2017-09-15 19:00:00,666,112,358,549,28,85,4,0,0,0
10606591490_10155095433051491,"On September 16, the multi-platinum, clown makeup–wearing rap group Insane Clown Posse and its fans, who call themselves Juggalos, will march on the National Mall to protest the FBI. http://ti.me/2y4iCV5",Why Insane Clown Posse is Marching on Washington,video,https://www.facebook.com/time/videos/10155095433051491/,2017-09-15 16:31:29,3127,768,2539,2384,225,97,390,12,19,0
10606591490_10155094978141491,Everything you need to know about the 2018 Winter Olympics. http://ti.me/2x1ONaH,What To Know About the 2018 Winter Olympics,video,https://www.facebook.com/time/videos/10155094978141491/,2017-09-15 13:31:04,289,27,94,246,31,12,0,0,0,0
10606591490_10155094801986491,An 11-year-old boy with a lawn mower and a dream just took on the White House. http://ti.me/2f0zG6T,Trump Greets the 11-Year-Old Mowing the White House Lawn,video,https://www.facebook.com/time/videos/10155094801986491/,2017-09-15 12:30:00,8778,1310,1333,7089,849,55,732,14,39,0
10606591490_10155365019717949,This pair of diamond earrings may be the most expensive in the world.,Most Expensive Pair of Diamond Earrings in the World,video,https://www.facebook.com/time/videos/10155365019717949/,2017-09-15 09:30:00,468,116,153,313,46,105,3,1,0,0
10606591490_10155205062013773,Think dietitans cook everything from scratch? Think again. http://trib.al/djje9rb,10 Processed Foods Dietitians Actually Eat,video,https://www.facebook.com/time/videos/10155205062013773/,2017-09-15 08:30:00,104,3,49,94,7,2,1,0,0,0
10606591490_10155096814868163,Good cop. Bad cop. How about better cop? http://bit.ly/2rkcENa,7 Things Pros Wish Parents Knew About Discipline,video,https://www.facebook.com/time/videos/10155096814868163/,2017-09-15 07:30:04,117,21,47,99,15,1,2,0,0,0
10606591490_10155093152376491,Which iPhone should you buy? How the iPhone X compares to the iPhone 8 and 8 Plus http://ti.me/2xo8J7p,Which iPhone Should You Buy?,video,https://www.facebook.com/time/videos/10155093152376491/,2017-09-14 23:30:55,2043,304,542,1874,89,58,17,4,1,0
10606591490_10155091532971491,"Donald Trump on a potential DACA deal: ""If we don’t have the wall we’re doing nothing."" http://ti.me/2xC65Me",Trump: ‘If We Don’t Have the Wall We’re Doing Nothing’,video,https://www.facebook.com/time/videos/10155091532971491/,2017-09-14 13:00:00,1594,942,215,467,47,29,291,28,732,0
10606591490_10155088667391491,Why California Gov. Jerry Brown is seeing his star soar. http://ti.me/2fiSmiF,Inside the World of California Gov. Jerry Brown,video,https://www.facebook.com/time/videos/10155088667391491/,2017-09-13 15:30:00,575,47,73,501,63,2,6,0,3,0
10606591490_10155088760661491,International Olympic Committee officials deliver a press conference on the 2024 and 2028 Olympics,,video,https://www.facebook.com/time/videos/10155088760661491/,2017-09-13 14:23:16,283,50,50,237,29,8,2,1,6,0
10606591490_10155088708246491,Bernie Sanders launches the latest version of his universal health care plan,,video,https://www.facebook.com/time/videos/10155088708246491/,2017-09-13 13:09:05,1235,381,136,901,294,7,19,1,13,0
10606591490_10155088626866491,Chinese military students form a human map of China,Military Students Form Human Map of China,video,https://www.facebook.com/time/videos/10155088626866491/,2017-09-13 12:30:57,327,67,47,246,15,42,14,0,10,0
10606591490_10155010111295668,Do you know how to spot a narcissist? http://trib.al/SpIokM6,How to Spot a Narcissist,video,https://www.facebook.com/time/videos/10155010111295668/,2017-09-13 07:30:00,3367,638,2763,2789,47,128,376,21,6,0
10606591490_10155895630339701,"Big news, Star Wars fans: J.J. Abrams is officially returning to write and direct Episode IX! Get the details: http://share.ew.com/4EZhkMi",J.J. Abrams Will Return To Write And Direct Star Wars- Episode IX,video,https://www.facebook.com/time/videos/10155895630339701/,2017-09-12 23:00:00,282,32,36,243,29,7,0,1,2,0
10606591490_10155087104671491,"As search and rescue operations continue in Florida, the U.S. Coast Guard has the herculean task of clearing rivers where yachts and sailboats have sunken, increasing the risk of water pollution. ""It literally looks like a battlefield,"" U.S. Coast Guard Lieutenant Nicole Corbett told TIME.",Inside the U.S. Coast Guard's Irma Operations,video,https://www.facebook.com/time/videos/10155087104671491/,2017-09-12 21:30:00,401,31,615,269,8,53,0,70,1,0
10606591490_10155085918556491,Watch Donald Trump explain that his genes are the secret to his success http://ti.me/2xi4Xwp,Donald Trump Loves Talking About His Genes,video,https://www.facebook.com/time/videos/10155085918556491/,2017-09-12 12:30:59,2507,642,509,586,31,69,1493,33,295,0
10606591490_10154951945026463,"The real secret to Charleston's enduring appeal is not its timelessness, but rather its skill for reinvention.","The South's Best City: Charleston, S.C.",video,https://www.facebook.com/time/videos/10154951945026463/,2017-09-12 07:30:00,229,17,93,205,18,2,3,0,1,0
10606591490_10155073666313163,"A+ lunch ideas for you and the little ones. 

Learn how to make them here: http://bit.ly/2wjbq7R",7 Creative Back-to-School Lunches,video,https://www.facebook.com/time/videos/10155073666313163/,2017-09-11 20:00:00,3732,481,2413,3365,301,51,10,3,2,0
10606591490_1688833761150107,7 uncomfortable conversations you hate having with your boss–and how to handle them. http://money.us/2tYiCUo,Uncomfortable Conversations With Your Boss,video,https://www.facebook.com/time/videos/1688833761150107/,2017-09-11 16:00:00,59,1,65,57,2,0,0,0,0,0
10606591490_1688840821149401,"A wedding is expensive, but a divorce could be worse.",Here's How Much an Average Divorce Costs,video,https://www.facebook.com/time/videos/1688840821149401/,2017-09-11 09:30:00,178,21,71,134,2,20,15,5,2,0
10606591490_10155082809121491,"Watch as President Trump and First Lady Melania Trump commemorate 9/11 at the Pentagon, 16 years after the attacks",President Donald Trump and First Lady Melania Trump participat...,video,https://www.facebook.com/time/videos/10155082809121491/,2017-09-11 08:33:06,727,257,81,491,66,5,9,97,59,0
10606591490_10155080471936491,Dramatic footage shows heavy rain and strong wind across Florida as Hurricane Irma makes landfall,Dramatic footage of Florida as Hurricane Irma makes landfall,video,https://www.facebook.com/time/videos/10155080471936491/,2017-09-10 11:56:21,14754,3871,5002,5702,529,3419,105,4864,135,0
10606591490_10155078525213163,How to question your doctor’s advice. http://ti.me/2rkwrP9,How to Question Your Doctor’s Advice,video,https://www.facebook.com/time/videos/10155078525213163/,2017-09-10 07:00:00,87,2,31,82,3,1,0,0,1,0
10606591490_10155345429107949,"Here's what to know about Lara Trump, President Donald J. Trump's daughter-in-law.",Here's What to Know About Lara Trump,video,https://www.facebook.com/time/videos/10155345429107949/,2017-09-10 03:00:00,136,43,14,77,5,3,22,1,28,0
10606591490_1688848904481926,"These are 5 movies that didn't cost much, but made a huge profit.",,video,https://www.facebook.com/time/videos/1688848904481926/,2017-09-10 02:00:00,650,19,127,603,14,30,3,0,0,0
10606591490_1421581411271160,What is gochujang and how do you cook with it? http://trib.al/9OH5Kve,What is Gochujang?,video,https://www.facebook.com/time/videos/1421581411271160/,2017-09-10 00:00:00,1004,173,253,886,97,16,5,0,0,0
10606591490_1688833034483513,The 50 top cities for recent college grads. http://money.us/2pXr3ke,Top 50 Cities for Recent Grads,video,https://www.facebook.com/time/videos/1688833034483513/,2017-09-09 04:00:00,239,9,71,218,10,11,0,0,0,0
10606591490_1688824901150993,A tech expert says these gadgets can help you get a better night's sleep. http://money.us/2p5lpvr,Tech Experts Say These Gadgets Can Help You Get a Better Night...,video,https://www.facebook.com/time/videos/1688824901150993/,2017-09-09 01:00:00,67,4,12,60,5,1,1,0,0,0
10606591490_10155002562310668,Your morning coffee has its benefits. http://trib.al/LtLYaSX,6 Health Benefits of Coffee,video,https://www.facebook.com/time/videos/10155002562310668/,2017-09-09 00:00:00,480,33,365,433,42,5,0,0,0,0
10606591490_10155072407846491,The women of 'Firsts' open up about balancing family and their careers. http://ti.me/2wMEODy,The Firsts Women on Balancing Family and Work,video,https://www.facebook.com/time/videos/10155072407846491/,2017-09-08 13:00:00,379,12,70,320,53,3,1,1,1,0
10606591490_10155072335366491,"Melinda Gates: ""I realized that the reason women were talking about women's issues is no one else was championing them."" http://ti.me/2vJknpT",Melinda Gates: The First Woman Philanthropist to Give Away Mor...,video,https://www.facebook.com/time/videos/10155072335366491/,2017-09-08 09:00:00,1174,31,264,1016,148,6,1,2,1,0
10606591490_10155071774791491,"Gabby Douglas: ""It's very important to have strong female individuals to look up to because you draw inspiration from them."" http://ti.me/2wbArjK",Gabby Douglas: The First American Gymnast to Win Solo and Team...,video,https://www.facebook.com/time/videos/10155071774791491/,2017-09-07 22:00:00,712,7,119,609,99,4,0,0,0,0
10606591490_10155071736701491,"""I think we suffer from the tyranny of low expectations when it comes to women and equality.""  http://ti.me/2wKVZHp",Sheryl Sandberg: The First Woman to Become a Billionaire From ...,video,https://www.facebook.com/time/videos/10155071736701491/,2017-09-07 19:00:00,877,26,217,783,86,0,0,8,0,0
10606591490_10155071695416491,"Ellen DeGeneres: ""You have this one moment in time to be fully who you are. That's what I decided to do, and I got rewarded for it."" http://ti.me/2wcd1un",Ellen DeGeneres: The First to Star as an Openly Gay Character ...,video,https://www.facebook.com/time/videos/10155071695416491/,2017-09-07 18:00:00,5751,100,592,4315,1400,26,7,0,3,0
10606591490_10155072249171491,Betsy DeVos moves to end Obama's guidelines for campus sexual assault investigations. http://ti.me/2j6AUCm,Betsy DeVos Moves to End Obama's Guidelines,video,https://www.facebook.com/time/videos/10155072249171491/,2017-09-07 16:30:00,9833,2049,1894,1298,75,268,47,582,7563,0
10606591490_10155071326226491,“My comfort level came in learning how to think like a man and to behave like a lady.” http://ti.me/2wbgPfs,Kellyanne Conway: The First Woman to Run a Winning Presidentia...,video,https://www.facebook.com/time/videos/10155071326226491/,2017-09-07 12:00:00,1354,659,100,494,53,28,482,14,283,0
10606591490_10155071392391491,"Serena Williams: “When you work so hard and you dedicate yourself, it shouldn’t be a double standard.” http://ti.me/2eO6Zh8",Serena Williams: The First Tennis Players to Win 23 Grand Slam...,video,https://www.facebook.com/time/videos/10155071392391491/,2017-09-07 10:01:08,1174,20,142,1011,156,5,1,0,1,0
10606591490_10155071153356491,"Oprah Winfrey: It's essential that, in life, you see yourself reflected in other people's stories."" http://ti.me/2eOgi0v",Oprah Winfrey: The First Woman to Own and Produce Her Own Talk...,video,https://www.facebook.com/time/videos/10155071153356491/,2017-09-07 08:01:21,10574,187,4227,7895,2595,72,8,2,2,0
10606591490_10155068232146491,See what it's like to fly inside Hurricane Irma http://ti.me/2w795Ll,What It's Like to Fly Inside Hurricane Irma,video,https://www.facebook.com/time/videos/10155068232146491/,2017-09-06 10:30:00,647,22,192,476,10,158,2,1,0,0
10606591490_1419258324836802,How to clean a grill: Because cleanliness is key. http://trib.al/41T9F7W,How to Clean a Grill,video,https://www.facebook.com/time/videos/1419258324836802/,2017-09-06 08:30:00,237,42,173,227,8,2,0,0,0,0
10606591490_10155066600116491,These volunteers helped their neighbors after Hurricane Harvey. Now their immigration status is at risk. http://ti.me/2gEGpDJ,How DACA Recipients Helped the Harvey Relief Efforts,video,https://www.facebook.com/time/videos/10155066600116491/,2017-09-05 22:30:00,912,41,197,403,26,15,2,336,130,0
10606591490_10155066556706491,Here's what President Trump has said about DACA in the past. http://ti.me/2gEs0Yx,In His Own Words: Trump on DACA,video,https://www.facebook.com/time/videos/10155066556706491/,2017-09-05 21:30:00,1639,382,362,530,27,35,32,117,898,0
10606591490_10155066573561491,Hurricane Irma has hit the Caribbean with record-breaking winds. http://ti.me/2wEa5dB,Hurricane Irma Hits the Caribbean With Strong Winds,video,https://www.facebook.com/time/videos/10155066573561491/,2017-09-05 20:28:10,2090,159,712,917,11,515,5,639,3,0
10606591490_1661741010534090,Ever wonder what happens when an award winning chef and a millennial food writer try to make trending recipes after watching a how-to video?  Find out in Homemade vs. the Internet.,Coming Soon: Homemade vs. the Internet Ever wonder what happen...,video,https://www.facebook.com/time/videos/1661741010534090/,2017-09-05 15:00:00,49,2,7,47,2,0,0,0,0,0
10606591490_10155064847436491,"The world’s tallest sandcastle now stands at nearly 55 feet tall in the German city of Duisburg. A group of international sculptors spent more than three weeks constructing the sandcastle and used 3,500 tons of sand.

The castle will be on display until at least September 24 and the site has so far been visited by around 180,000 people, according to a local tour operator who organized the event.",World's Tallest Sand Castle,video,https://www.facebook.com/time/videos/10155064847436491/,2017-09-05 12:30:00,3168,171,1261,2503,144,510,6,4,1,0
10606591490_10155065176831491,Attorney General Jeff Sessions says DACA program will be phased out http://ti.me/2w3rVTK,Attorney General Jeff Sessions Says DACA Program Will Be Phase...,video,https://www.facebook.com/time/videos/10155065176831491/,2017-09-05 11:31:17,2151,585,208,351,44,23,14,230,1489,0
10606591490_10154913280772135,Seltzer vs. club soda vs. tonic water vs. sparkling water http://trib.al/iLpGEYr,Seltzer vs. Club Soda vs. Tonic Water vs. Sparkling Water,video,https://www.facebook.com/time/videos/10154913280772135/,2017-09-05 09:30:00,957,234,425,898,35,18,5,0,1,0
10606591490_10155335812557949,See how this entrepreneur turned her love of dogs into a business. http://for.tn/2pUVNPY,Meet the Dog Matchmaker of NYC,video,https://www.facebook.com/time/videos/10155335812557949/,2017-09-05 08:30:00,924,230,108,757,141,10,14,1,1,0
10606591490_10155056476328163,Come back strong with these smart strategies. http://bit.ly/2tzY8l1,How to Get Back Into the Workforce,video,https://www.facebook.com/time/videos/10155056476328163/,2017-09-05 07:30:00,96,2,26,94,1,0,0,1,0,0
10606591490_10155063981216491,"Since August 25, over 123,000 Rohingya refugees have fled the escalating violence in western Myanmar's Rakhine state to neighboring Bangladesh. http://ti.me/2w1z4nJ",Rohingya Refugees Continue to Flee Into Bangladesh,video,https://www.facebook.com/time/videos/10155063981216491/,2017-09-05 04:01:23,3025,445,1736,1035,28,50,68,1509,335,0
10606591490_10155158716778773,How you can benefit from garlic. http://trib.al/gvXOZJM,How You Can Benefit from Garlic,video,https://www.facebook.com/time/videos/10155158716778773/,2017-09-04 22:30:00,740,49,456,688,39,12,1,0,0,0
10606591490_10155312582967949,The candy industry wants consumers to cut back on sugar. Here's why: http://for.tn/2q811uf,The Candy Industry Wants Consumers to Cut Back on Sugar,video,https://www.facebook.com/time/videos/10155312582967949/,2017-09-04 20:30:00,457,42,85,413,23,15,3,1,2,0
10606591490_1678065642226919,Use these 3 expert tips to create a strong and secure password. http://money.us/2oShnaL,3 Expert Tips to Create a Strong and Secure Password,video,https://www.facebook.com/time/videos/1678065642226919/,2017-09-04 18:30:00,77,3,22,72,3,0,1,0,1,0
10606591490_10155062638411491,Some Texans are helping feed first responders helping clean up after Hurricane Harvey,Texans Come Together in Harvey Relief Efforts,video,https://www.facebook.com/time/videos/10155062638411491/,2017-09-04 15:46:08,1075,35,131,917,144,11,1,2,0,0
10606591490_10154974797225668,"Pomegranates may be challenging to eat, but they have plenty of health benefits.",5 Reasons to Eat More Pomegranate,video,https://www.facebook.com/time/videos/10154974797225668/,2017-09-04 09:00:00,573,53,220,530,38,3,1,1,0,0
10606591490_1678058398894310,"The best way to answer, ""Tell me about yourself"" http://money.us/2oROzw1","What to Say When Someone Asks You to ""Tell Me About Yourself""",video,https://www.facebook.com/time/videos/1678058398894310/,2017-09-03 20:30:00,382,24,256,371,8,3,0,0,0,0
10606591490_10155046975923163,Ever wonder about the germs that are fellow passengers on that plane? http://bit.ly/2qQdUav,Surprising Facts About Airplane Germs,video,https://www.facebook.com/time/videos/10155046975923163/,2017-09-03 19:30:00,81,11,32,69,2,7,0,3,0,0
10606591490_10155768365209073,Every street and building here is painted in a various shade of blue. http://tandl.me/2qU44HA,The Most Instagrammable City in the World,video,https://www.facebook.com/time/videos/10155768365209073/,2017-09-03 07:00:00,12747,2005,3077,10497,1711,530,7,2,0,0
10606591490_1412130512216250,What is Matcha? There's a reason why it costs you a pretty penny. http://trib.al/YvYlWEl,What is Matcha?,video,https://www.facebook.com/time/videos/1412130512216250/,2017-09-03 06:00:00,1330,166,394,1158,152,19,0,0,1,0
10606591490_10156125473703132,"Three generations of Michigan women are all obstetrics nurses — and have delivered an estimated 10,000 babies! http://peoplem.ag/brvH2wo",Three Generations of Nurses in One Family Have Delivered Thous...,video,https://www.facebook.com/time/videos/10156125473703132/,2017-09-03 04:00:00,942,12,104,812,97,32,1,0,0,0
10606591490_10155312521907949,This is what Warren Buffett says is his biggest mistake. http://for.tn/2qTk0Hm,Warren Buffett's Biggest Mistake,video,https://www.facebook.com/time/videos/10155312521907949/,2017-09-02 19:00:00,463,10,141,445,4,13,1,0,0,0
10606591490_1679133445453472,How to save money while traveling solo. http://money.us/2pDDnUg,Cut Costs While Traveling Solo,video,https://www.facebook.com/time/videos/1679133445453472/,2017-09-02 06:00:00,216,12,84,208,7,1,0,0,0,0
10606591490_10155053460186491,Join J.K. Rowling in celebrating the official '19 Years Later' date from 'Harry Potter' http://ti.me/2vQfRoW,Harry Potter Fans Celebrate Official '19 Years Later' Date,video,https://www.facebook.com/time/videos/10155053460186491/,2017-09-01 11:31:01,12151,810,1625,9225,2497,382,36,7,4,0
10606591490_10155782393779073,This is not your typical roller coaster.,Not Your Typical Roller Coaster,video,https://www.facebook.com/time/videos/10155782393779073/,2017-09-01 10:30:00,2563,1370,862,1627,104,755,65,8,4,0
10606591490_10155056464123163,Why you need to take more vacation time. http://ti.me/2tccU4r,Why You Need to Take More Vacation Time,video,https://www.facebook.com/time/videos/10155056464123163/,2017-09-01 08:30:00,76,4,25,69,3,3,0,1,0,0
10606591490_1681429758557174,Take these 5 vacations before you have kids. http://money.us/2qk2if8,Take These 5 Vacations Before You Have Kids,video,https://www.facebook.com/time/videos/1681429758557174/,2017-09-01 01:30:00,704,119,166,638,44,15,6,0,1,0
10606591490_10155050241921491,This Houston man returned to his flooded home and played a song on the piano in waist-deep water.,Houston Man Plays Piano in Waist-Deep Water,video,https://www.facebook.com/time/videos/10155050241921491/,2017-08-31 12:30:00,12884,406,10212,7124,2238,238,14,3266,4,0
10606591490_10155321219172949,Here's how logos became the most important quarter-inch in business: http://for.tn/2tsUsBe,How Logos Became the Most Important Quarter-Inch in Business,video,https://www.facebook.com/time/videos/10155321219172949/,2017-08-31 10:30:00,206,11,64,191,10,2,3,0,0,0
