status_id,status_message,link_name,status_type,status_link,status_published,num_reactions,num_comments,num_shares,num_likes,num_loves,num_wows,num_hahas,num_sads,num_angrys,num_special
10606591490_10155241721986491,"Texas Church shooter contacted his father before he died, officials say. http://ti.me/2zmfhTa",Officials Say Church Shooter Had Domestic Issues With His In-laws,video,https://www.facebook.com/time/videos/10155241721986491/,2017-11-06 15:30:00,251,90,34,139,5,7,0,64,36,0
10606591490_10155241651436491,The 5 weirdest foods you'll start eating in 2018. http://ti.me/2yzW973,5 Weirdest Foods You'll Eat in 2018,video,https://www.facebook.com/time/videos/10155241651436491/,2017-11-06 14:01:20,1981,295,822,1716,83,141,26,7,8,0
10606591490_10155241285101491,Here's why sleeping in may be dangerous. http://ti.me/2zBhAEU,Sleeping In May Be Dangerous,video,https://www.facebook.com/time/videos/10155241285101491/,2017-11-06 11:01:56,362,257,155,299,7,30,8,17,1,0
10606591490_10155512324567949,Airbnb CEO and co-founder Brian Chesky shares the story of how they came up with the company's name.,The Story Behind the Name Airbnb,video,https://www.facebook.com/time/videos/10155512324567949/,2017-11-06 10:00:00,1743,98,372,1593,84,15,51,0,0,0
10606591490_10155239749536491,"“As a state we are dealing with the largest mass shooting in our state’s history,” Texas Gov. Greg Abbott said after a gunman opened fire at a church in Sutherland Springs, killing at least 26 people. http://ti.me/2zxxoby",,video,https://www.facebook.com/time/videos/10155239749536491/,2017-11-05 20:30:56,1510,361,165,462,8,25,6,811,198,0
10606591490_10155117455155668,These surprising habits could be putting your heart's health at risk.,5 Surprising Things That Hurt Your Heart,video,https://www.facebook.com/time/videos/10155117455155668/,2017-11-05 09:00:00,1444,78,1168,1357,29,54,3,1,0,0
10606591490_10155117448025668,These celebrities love to make fitness a family activity.,13 Celebs Who Work Out with Their Kids,video,https://www.facebook.com/time/videos/10155117448025668/,2017-11-05 04:00:00,484,12,23,445,35,4,0,0,0,0
10606591490_1737946366238846,12 insanely long and ridiculously expensive cruises that will take you around the world. http://money.us/2oZhSP9,12 Insanely Long (and Ridiculously Expensive) Cruises,video,https://www.facebook.com/time/videos/1737946366238846/,2017-11-05 02:00:00,1182,185,317,992,66,113,7,2,2,0
10606591490_1737944072905742,67% of millionaires say they write down goals and maintain a to-do list.,12 Habits of Millionaires That You Should Adopt Right Now,video,https://www.facebook.com/time/videos/1737944072905742/,2017-11-04 08:00:00,497,41,281,473,14,2,7,0,1,0
10606591490_1737941759572640,These are the top schools where alums beat the odds. http://money.us/2sQnDhV,Top Schools Where Alums Beat The Odds,video,https://www.facebook.com/time/videos/1737941759572640/,2017-11-04 04:00:00,77,5,10,70,4,2,0,1,0,0
10606591490_10155233869631491,Ivanka Trump speaks at the Tokyo Summit on Women’s Advancement,Ivanka Trump at the Tokyo Summit on Women’s Advancement,video,https://www.facebook.com/time/videos/10155233869631491/,2017-11-03 16:00:00,7765,1774,985,5000,350,74,1678,29,634,0
10606591490_1471420606287240,"What is Bulletproof Coffee? If your morning routine needs a little shake-up, this is it. http://trib.al/eNq8uHz",What is Bulletproof Coffee?,video,https://www.facebook.com/time/videos/1471420606287240/,2017-11-03 11:30:00,109,22,42,95,7,2,2,2,1,0
10606591490_1744162792283870,Here's how much it would cost you to vacation like a Kardashian. http://money.us/2o6kM1j,Here's How Much it Would Cost You to Vacation Like a Kardashian,video,https://www.facebook.com/time/videos/1744162792283870/,2017-11-02 23:30:01,148,46,5,132,5,3,2,1,5,0
10606591490_10155230923326491,Scientists just found a hidden chamber in the Great Pyramid of Giza http://ti.me/2zqdhvP,Scientist Found a Hidden Chamber in the Pyramid of Giza,video,https://www.facebook.com/time/videos/10155230923326491/,2017-11-02 11:31:44,4568,212,1233,3932,196,433,7,0,0,0
10606591490_10155230031761491,This is the number-one cause of stress for Americans — and it’s not money or work. http://ti.me/2zZI0fx,The Top Cause of Stress in the U.S.,video,https://www.facebook.com/time/videos/10155230031761491/,2017-11-02 06:30:00,402,46,121,302,4,34,5,54,3,0
10606591490_10155967075624073,Tag someone you want to bring here! http://www.travelandleisure.com/travel-guide/arizona,"Add it to the Bucket List: The Wave in Coyote Buttes, Arizona",video,https://www.facebook.com/time/videos/10155967075624073/,2017-11-01 23:00:00,4883,1554,651,3879,630,370,4,0,0,0
10606591490_10155499377742949,This hat might be the future of music.,This Hat Might Be the Future of Music,video,https://www.facebook.com/time/videos/10155499377742949/,2017-11-01 20:00:01,710,102,215,566,26,99,15,1,3,0
10606591490_10155228351016491,Sarah Huckabee Sanders delivers the White House press briefing after yesterday's attack in Manhattan.,Press Secretary Sarah Huckabee Sanders Delivers the White Hous...,video,https://www.facebook.com/time/videos/10155228351016491/,2017-11-01 14:04:19,331,567,29,137,31,4,11,14,134,0
10606591490_10155228209346491,Poet Elizabeth Alexander interviews Michelle Obama at the Obama Foundation Summit in Chicago,,video,https://www.facebook.com/time/videos/10155228209346491/,2017-11-01 11:55:08,1543,431,283,952,554,8,13,1,15,0
10606591490_10155493254427949,"If you don't want to get hacked, avoid these 5 passwords. http://for.tn/2jt61Ha",Here’s How to Protect Your Digital Identity,video,https://www.facebook.com/time/videos/10155493254427949/,2017-11-01 08:30:00,114,9,57,98,1,1,13,0,1,0
10606591490_10155226987931491,Why you should eat your Halloween candy all at once. http://ti.me/2A1towZ,Why You Should Eat Your Halloween Candy All At Once,video,https://www.facebook.com/time/videos/10155226987931491/,2017-11-01 01:31:44,138,15,25,120,1,3,10,1,3,0
10606591490_10155226116626491,"8 Dead After Driver Strikes Multiple People on New York City Bike Path
http://ti.me/2z3hmDj",'An Act of Terror in New York City,video,https://www.facebook.com/time/videos/10155226116626491/,2017-10-31 19:16:09,592,89,86,160,9,18,0,270,135,0
10606591490_10155225822916491,"Eight dead after driver struck and killed people on New York City bike path, police say. http://ti.me/2zlT6iD",NYPD Holds a News Conference Following a Deadly Incident in Ma...,video,https://www.facebook.com/time/videos/10155225822916491/,2017-10-31 18:00:00,355,54,42,138,4,3,1,170,39,0
10606591490_10155225663826491,New York Police Department holds a news conference following a deadly incident in Manhattan,,video,https://www.facebook.com/time/videos/10155225663826491/,2017-10-31 16:22:36,1220,418,269,365,61,36,1,645,112,0
10606591490_10155224871816491,The Duchess of Cambridge shows off her tennis skills with children.,The Duchess of Cambridge Plays Tennis,video,https://www.facebook.com/time/videos/10155224871816491/,2017-10-31 12:30:00,3934,56,275,3522,383,23,5,1,0,0
10606591490_10155223953516491,"""We have to fight isolationism, protectionism, and nativism."" Republican Sen. John McCain addresses U.S. Naval Academy graduates, warning against “parties that preach resentful nationalism rather than enlightened self-interest."" http://ti.me/2zkYAKA",John McCain Addresses U.S. Naval Academy Graduates,video,https://www.facebook.com/time/videos/10155223953516491/,2017-10-31 06:30:00,1630,71,351,1445,164,13,5,0,3,0
10606591490_10155961097599073,"Happy, sleepy, and dopey friends not included, unfortunately. 
Get more details: http://tandl.me/2fBLnlf",A Perfect Replica of Snow White’s Cottage Is for Sale,video,https://www.facebook.com/time/videos/10155961097599073/,2017-10-30 23:00:00,4247,799,988,3245,605,374,18,5,0,0
10606591490_10155222316981491,The White House downplays its connection to the new Mueller investigation charges. http://ti.me/2zhBNPK,White House Downplays Connection to Mueller Investigation Charges,video,https://www.facebook.com/time/videos/10155222316981491/,2017-10-30 15:00:00,1325,566,72,359,28,39,704,10,185,0
10606591490_10155960173824073,8 places to see the bluest water in the world. http://tandl.me/2thSAP5,8 Places to See the Bluest Water in the World,video,https://www.facebook.com/time/videos/10155960173824073/,2017-10-30 11:30:00,8440,706,4165,7016,1087,322,11,0,4,0
10606591490_10155221165171491,Two rescued sailors have reached a U.S. base in Japan after being stranded at sea for months. http://ti.me/2yWBRBs,Adrift Sailors Rescued by Navy Arrive in Japan,video,https://www.facebook.com/time/videos/10155221165171491/,2017-10-30 05:30:00,622,31,50,554,30,36,2,0,0,0
10606591490_10155474135257949,Did you know Estonia is a tech powerhouse? http://for.tn/2ppUfjq,How Estonia Became a Tech Powerhouse,video,https://www.facebook.com/time/videos/10155474135257949/,2017-10-29 23:30:00,2810,163,1066,2472,129,204,5,0,0,0
10606591490_1461466310616003,How to make 3 amazing burgers. Because what good is a burger without some exciting toppings? http://trib.al/qjOgPTP,How to Make 3 Amazing Burgers,video,https://www.facebook.com/time/videos/1461466310616003/,2017-10-29 21:30:00,312,54,90,274,25,8,3,2,0,0
10606591490_10155200103678163,Are you making one of these? http://bit.ly/2p1EQmx,10 Health Mistakes Even Smart People Make,video,https://www.facebook.com/time/videos/10155200103678163/,2017-10-28 20:00:00,106,9,38,90,1,12,3,0,0,0
10606591490_10155215248506491,Beth and Howard Stern love cats. And they're using their $90 million fortune to save them. http://ti.me/2yakbp5,The Sterns Love Fostering Cats,video,https://www.facebook.com/time/videos/10155215248506491/,2017-10-27 18:31:09,5480,342,1083,3981,1400,88,9,2,0,0
10606591490_10155214066091491,Chocolatiers and fashion designers display the 2017 collection of chocolate dresses as part of the annual Salon du Chocolat,,video,https://www.facebook.com/time/videos/10155214066091491/,2017-10-27 13:11:29,701,125,184,535,103,43,15,3,2,0
10606591490_10155213882861491,2 women lost at sea for 5 months survived shark attacks and storms http://ti.me/2zK71vb,Women Rescued After Being Adrift Five Months,video,https://www.facebook.com/time/videos/10155213882861491/,2017-10-27 10:31:16,5113,229,554,3281,268,1541,12,11,0,0
10606591490_10155945947774073,Amazing solo vacations to take before you tie the knot. http://ti.me/2qssSnh,Six Trips to Take Before You Get Married,video,https://www.facebook.com/time/videos/10155945947774073/,2017-10-27 08:30:00,335,32,86,302,28,5,0,0,0,0
10606591490_10155211739146491,"""He really helped me."" President Trump says his brother kept him away from drugs. http://ti.me/2y6IrZc",‘He Really Helped Me.’ President Trump Says His Brother Kept H...,video,https://www.facebook.com/time/videos/10155211739146491/,2017-10-26 15:30:00,1983,608,244,1396,69,22,392,14,90,0
10606591490_10155211515071491,Inside Scott Pruitt’s mission to remake the EPA http://ti.me/2z9r75N,Inside Scott Pruitt's Mission to Remake the EPA,video,https://www.facebook.com/time/videos/10155211515071491/,2017-10-26 14:03:32,196,71,38,61,5,6,2,17,105,0
10606591490_10155210779356491,47 dead after explosion at fireworks factory http://ti.me/2i6TeYu,Explosion in Indonesia,video,https://www.facebook.com/time/videos/10155210779356491/,2017-10-26 12:30:00,1168,36,205,306,5,158,4,683,12,0
10606591490_10155210698176491,"This super simple household item gets pesticides off apples, study says http://ti.me/2y6VN7w",The Better Way to Wash Apples,video,https://www.facebook.com/time/videos/10155210698176491/,2017-10-26 10:31:30,812,66,585,760,20,20,0,3,9,0
10606591490_10155210572331491,You Asked: Is watching scary movies good for you? http://ti.me/2z8TcKD,Scary Movies Could Be Good For Your Health,video,https://www.facebook.com/time/videos/10155210572331491/,2017-10-26 09:31:28,1892,1255,769,1505,129,34,221,1,2,0
10606591490_10155133567021491,"U.S. issues Cuba travel warning in response to ""specific attacks."" http://ti.me/2fDtOEz",U.S. Issues Cuba Travel Warning,video,https://www.facebook.com/time/videos/10155133567021491/,2017-09-29 14:00:00,344,83,128,198,2,83,4,43,14,0
10606591490_10155133585406491,What to say to someone observing Yom Kippur http://ti.me/2fvDBsG,What to Say to Someone Who Is Observing Yom Kippur,video,https://www.facebook.com/time/videos/10155133585406491/,2017-09-29 13:01:16,376,16,164,351,20,5,0,0,0,0
10606591490_10155135199048163,Take a look inside Barack Obama’s old Brooklyn apartment. http://bit.ly/2qIDX2y,Barack Obama’s Old Brooklyn Apartment,video,https://www.facebook.com/time/videos/10155135199048163/,2017-09-29 09:00:00,172,20,18,144,12,15,0,0,1,0
10606591490_10155131387266491,According to the American Heart Association,Meditation May Help Against Heart Disease,video,https://www.facebook.com/time/videos/10155131387266491/,2017-09-28 17:46:01,261,5,200,242,19,0,0,0,0,0
10606591490_1708500629183420,Here's why avocado prices have doubled in the last year. http://money.us/2pJexVw,Avocado Prices Have Doubled in The Last Year,video,https://www.facebook.com/time/videos/1708500629183420/,2017-09-28 16:00:00,525,105,116,411,8,33,2,69,2,0
10606591490_1708178992548917,Looking for a new job? Here's how to make your resume stand out. http://money.us/2i5Z6Ea,Make Your Resume Stand Out in 2017,video,https://www.facebook.com/time/videos/1708178992548917/,2017-09-28 10:30:00,426,16,337,417,5,0,4,0,0,0
10606591490_10155402809307949,The competition is coming for Netflix.,The Competition Is Coming for Netflix,video,https://www.facebook.com/time/videos/10155402809307949/,2017-09-27 22:30:00,117,7,32,109,4,1,1,2,0,0
10606591490_10155129025736491,Southwest Airlines has apologized after a video surfaced showing law enforcement forcibly dragging a woman off a Los Angeles-bound flight. http://ti.me/2wXWik0,Woman Dragged Out of Southwest Airlines,video,https://www.facebook.com/time/videos/10155129025736491/,2017-09-27 21:37:27,7211,1424,1106,2482,67,754,221,288,3399,0
10606591490_10155127849246491,"President Donald Trump is scheduled to give remarks on tax reform on Wednesday afternoon.
Trump, who campaigned on a promise to overhaul the tax code, is expected to unveil a Republican tax plan that will potentially include steep tax cuts for corporations as well as cuts for the wealthiest Americans and simplified tax brackets, according to the Associated Press.",,video,https://www.facebook.com/time/videos/10155127849246491/,2017-09-27 14:32:16,1195,1713,108,329,95,16,66,25,664,0
10606591490_10155127709611491,President Trump won't say if he still thinks climate change is a hoax. Here's why http://ti.me/2xLmPQK,President Trump Is Still Vague on Climate Change,video,https://www.facebook.com/time/videos/10155127709611491/,2017-09-27 11:34:51,336,133,57,162,7,4,53,17,93,0
10606591490_10155127597376491,President Trump is planning to slash the number of refugees allowed into the U.S. http://ti.me/2y9unO0,Trump Plans to Slash Refugee Admissions,video,https://www.facebook.com/time/videos/10155127597376491/,2017-09-27 10:33:16,519,194,48,223,36,14,5,58,183,0
10606591490_10155396788697949,You don't need a pilot's license to fly this flying car.,No Need Of A Pilot's License To Fly This Flying Car,video,https://www.facebook.com/time/videos/10155396788697949/,2017-09-27 07:30:00,2829,348,1257,2369,123,319,15,0,3,0
10606591490_10155126688256491,Roy Moore's victory in Alabama is bad news for the establishment GOP. http://ti.me/2fQbTHs,Roy Moore Wins Alabama Republican Senate Primary,video,https://www.facebook.com/time/videos/10155126688256491/,2017-09-27 00:00:00,164,26,19,110,5,10,11,3,25,0
10606591490_1706561982710618,Looking for a new job? Use this sample cover letter and stand out to hiring managers: http://money.us/2oktwSR,What Your Cover Letter Should Look Like in 2017,video,https://www.facebook.com/time/videos/1706561982710618/,2017-09-26 21:00:00,124,10,59,120,3,1,0,0,0,0
10606591490_10155126080496491,Women have been fighting for the right for years,Saudi Arabia Is Allowing Women to Drive Cars,video,https://www.facebook.com/time/videos/10155126080496491/,2017-09-26 17:46:24,3015,278,774,2576,286,109,35,2,7,0
10606591490_10155126055916491,"The Republican fight to repeal Obamacare is ""dead as a doornail."" For now. http://ti.me/2xK3SO3",Republicans Pull Plug on Obamacare Repeal,video,https://www.facebook.com/time/videos/10155126055916491/,2017-09-26 17:31:07,826,149,89,515,85,5,207,3,11,0
10606591490_10155125212931491,Is Puerto Rico part of the U.S.? Here's what to know http://ti.me/2yp7QsI,Is Puerto Rico Part of the U.S.?,video,https://www.facebook.com/time/videos/10155125212931491/,2017-09-26 11:30:00,5551,365,15138,4601,131,216,22,548,33,0
10606591490_10155125110471491,What a Roy Moore win could mean for Washington http://ti.me/2xxy3Gj,What a Roy Moore Win Could Mean for Washington,video,https://www.facebook.com/time/videos/10155125110471491/,2017-09-26 10:32:13,359,327,40,112,21,17,83,11,115,0
10606591490_10155043408410668,Hit a weight-loss plateau? Here's how to break through.,What To Do If You've Hit a Weight Loss Plateau,video,https://www.facebook.com/time/videos/10155043408410668/,2017-09-26 09:30:00,109,15,55,101,5,3,0,0,0,0
10606591490_10155124267336491,"""I kneel because I'm going to stand against racism. I kneel because I will stand with those young men."" Rep. Sheila Jackson Lee took the knee on the House floor in solidarity with NFL players. http://ti.me/2hvQpQg",Rep. Sheila Jackson Lee Kneels Down on House Floor,video,https://www.facebook.com/time/videos/10155124267336491/,2017-09-26 07:30:00,4472,312,800,3434,894,37,36,5,66,0
10606591490_10155124241176491,"“Every single time I see that picture of me, standing by myself, I feel embarrassed."" Alejandro Villaneuva of the Pittsburgh Steelers was the only member of the team to stand publicly during the national anthem on Sunday. http://ti.me/2xxNGNQ","Steelers Player Alejandro Villanueva: ""I Feel Embarrassed""",video,https://www.facebook.com/time/videos/10155124241176491/,2017-09-26 05:30:00,1987,392,281,1577,182,16,17,155,40,0
10606591490_10155124078021491,“I don’t believe that any of these athletes have the right for politics.” Fans have mixed reactions to President Donald Trump's attacks on NFL players who are kneeling or not showing up for the national anthem. http://ti.me/2xxnzqp,NFL Fans Have Mixed Reactions to Players Taking the Knee,video,https://www.facebook.com/time/videos/10155124078021491/,2017-09-26 00:00:20,339,386,28,237,10,10,49,8,25,0
10606591490_10155123293011491,Protesters got dragged out of a hearing on the Republican health care repeal bill. http://ti.me/2jXWbi0,Protesters Interrupt Hearing on Last-Minute Health Care Proposal,video,https://www.facebook.com/time/videos/10155123293011491/,2017-09-25 16:31:00,2484,365,899,599,42,157,24,768,894,0
10606591490_10155123188971491,Watch Ellen Pao and Gretchen Carlson discuss sexual harassment and changing office culture http://ti.me/2xFXjMG,Ellen Pao and Gretchen Carlson on the Fight for Safer Workplaces,video,https://www.facebook.com/time/videos/10155123188971491/,2017-09-25 15:31:32,78,8,11,68,10,0,0,0,0,0
10606591490_10155122864241491,"North Korea says Trump's latest threat is a ""declaration of war."" http://ti.me/2hrOfVu",North Korea Says Trump’s Latest Threat Is a ‘Declaration of War’,video,https://www.facebook.com/time/videos/10155122864241491/,2017-09-25 13:35:47,8020,2007,19856,4468,139,1855,807,434,317,0
10606591490_10155122693176491,'Dissidents are patriots.' Read Bob Costas' powerful response to Trump's NFL attacks http://ti.me/2ftwiVS,Bob Costas: Dissidents Are Patriots,video,https://www.facebook.com/time/videos/10155122693176491/,2017-09-25 12:31:07,4017,211,786,3428,503,13,12,2,59,0
10606591490_10155122563741491,Why you shouldn't charge your mobile phone overnight http://ti.me/2ftJryv,Should You Charge Your Mobile Phone Overnight?,video,https://www.facebook.com/time/videos/10155122563741491/,2017-09-25 11:30:55,2384,649,1536,2241,35,93,11,3,1,0
10606591490_10155121087106491,Angela Merkel has won a fourth term as German Chancellor. http://ti.me/2fKI8rO,Angela Merkel Wins Fourth Term as German Chancellor,video,https://www.facebook.com/time/videos/10155121087106491/,2017-09-24 22:30:00,6665,224,652,5761,715,139,10,14,26,0
10606591490_10155121076776491,"""This has to do with respect for our country and respect for our flag."" President Donald J. Trump addresses the row over the kneeling movement sweeping the NFL.",Trump Addresses NFL Row,video,https://www.facebook.com/time/videos/10155121076776491/,2017-09-24 20:30:00,3324,1953,480,1373,183,32,581,42,1113,0
10606591490_1699523416747808,The best Airbnbs have these 7 things in common.,The Best Airbnbs Have These 7 Things In Common,video,https://www.facebook.com/time/videos/1699523416747808/,2017-09-24 14:00:00,113,12,29,105,6,2,0,0,0,0
10606591490_10155109506948163,Here's how to shuck oysters.,How to Shuck Oysters,video,https://www.facebook.com/time/videos/10155109506948163/,2017-09-24 05:00:00,109,22,20,98,8,3,0,0,0,0
10606591490_10155109503923163,The one thing you can eat for a good night's sleep.,Sleep Studies,video,https://www.facebook.com/time/videos/10155109503923163/,2017-09-24 03:00:00,74,5,51,71,3,0,0,0,0,0
10606591490_10155836419539073,Amazing solo vacations to take before you tie the knot. http://ti.me/2qssSnh,Six Trips to Take Before You Get Married,video,https://www.facebook.com/time/videos/10155836419539073/,2017-09-23 13:00:00,280,27,85,254,20,5,0,1,0,0
10606591490_10155374971462949,5 hotel brands that are key to Marriott Hotels' success.,5 Hotel Brands That Are Key to Marriott's Success,video,https://www.facebook.com/time/videos/10155374971462949/,2017-09-23 08:00:00,471,35,214,451,13,4,0,2,1,0
10606591490_1698660443500772,These are the best cruises for your money right now.,The Best Cruises for Your Money Right Now,video,https://www.facebook.com/time/videos/1698660443500772/,2017-09-23 06:00:00,337,69,122,321,8,5,2,0,1,0
10606591490_1698659186834231,18 everyday items that are totally worth the splurge. http://money.us/2ocQ1Zd,18 Everyday Items That Are Totally Worth Splurging On | Money,video,https://www.facebook.com/time/videos/1698659186834231/,2017-09-23 05:00:00,133,12,26,126,6,1,0,0,0,0
10606591490_10155374951337949,Would you eat a caffeinated bagel? Now's your chance.,Would You Eat a Caffeinated Bagel?,video,https://www.facebook.com/time/videos/10155374951337949/,2017-09-23 03:00:00,160,54,14,127,16,13,4,0,0,0
10606591490_10154980585961463,We suggest you take some notes before your next flight.,Flight Attendants Reveal All The Places You Don’t Want to Touc...,video,https://www.facebook.com/time/videos/10154980585961463/,2017-09-22 22:00:00,172,6,43,159,6,7,0,0,0,0
10606591490_10155036473035668,"Healthy eating lowers your risk of diabetes, hypertension, and heart disease—and it may even help save your memory.

LEARN MORE: https://trib.al/om3YKrX",7 Foods That Can Help Save Your Memory,video,https://www.facebook.com/time/videos/10155036473035668/,2017-09-22 17:00:00,912,47,751,857,43,9,2,1,0,0
10606591490_10155114646121491,Britain's Theresa May says Brexit shouldn't take effect until 2021 http://ti.me/2jRsTln,May Asks for Later Brexit,video,https://www.facebook.com/time/videos/10155114646121491/,2017-09-22 13:31:13,180,57,32,107,11,8,48,1,5,0
10606591490_10155114156001491,President Trump says Kim Jong Un 'is obviously a madman' http://ti.me/2jRyk3p,'Dotard' Vs 'Madman',video,https://www.facebook.com/time/videos/10155114156001491/,2017-09-22 11:30:00,533,317,99,282,20,12,193,14,12,0
10606591490_10155220538543773,Want a home garden but don't know where to start? This guide is a guaranteed green thumb. http://trib.al/tm3wmal,5 Things You'll Need to Start Your Garden,video,https://www.facebook.com/time/videos/10155220538543773/,2017-09-22 10:30:00,91,2,15,83,5,3,0,0,0,0
10606591490_1701139246586225,These are the best companies for work-life balance. http://money.us/2pjHbNs,The Best Companies for Work-Life Balance,video,https://www.facebook.com/time/videos/1701139246586225/,2017-09-22 08:30:00,260,6,57,238,13,8,1,0,0,0
10606591490_10155113439791491,"Her story captured international attention after Mexico's devastating earthquake, but 'Frida Sofia' never actually existed. http://ti.me/2fE2Rxg",Girl 'Trapped' in Rubble After Mexico Quake Never Existed,video,https://www.facebook.com/time/videos/10155113439791491/,2017-09-22 05:03:00,465,69,111,271,1,86,3,27,77,0
10606591490_10155113270941491,"Bangladesh's prime minister Sheikh Hasina has accused Myanmar of ""ethnic cleansing"" of Rohingya Muslims and laying land mines to prevent those who fled to Bangladesh from returning.","Bangladesh's PM Calls on Myanmar to Stop ""Ethnic Cleansing""",video,https://www.facebook.com/time/videos/10155113270941491/,2017-09-22 02:28:28,4221,451,2957,3175,174,47,253,513,59,0
10606591490_10155112825936491,"""Righting historical wrongs."" Justin Trudeau addresses Canada's failings of indigenous peoples http://ti.me/2yhi3r1",Justin Trudeau Says Canada Failed Indigenous Peoples,video,https://www.facebook.com/time/videos/10155112825936491/,2017-09-21 23:00:00,5243,298,731,4390,708,76,21,26,22,0
10606591490_1701646089868874,The 5 most expensive wedding venues.,5 Most Expensive Wedding Venues,video,https://www.facebook.com/time/videos/1701646089868874/,2017-09-21 21:00:00,181,62,36,144,5,18,11,1,2,0
10606591490_10155111342206491,Your towels are way dirtier than you think http://ti.me/2jOMp1O,Your Towels Are Way Dirtier Than You Think,video,https://www.facebook.com/time/videos/10155111342206491/,2017-09-21 11:31:09,821,319,357,660,16,124,10,8,3,0
