status_id,status_message,link_name,status_type,status_link,status_published,num_reactions,num_comments,num_shares,num_likes,num_loves,num_wows,num_hahas,num_sads,num_angrys,num_special
10606591490_10155049795516491,"Dramatic footage from China of a 40-year-old bridge plummeting into a river when it was demolished on Wednesday.
The video, which was filmed in Chongqing, shows the Yujiang Bridge being demolished by explosives in just one second and then falling into the Yu river with a huge splash.
According to local media, 10-thousand local residents were temporarily evacuated from the surrounding area. Local authorities decided the bridge was unsafe and are working to replace it.",Bridge Demolition in China,video,https://www.facebook.com/time/videos/10155049795516491/,2017-08-31 08:31:05,363,55,96,256,3,94,2,5,3,0
10606591490_10155319346977949,These global entrepreneurs got an inside look at corporate America. Here's how: http://for.tn/2r1cT2k,How a Group of Global Entrepreneurs Got an Inside Look at Corp...,video,https://www.facebook.com/time/videos/10155319346977949/,2017-08-30 23:58:34,125,10,23,117,6,0,2,0,0,0
10606591490_10155319341407949,The meal kit battles are heating up. Who will win?,The Battle for Meal Kit Supremacy,video,https://www.facebook.com/time/videos/10155319341407949/,2017-08-30 20:00:00,72,11,12,67,3,2,0,0,0,0
10606591490_10155047196011491,"A shelter near Houston for at least 100 displaced people has been overrun by Harvey floodwaters, forcing weary evacuees to retreat to bleacher seats, according to the Associated Press. Jefferson County sheriff’s deputy Marcus McLellan said Wednesday that the Bowers Civic Center in Port Arthur was inundated overnight due to overwhelming rainfall and a nearby overflowing canal. McLellan says it’s not clear where the evacuees will go. Some have been at the civic center since Monday.",Harvey Floods Shelter in Texas,video,https://www.facebook.com/time/videos/10155047196011491/,2017-08-30 14:30:00,1853,146,594,388,13,276,4,1155,17,0
10606591490_10155047032231491,"David Tang, socialite and Shanghai Tang Founder, dies aged 63 http://ti.me/2vrRsuB",In Memoriam: David Tang,video,https://www.facebook.com/time/videos/10155047032231491/,2017-08-30 11:31:00,205,8,40,131,0,10,0,64,0,0
10606591490_10155045741646491,"Severe flooding in South Asia has caused more than 1,200 deaths this summer. http://ti.me/2xwTPte","More Than 1,200 People Have Died Due to Floods in South Asia",video,https://www.facebook.com/time/videos/10155045741646491/,2017-08-30 01:30:00,1402,44,619,389,2,172,2,836,1,0
10606591490_10155045093841491,The low-fat vs. low-carb diet debate has a new answer. http://ti.me/2wH8XH4,What's Better: Low-Carb or Low-Fat?,video,https://www.facebook.com/time/videos/10155045093841491/,2017-08-29 20:31:13,801,212,397,736,35,10,4,13,3,0
10606591490_10155044364126491,"In Houston, questions continued to swirl about why the mayor did not issue a mandatory evacuation order.
The mayor has repeatedly defended the decision, insisting that a mass evacuation of millions of people by car was a greater risk than enduring the storm. By Tuesday morning, more than 9,000 people were at the city’s largest shelter set up inside the George R. Brown Convention Center — which originally had an estimated capacity of 5,000. http://ti.me/2x21X7l",Houston Mayor Defends His Decision Not to Evacuate,video,https://www.facebook.com/time/videos/10155044364126491/,2017-08-29 15:30:00,293,144,55,230,22,8,3,12,18,0
10606591490_10155043616406491,This Texas woman saw alligators in her backyard.,Texas Woman Spots Alligators In Backyard,video,https://www.facebook.com/time/videos/10155043616406491/,2017-08-29 11:30:00,2623,284,720,1077,13,1385,93,51,4,0
10606591490_10155043554636491,White actor leaves 'Hellboy' role after realizing his character was originally Asian http://ti.me/2x0uE4F,Actor Leaves 'Hellboy' Cast Over Whitewashing,video,https://www.facebook.com/time/videos/10155043554636491/,2017-08-29 10:30:39,1963,205,101,1574,303,31,48,2,5,0
10606591490_10155043412131491,North Korea’s missile test over Japan was a carefully calculated move http://ti.me/2x0wVNa,North Korea Launches Missile Over Japan,video,https://www.facebook.com/time/videos/10155043412131491/,2017-08-29 09:30:41,895,153,269,502,9,95,14,45,230,0
10606591490_10155046818373163,Take a look inside Barack Obama’s old Brooklyn apartment. http://bit.ly/2qIDX2y,Barack Obama’s Old Brooklyn Apartment,video,https://www.facebook.com/time/videos/10155046818373163/,2017-08-28 07:30:10,203,8,31,183,16,4,0,0,0,0
10606591490_1407884735974161,"What is ""hygge"" and ""kalsarikannit""? And why don't these words exist in English? http://trib.al/Q46qUgR",What is Hygge and Kalsarikannit?,video,https://www.facebook.com/time/videos/1407884735974161/,2017-08-27 03:00:00,3222,378,768,2726,411,13,70,0,2,0
10606591490_10155298275027949,Here are Apple co-founder Steve Wozniak's predictions for the year 2075: http://for.tn/2oimpcZ,Steve Wozniak's Predictions For 2075,video,https://www.facebook.com/time/videos/10155298275027949/,2017-08-27 02:00:00,177,9,54,155,3,16,1,2,0,0
10606591490_1672093832824100,Looking for a new job this year? Here's how to make your resume stand out in 2017. http://money.us/2i5Z6Ea,Make Your Resume Stand Out in 2017,video,https://www.facebook.com/time/videos/1672093832824100/,2017-08-26 05:00:00,814,55,755,784,20,9,1,0,0,0
10606591490_10154960133280668,Inflammation affects your body in many ways. http://trib.al/J7bS02J,7 Ways Inflammation Affects Your Body,video,https://www.facebook.com/time/videos/10154960133280668/,2017-08-26 04:00:00,926,23,898,866,28,27,0,5,0,0
10606591490_1672092206157596,5 important things to remember when announcing a new job,5 Important Things to Remember When Announcing a New Job,video,https://www.facebook.com/time/videos/1672092206157596/,2017-08-26 03:00:00,53,3,16,51,2,0,0,0,0,0
10606591490_1674219185944898,Here's why avocado prices have doubled in the last year. http://money.us/2pJexVw,Avocado Prices Have Doubled in The Last Year,video,https://www.facebook.com/time/videos/1674219185944898/,2017-08-25 19:00:00,380,40,108,320,3,20,0,34,3,0
10606591490_10155032421411491,Former CIA agent wants to buy Twitter to prevent President Trump from using it http://ti.me/2vd2Ry4,Former CIA Spy Wants Trump Off Twitter,video,https://www.facebook.com/time/videos/10155032421411491/,2017-08-25 10:30:49,2827,414,318,2089,271,33,413,1,20,0
10606591490_10155032171646491,Here's what Hurricane Harvey looks like from space.,Hurricane Harvey From Space,video,https://www.facebook.com/time/videos/10155032171646491/,2017-08-25 08:30:54,592,37,122,306,15,259,1,11,0,0
10606591490_10155030042276491,"This former intelligence official questioned Trump's fitness for office, so Trump tweeted at him. http://ti.me/2vjWfd4",Donald Trump's History With Nuclear Weapons,video,https://www.facebook.com/time/videos/10155030042276491/,2017-08-24 13:31:12,676,37,190,439,17,19,28,46,127,0
10606591490_10155301323402949,You don't need a pilot's license to fly this flying car.,No Need Of A Pilot's License To Fly This Flying Car,video,https://www.facebook.com/time/videos/10155301323402949/,2017-08-24 10:30:00,2643,183,1441,2167,128,332,14,1,1,0
10606591490_10155025949051491,"President Trump went on the offense Tuesday night, hitting out at his political opponents and the media at a campaign rally in Phoenix. http://ti.me/2xbD6LQ",Trump Attacks Opponents and Media in Phoenix Rally,video,https://www.facebook.com/time/videos/10155025949051491/,2017-08-23 06:30:00,1111,610,114,415,39,24,199,22,412,0
10606591490_10155025897191491,Police fire pepper spray as protests at Trump’s rally in Phoenix turn unruly. http://ti.me/2wDAA3p,Protesters Pepper Sprayed in Arizona,video,https://www.facebook.com/time/videos/10155025897191491/,2017-08-23 05:30:00,718,234,169,299,8,120,30,171,90,0
10606591490_10155025906576491,"A powerful typhoon has hit Hong Kong, flooding streets and suspending trade. http://ti.me/2wmXyvP",Powerful Typhoon Hits Hong Kong,video,https://www.facebook.com/time/videos/10155025906576491/,2017-08-23 04:30:00,9297,1151,2512,4332,32,3252,43,1630,8,0
10606591490_1671144912918992,"""I spent $400 on a Game of Thrones dinner party featuring rattlesnake and locusts."" http://money.us/2uBw05s",'Game of Thrones' Fan Throws $400 Dinner,video,https://www.facebook.com/time/videos/1671144912918992/,2017-08-22 20:30:00,789,199,88,625,51,96,16,1,0,0
10606591490_10155023983326491,At least 1 dead after earthquake hits Italian resort island http://ti.me/2x8R9Sz,Brothers Rescued From Earthquake Rubble,video,https://www.facebook.com/time/videos/10155023983326491/,2017-08-22 10:30:54,296,3,44,117,1,27,0,150,1,0
10606591490_10155028066578163,The 5 wedding tips real brides want you to know. http://ti.me/2rkoEii,The 5 Wedding Tips Real Brides Want You to Know,video,https://www.facebook.com/time/videos/10155028066578163/,2017-08-22 08:30:00,58,2,11,54,2,2,0,0,0,0
10606591490_10155023295476491,"North Korea threatens ""merciless retaliation"" over U.S.-South Korean drills. http://ti.me/2vai92H","North Korea Threatens ""Merciless Retaliation"" over Drills",video,https://www.facebook.com/time/videos/10155023295476491/,2017-08-22 04:31:02,583,235,148,322,10,38,158,44,11,0
10606591490_1406475962781705,What is Kombucha? http://trib.al/AUVGN87,What is Kombucha?,video,https://www.facebook.com/time/videos/1406475962781705/,2017-08-22 01:00:01,592,249,158,522,39,21,8,2,0,0
10606591490_10155022728616491,President Trump says the U.S. can't afford a quick withdrawal from Afghanistan. http://ti.me/2x7InUC,Trump Unveils Policy on Afghanistan,video,https://www.facebook.com/time/videos/10155022728616491/,2017-08-21 22:00:00,354,265,40,146,13,9,18,34,134,0
10606591490_10155021979291491,Watch the whole total solar eclipse in 4 minutes. http://ti.me/2wydvyG,Watch the Whole Total Solar Eclipse in 4 Minutes,video,https://www.facebook.com/time/videos/10155021979291491/,2017-08-21 15:30:54,2778,76,1016,2347,253,174,4,0,0,0
10606591490_10155292420767949,The total solar eclipse could cost employers millions. Here's why: http://for.tn/2v4zOYH,The Solar Eclipse Could Cose Employers Millions,video,https://www.facebook.com/time/videos/10155292420767949/,2017-08-21 10:30:00,264,55,56,186,8,16,51,1,2,0
10606591490_1663936383639845,Here are some rich men whose wives are even richer. http://money.us/2uMYqGe,Women Worth More Than Their Husbands,video,https://www.facebook.com/time/videos/1663936383639845/,2017-08-20 23:30:00,624,31,66,560,35,22,7,0,0,0
10606591490_10155018421236491,From Charlottesville to North Korea to Steve Bannon http://ti.me/2uVm730,Everything That Happened on Trump's 'Working Vacation',video,https://www.facebook.com/time/videos/10155018421236491/,2017-08-20 14:31:50,340,47,92,222,8,8,61,8,33,0
10606591490_10155724964384073,A stay in a luxury hotel is now in everybody’s price range — if only for a little bit. http://tandl.me/2oJ564V,Book Luxury Hotel Rooms By the Minute,video,https://www.facebook.com/time/videos/10155724964384073/,2017-08-20 06:00:00,104,4,20,95,0,4,5,0,0,0
10606591490_1663933690306781,These are the best public colleges for your money. http://money.us/2sYb5sP,The Best Public Colleges,video,https://www.facebook.com/time/videos/1663933690306781/,2017-08-19 21:00:00,519,30,149,475,17,21,5,1,0,0
10606591490_10154847554571491,Venezuelan President Nicolas Maduro says a helicopter opened fire on the Supreme Court. http://ti.me/2tkawZg,Helicopter Opens Fire on Venezuelan Supreme Court,video,https://www.facebook.com/time/videos/10154847554571491/,2017-06-28 09:32:04,139,18,64,108,5,7,12,3,4,0
10606591490_10154844503461491,Senate delays health care vote due to lack of support. http://ti.me/2sY8ZWE,Senate Delays Health Care Vote,video,https://www.facebook.com/time/videos/10154844503461491/,2017-06-27 16:30:00,1150,371,101,542,31,11,359,8,198,1
10606591490_1609794915720659,These are the 3 best ways to exchange cash abroad.,How to Exchange Cash Abroad,video,https://www.facebook.com/time/videos/1609794915720659/,2017-06-27 15:30:00,272,23,112,259,7,5,1,0,0,0
10606591490_10154841875151491,"The Senate health care bill would leave 22 million more people uninsured, according to the CBO.",Senate Health Care Bill By the Numbers,video,https://www.facebook.com/time/videos/10154841875151491/,2017-06-26 20:16:01,487,102,130,165,3,16,9,54,240,0
10606591490_10154841307041491,China's jailed Nobel laureate Liu Xiaobo has been granted medical parole. http://ti.me/2teTfl9,Jailed Nobel Peace Laureate Released,video,https://www.facebook.com/time/videos/10154841307041491/,2017-06-26 16:30:57,166,3,37,131,2,4,1,28,0,0
10606591490_10154841145801491,President Trump and Prime Minister Modi deliver joint statement,,video,https://www.facebook.com/time/videos/10154841145801491/,2017-06-26 16:26:57,1317,857,128,682,144,15,48,21,391,16
10606591490_10154841132971491,"Trial begins for ""Pharma Bro"" Martin Shkreli. http://ti.me/2sUaLIq",'Pharma Bro' Set For Trial,video,https://www.facebook.com/time/videos/10154841132971491/,2017-06-26 15:31:08,574,99,71,419,20,2,35,4,92,2
10606591490_10154840765196491,"Listen up, Harry Potter fans. Here's how to make Butterbeer as tasty as Madam Rosmerta's.",How to Make Butterbeer,video,https://www.facebook.com/time/videos/10154840765196491/,2017-06-26 13:31:07,16187,5414,10506,13255,1986,818,96,9,9,14
10606591490_10154840628561491,Over 600 children set Harry Potter world record. http://ti.me/2rU5mzx,Hundreds Set 'Harry Potter' Record,video,https://www.facebook.com/time/videos/10154840628561491/,2017-06-26 12:31:21,789,32,59,624,146,4,13,0,1,1
10606591490_10154837234891491,Why do I hate the sound of my own voice? http://ti.me/2rzOnSV,Why You Hate the Sound of Your Voice,video,https://www.facebook.com/time/videos/10154837234891491/,2017-06-25 10:01:43,884,82,312,776,23,64,17,3,1,0
10606591490_10155080468602949,Have you ever heard of a cat cafe? NYC has one.,Meow Parlour: NYC's First Cat Café,video,https://www.facebook.com/time/videos/10155080468602949/,2017-06-25 04:00:00,3616,1593,690,2863,634,35,77,3,1,3
10606591490_10154833124678163,How to find the right therapy for you. http://ti.me/2sM0Y98,How to Find the Right Therapy for You,video,https://www.facebook.com/time/videos/10154833124678163/,2017-06-25 01:00:00,113,15,55,107,6,0,0,0,0,0
10606591490_10154835121871491,Here's why you should think twice before ordering coffee or tea on a plane. http://ti.me/2tJBNB8,The Problem With Airline Coffee,video,https://www.facebook.com/time/videos/10154835121871491/,2017-06-24 15:01:11,3753,731,2430,2345,16,1007,31,52,302,0
10606591490_10155077153187949,5 hotel brands that are key to Marriott Hotels' success.,5 Hotel Brands That Are Key to Marriott's Success,video,https://www.facebook.com/time/videos/10155077153187949/,2017-06-24 07:30:00,758,56,258,724,21,11,0,0,1,1
10606591490_1600861553280662,How this 33-year-old blogger traveled to every country and made $1 million doing it. http://money.us/2p5FkHF,How This 33-Year-Old Blogger Traveled to Every Country and Mad...,video,https://www.facebook.com/time/videos/1600861553280662/,2017-06-24 06:30:00,1250,87,187,1121,53,71,3,2,0,0
10606591490_10154831886471491,President Trump points finger at Obama on Russia election hack http://ti.me/2tYdcZJ,Who Does Trump Blame? Democrats,video,https://www.facebook.com/time/videos/10154831886471491/,2017-06-23 15:30:00,1425,346,172,465,19,40,562,25,312,2
10606591490_10155083521637949,U.S. workers are still really bad about using their vacation days.,U.S. Workers Are Wasting Vacation Days,video,https://www.facebook.com/time/videos/10155083521637949/,2017-06-23 08:30:00,226,76,59,185,2,17,9,8,5,0
10606591490_10154830150471491,British Prime Minister Theresa May said the fate of E.U. citizens will be a top priority in Brexit negotiations.,Theresa May Offers Hope for E.U. Citizens After Brexit,video,https://www.facebook.com/time/videos/10154830150471491/,2017-06-23 05:32:05,213,25,45,189,7,5,11,1,0,0
10606591490_10154828504221491,The world's population is forecast to reach 9.8 billion by the year 2050 http://ti.me/2sUZMQX,World Population to Reach 9.8 Billion By 2050,video,https://www.facebook.com/time/videos/10154828504221491/,2017-06-22 15:01:23,1102,165,580,593,10,291,13,166,29,0
10606591490_10154827200686491,"President Trump held a campaign-style rally in Cedar Falls, Iowa, on Wednesday.",Trump Talks Health Care and Immigration in Iowa Rally,video,https://www.facebook.com/time/videos/10154827200686491/,2017-06-22 06:33:29,621,301,57,190,14,11,161,16,227,2
10606591490_10154826918041491,Iraqi Prime Minister Haider al-Abadi said the destruction was an admission by the militants that they are losing the fight for Mosul.,,video,https://www.facebook.com/time/videos/10154826918041491/,2017-06-22 03:31:45,191,37,49,107,2,5,5,42,30,0
10606591490_10154833732008163,These little changes will make a huge difference. http://bit.ly/2rcwooH,8 Small Steps Toward a Healthy Lifestyle,video,https://www.facebook.com/time/videos/10154833732008163/,2017-06-21 14:30:00,126,3,50,120,0,1,5,0,0,0
10606591490_10154824559216491,Why do summer colds feel so much worse? http://ti.me/2sVTH7d,Why Do Summer Colds Feel Worse?,video,https://www.facebook.com/time/videos/10154824559216491/,2017-06-21 10:30:58,98,4,26,84,1,3,2,8,0,0
10606591490_10154822239486491,Hip hop artist Prodigy of Mobb Deep dies at 42. http://ti.me/2tpXMOv,In Memoriam: Prodigy,video,https://www.facebook.com/time/videos/10154822239486491/,2017-06-20 17:01:08,3524,154,689,1331,62,363,3,1761,4,0
10606591490_10155081010627949,Mattel is giving Ken dolls a big makeover.,Mattel Is Giving Ken a Big Makeover,video,https://www.facebook.com/time/videos/10155081010627949/,2017-06-20 16:30:00,184,33,43,155,15,7,6,1,0,0
10606591490_1602183859815098,Wondering what happened to your class valedictorian? This is what research shows. http://money.us/2rhVVNm,What Happened to Your Class Valedictorian,video,https://www.facebook.com/time/videos/1602183859815098/,2017-06-20 14:30:00,4247,289,2512,3770,202,239,28,6,1,1
10606591490_10154821516756491,Trove of Nazi artifacts including a bust of Adolf Hitler found http://ti.me/2sM21WF,Nazi Artifacts Found in Argentina,video,https://www.facebook.com/time/videos/10154821516756491/,2017-06-20 12:31:05,4154,695,1023,2766,122,1130,34,22,76,4
10606591490_10154821171221491,The Internet can't get over President Trump's Panama Canal comment http://ti.me/2sOV9Zq,Trump's Panama Canal Comment,video,https://www.facebook.com/time/videos/10154821171221491/,2017-06-20 10:31:05,8253,1292,1471,2325,51,483,5147,102,130,15
10606591490_10155076811762949,Here's how logos became the most important quarter-inch in business: http://for.tn/2tsUsBe,How Logos Became the Most Important Quarter-Inch in Business,video,https://www.facebook.com/time/videos/10155076811762949/,2017-06-20 09:30:00,617,42,291,585,24,2,4,1,0,1
10606591490_10154819475596491,See pride events from around the world. http://ti.me/2rwIWnJ,Pride 2017: Events Around the World,video,https://www.facebook.com/time/videos/10154819475596491/,2017-06-19 20:30:59,1093,94,216,598,107,7,7,7,14,353
10606591490_10154818578891491,Hear Jared Kushner speak in a rare public appearance. http://ti.me/2sLuEnB,Jared Kushner Speaks in Rare Public Appearance,video,https://www.facebook.com/time/videos/10154818578891491/,2017-06-19 14:30:00,1954,899,235,700,37,60,760,19,368,10
10606591490_10154759207615668,"Pomegranates may be challenging to eat, but they have plenty of health benefits.",5 Reasons to Eat More Pomegranate,video,https://www.facebook.com/time/videos/10154759207615668/,2017-06-19 09:30:00,625,24,353,580,36,9,0,0,0,0
10606591490_10154756377785668,These celebrities love to make fitness a family activity.,13 Celebs Who Work Out with Their Kids,video,https://www.facebook.com/time/videos/10154756377785668/,2017-06-18 07:00:00,379,4,22,347,30,2,0,0,0,0
10606591490_10154808923691491,'Wonder Woman' director Patty Jenkins talks about how she was inspired by her dad.,'Wonder Woman' Director Inspired By Dad,video,https://www.facebook.com/time/videos/10154808923691491/,2017-06-18 06:00:00,454,16,58,410,36,5,1,0,0,2
10606591490_1336967803065855,Ghee vs. Butter: Is cooking with ghee all that it's hyped up to be? http://trib.al/lwjq3qb,Ghee vs. Butter,video,https://www.facebook.com/time/videos/1336967803065855/,2017-06-18 05:00:00,605,113,217,576,15,8,3,2,0,1
10606591490_10155500133384073,"Dangling some 100 feet over the rocky waters of the Atlantic Ocean, the rope bridge takes visitors across cliffs where they can access the tiny island of Carrick-a-Rede. http://tandl.me/2pIfH41",This Rope Bridge Is So Popular You Need a Ticket to Cross,video,https://www.facebook.com/time/videos/10155500133384073/,2017-06-18 04:00:00,554,56,133,499,28,26,0,0,0,1
10606591490_10154813331341491,Here's the easiest way to eat more vegetables. http://ti.me/2rejNyg,Easy Way to Eat More Vegetables,video,https://www.facebook.com/time/videos/10154813331341491/,2017-06-17 19:01:20,384,20,127,359,16,4,5,0,0,0
10606591490_10154810422976491,You can now meet a virtual reality hologram of Buzz Aldrin on the Oculus Rift. http://ti.me/2roGiR1,See Buzz Aldrin's Plan to Colonize Mars in Virtual Reality,video,https://www.facebook.com/time/videos/10154810422976491/,2017-06-16 19:30:07,285,11,72,255,15,15,0,0,0,0
10606591490_10154809690286491,President Donald J. Trump curbs Obama-era Cuba deal. http://ti.me/2tbaQqQ,Trump Curbs Obama-era Cuba Deal,video,https://www.facebook.com/time/videos/10154809690286491/,2017-06-16 15:30:00,4430,1099,320,1390,163,124,131,144,2473,5
10606591490_10154808975976491,Russia says it may have killed ISIS leader Abu Bakr al-Baghdadi in an airstrike http://ti.me/2sjji7g,ISIS Leader Possibly Dead,video,https://www.facebook.com/time/videos/10154808975976491/,2017-06-16 10:31:13,1155,211,242,962,77,86,25,2,1,2
10606591490_10155063918512949,Take a look inside this $27.9 million clock tower penthouse.,Take a Look Inside This $27.9 Million Clock Tower Penthouse,video,https://www.facebook.com/time/videos/10155063918512949/,2017-06-16 09:30:00,524,36,95,444,28,48,1,0,0,3
10606591490_10154808698646491,Buying your dad a gift is why Father's Day exists. http://ti.me/2swPK99,History of Father's Day,video,https://www.facebook.com/time/videos/10154808698646491/,2017-06-16 08:31:41,184,12,97,161,15,6,1,0,0,1
10606591490_10154688001436463,"The real secret to Charleston's enduring appeal is not its timelessness, but rather its skill for reinvention.","The South's Best City: Charleston, S.C.",video,https://www.facebook.com/time/videos/10154688001436463/,2017-06-15 21:00:00,170,27,38,157,11,2,0,0,0,0
10606591490_10154806350051491,The American student had been imprisoned by North Korea,Otto Warmbier Suffered 'Severe' Brain Injury,video,https://www.facebook.com/time/videos/10154806350051491/,2017-06-15 19:46:06,2755,250,386,718,11,232,11,1586,193,4
10606591490_650526215145668,Two girls who escaped Boko Haram open up to us about their incredible journey to freedom. Click the link to watch the full special: https://pen.live/2rw6Grg,Boko Haram Journey,video,https://www.facebook.com/time/videos/650526215145668/,2017-06-15 10:30:00,114,5,31,95,9,1,0,6,0,3
10606591490_10155061050312949,48 million Americans are affected by contaminated food every year.,The 3 Largest Food Recalls In U.S. History,video,https://www.facebook.com/time/videos/10155061050312949/,2017-06-15 07:30:00,126,14,59,88,0,24,0,11,2,1
10606591490_10155801842988132,"Joy Bishara and Lydia Pogu were kidnapped by Boko Haram, a terrorist group in their native Nigeria. https://pen.live/2rw6Grg",Boko Haram: Our Journey to Freedom,video,https://www.facebook.com/time/videos/10155801842988132/,2017-06-14 16:30:00,858,32,127,328,14,43,0,458,15,0
10606591490_1595071863859631,10 retailers that are at serious risk of bankruptcy. http://money.us/2rdAIAQ,10 Retailers That Are at Serious Risk of Bankruptcy,video,https://www.facebook.com/time/videos/1595071863859631/,2017-06-14 15:30:00,473,80,231,293,3,108,7,61,0,1
10606591490_10154801885966491,President Trump makes a statement on Virginia shooting. http://ti.me/2rhnIug,President Trump Makes Statement On Virginia Shooting,video,https://www.facebook.com/time/videos/10154801885966491/,2017-06-14 12:02:00,754,434,81,511,22,4,108,63,44,2
10606591490_10154801602876491,"A top Republican congressional leader and others were shot in Virginia while practicing for their annual charity baseball game on Wednesday morning.

House Majority Whip Steve Scalise was one of several people shot when a shooter fired bullets at Republican members of Congress and their staffers at a baseball field just outside of Washington, D.C. Five people were transported from the scene in Alexandria, Va., for medical care, and Scalise’s office has said he was in stable condition and undergoing surgery.

Authorities have identified the suspect as James T. Hodgkinson, who later died from his injuries, President Donald Trump said at a news conference.",Nancy Pelosi speaks after congressman shot in Virginia,video,https://www.facebook.com/time/videos/10154801602876491/,2017-06-14 10:36:48,1083,715,183,495,62,67,27,220,206,6
10606591490_10154759136340668,This is what people get wrong about depression.,5 Things People Get Wrong About Depression,video,https://www.facebook.com/time/videos/10154759136340668/,2017-06-14 08:00:26,402,8,269,374,16,7,0,4,0,1
10606591490_10154800644791491,At least 30 people have been hospitalized after a massive fire at a London apartment building http://ti.me/2rg1YPk,Massive Fire at London Apartment Building,video,https://www.facebook.com/time/videos/10154800644791491/,2017-06-14 01:30:46,1189,48,179,358,6,136,1,684,3,1
