status_id,status_message,link_name,status_type,status_link,status_published,num_reactions,num_comments,num_shares,num_likes,num_loves,num_wows,num_hahas,num_sads,num_angrys,num_special
111938618893743_1481786188575639,"Sarah Huckabee Sanders: Pres. Trump's frustration with AG Jeff Sessions recusing himself hasn't gone away, and I don't think it will.",,video,https://www.facebook.com/foxandfriends/videos/1481786188575639/,2017-07-25 08:11:17,918,206,109,793,58,16,2,41,8,0
111938618893743_1481765335244391,"Rand Paul blasts 'pork fest' Senate GOP healthcare bill: ""Conservatives are getting squat.""",,video,https://www.facebook.com/foxandfriends/videos/1481765335244391/,2017-07-25 07:49:09,867,361,207,667,37,23,5,12,123,0
111938618893743_1481633765257548,"""We ought to change it from the word 'swamp' to the word 'cesspool' or...'sewer.'"" -President Donald J. Trump blasts Washington establishment",,video,https://www.facebook.com/foxandfriends/videos/1481633765257548/,2017-07-25 05:08:30,3540,343,381,3060,350,6,117,0,7,0
111938618893743_1477524452335146,"“Mueller’s team, the people he has picked, is a clear indication that there is some hostility toward the president.” -Geraldo Rivera",,video,https://www.facebook.com/foxandfriends/videos/1477524452335146/,2017-07-21 11:07:02,2522,647,789,1812,20,118,32,41,499,0
111938618893743_1477369385683986,CIA Dir. Mike Pompeo blasts The New York Times as 'unconscionable' for published the name of a covert officer in Iran,,video,https://www.facebook.com/foxandfriends/videos/1477369385683986/,2017-07-21 07:48:27,3155,426,1282,1995,36,243,7,39,835,0
111938618893743_1477319265688998,Should schools be allowed to paddle misbehaving students?,,video,https://www.facebook.com/foxandfriends/videos/1477319265688998/,2017-07-21 06:43:46,20159,8041,6835,16964,1944,210,208,45,788,0
111938618893743_1477302995690625,Atlanta Braves apologize after an Army veteran was asked to take down his American flag during a tailgate,,video,https://www.facebook.com/foxandfriends/videos/1477302995690625/,2017-07-21 06:25:04,2044,457,638,613,11,272,10,59,1079,0
111938618893743_1476475009106757,"""Democrats lost the election, so they're going to investigate Trump for as long as he's in office."" -Sen. Rand Paul",,video,https://www.facebook.com/foxandfriends/videos/1476475009106757/,2017-07-20 10:20:00,6500,1193,2549,4317,63,78,78,442,1522,0
111938618893743_1476294459124812,"President Trump blasts AG Sessions: ""How do you take a job and then recuse yourself?""",,video,https://www.facebook.com/foxandfriends/videos/1476294459124812/,2017-07-20 06:53:30,1417,541,184,1182,79,90,24,11,31,0
111938618893743_1476247565796168,Should OJ Simpson get out on parole?,,video,https://www.facebook.com/foxandfriends/videos/1476247565796168/,2017-07-20 06:00:22,253,320,18,104,2,8,16,2,121,0
111938618893743_1476182339136024,"Mark Steyn: There's significant parts in GOP leadership that don't want Pres. Trump to succeed. You'd think that'd be enough of a story for CNN, but they're stuck on Russia. (via Tucker Carlson Tonight)",,video,https://www.facebook.com/foxandfriends/videos/1476182339136024/,2017-07-20 04:39:57,1369,270,333,1000,10,48,30,40,241,0
111938618893743_1475215645899360,"The nation’s 11 most-approved governors are all Republicans, new poll finds",,video,https://www.facebook.com/foxandfriends/videos/1475215645899360/,2017-07-19 07:10:03,3080,199,617,2714,300,22,40,2,2,0
111938618893743_1475135415907383,ICE plans to hire 10k more agents in sanctuary cities,,video,https://www.facebook.com/foxandfriends/videos/1475135415907383/,2017-07-19 05:34:31,11381,719,3895,9807,1369,38,154,4,9,0
111938618893743_1474074852680106,Senator James Lankford is still optimistic the Senate can repeal and replace ObamaCare. Are you?,,video,https://www.facebook.com/foxandfriends/videos/1474074852680106/,2017-07-18 06:32:46,887,548,101,742,37,7,25,39,37,0
111938618893743_1473236576097267,Rachel Campos-Duffy: No one talks about Russia in the Midwest other than to complain that it’s getting so much attention.,,video,https://www.facebook.com/foxandfriends/videos/1473236576097267/,2017-07-17 10:30:32,2592,364,363,2387,152,11,18,3,21,0
111938618893743_1469945596426365,"This New Jersey resident is so frustrated with the mainstream media, he now calls CNN the ""Collusion News Network"" and MSNBC the ""Misinformed Speculative News Broadcasting Company""",,video,https://www.facebook.com/foxandfriends/videos/1469945596426365/,2017-07-14 08:33:08,14501,1062,6178,11587,1085,48,1751,7,23,0
111938618893743_1469796716441253,The Star-Spangled Banner plays as Presidents Trump and Macron mark Bastille Day in France,,video,https://www.facebook.com/foxandfriends/videos/1469796716441253/,2017-07-14 05:20:22,5802,242,940,5057,718,20,4,0,3,0
111938618893743_1468700993217492,Is Kid Rock running for senate? The rocker confirms the website is real!,,video,https://www.facebook.com/foxandfriends/videos/1468700993217492/,2017-07-13 06:06:56,6874,573,1558,5853,696,82,232,4,7,0
111938618893743_1467651066655818,President Trump’s lawyer Jay Sekulow claims “there’s no illegality” in Donald Trump Jr’s meeting with Russian lawyer (via Sean Hannity),,video,https://www.facebook.com/foxandfriends/videos/1467651066655818/,2017-07-12 05:27:02,4446,483,904,4102,292,6,36,1,9,0
111938618893743_1466543683433223,"Ted Cruz: It is crazy to go on an August recess without having Obamacare repealed. We should work every day, including weekends, until the job is done! (via Sean Hannity)",,video,https://www.facebook.com/foxandfriends/videos/1466543683433223/,2017-07-11 02:48:02,16107,1188,3148,15017,994,27,38,9,22,0
111938618893743_1465839690170289,U.S. veteran blinded in Omar Khadr ambush says Canada's $8 million payment to the ex-GITMO detainee is treasonous,,video,https://www.facebook.com/foxandfriends/videos/1465839690170289/,2017-07-10 10:05:48,3895,502,1267,2260,25,82,2,271,1255,0
111938618893743_1465693423518249,Draining the swamp! 526 VA employees have been fired since President Trump took office,,video,https://www.facebook.com/foxandfriends/videos/1465693423518249/,2017-07-10 07:13:35,9127,548,1970,8003,942,62,115,3,2,0
111938618893743_1462963967124528,Judge Jeanine Pirro: Everything Mayor de Blasio has done has been anti-police and anti-law enforcement,,video,https://www.facebook.com/foxandfriends/videos/1462963967124528/,2017-07-07 12:03:32,5753,629,2005,3439,47,63,3,963,1238,0
111938618893743_1462692270485031,"""They just want to break stuff; it's a way for them to vent. They don't even understand what they're protesting."" -Daniel Bongino on G20 rioters",,video,https://www.facebook.com/foxandfriends/videos/1462692270485031/,2017-07-07 07:22:06,3392,933,766,2043,24,108,63,266,888,0
111938618893743_1462600497160875,"""As the city mourns, its leader flees."" -NYPD sergeants union chief slams de Blasio for skipping NYPD swearing-in to protest G20 just one day after officer assassination",,video,https://www.facebook.com/foxandfriends/videos/1462600497160875/,2017-07-07 05:37:46,8900,2540,4086,2904,30,393,43,853,4677,0
111938618893743_1461881797232745,"Eric Trump: America is thriving, but the media remains focused on garbage and distractions.",,video,https://www.facebook.com/foxandfriends/videos/1461881797232745/,2017-07-06 12:39:06,5196,354,587,4748,332,18,19,29,50,0
111938618893743_1461590350595223,"Crowd bursts into ""USA!"" chant as President Trump and First Lady Melania attend wreath laying ceremony in Warsaw, Poland",,video,https://www.facebook.com/foxandfriends/videos/1461590350595223/,2017-07-06 07:09:04,18475,585,3586,15521,2793,124,27,2,8,0
111938618893743_1461562613931330,"""They are behaving in a very, very dangerous manner and something will have to be done about it."" -President Donald J. Trump on North Korea",,video,https://www.facebook.com/foxandfriends/videos/1461562613931330/,2017-07-06 06:34:12,1440,89,109,1286,137,8,4,2,3,0
111938618893743_1461517833935808,VP Press Secretary Marc Lotter questions14 states not complying with the voter commission: What are they trying to hide? Is this just pure partisanship?,,video,https://www.facebook.com/foxandfriends/videos/1461517833935808/,2017-07-06 05:43:08,2197,448,616,1750,24,130,12,18,263,0
111938618893743_1460643757356549,Food stamp enrollment plummets in states where recipients are forced to go to work or participate in training programs,,video,https://www.facebook.com/foxandfriends/videos/1460643757356549/,2017-07-05 08:12:00,28166,1781,13678,23897,2551,275,1405,22,15,1
111938618893743_1459465610807697,Gene Marks: Small business owners aren't concerned with President Trump's tweets. They're concerned with what he's doing for business.,,video,https://www.facebook.com/foxandfriends/videos/1459465610807697/,2017-07-04 06:10:11,3045,106,501,2811,198,7,28,0,1,0
111938618893743_1458361014251490,"This past weekend, the First Baptist Church in Dallas serenaded our Commander-In-Chief with a song based on his motto ""Make America Great Again""",,video,https://www.facebook.com/foxandfriends/videos/1458361014251490/,2017-07-03 04:37:00,5146,160,763,4407,698,30,9,0,2,0
111938618893743_1454095004678091,"""Do your job! Protect the people!"" -Jamiel Shaw, Sr. makes a plea to lawmakers to pass tougher immigration laws ten years after his son was murdered by an illegal immigrant",,video,https://www.facebook.com/foxandfriends/videos/1454095004678091/,2017-06-29 06:49:21,5248,228,1581,4456,247,19,5,493,26,2
111938618893743_1452723534815238,Voter fraud exposed! College student could spend 120 days behind bars after he admitted to submitting false voter registration forms,,video,https://www.facebook.com/foxandfriends/videos/1452723534815238/,2017-06-28 07:32:36,3671,461,1311,2684,97,304,171,31,382,2
111938618893743_1452714318149493,Charles Krauthammer: Obamacare gave out too many goodies and now able-bodied people don't want to give them back (via 'Special Report'),,video,https://www.facebook.com/foxandfriends/videos/1452714318149493/,2017-06-28 07:21:55,11988,1013,4928,11003,463,215,91,86,128,2
111938618893743_1452654094822182,Sarah Palin sues NYT for defamation after they published an editorial that falsely linked her to 2011 shooting of Rep. Giffords,,video,https://www.facebook.com/foxandfriends/videos/1452654094822182/,2017-06-28 06:29:37,10867,761,1186,9684,942,62,158,4,13,4
111938618893743_1452635348157390,House to vote on multiple immigration bills including 'Kate’s Law' and 'No Sanctuary for Criminals Act',,video,https://www.facebook.com/foxandfriends/videos/1452635348157390/,2017-06-28 06:10:00,4341,204,864,3966,362,4,4,1,3,1
111938618893743_1450483421705916,Ivanka Trump: There's an extreme emphasis on what you're against. And I'm more interested in being for something than against something.,,video,https://www.facebook.com/foxandfriends/videos/1450483421705916/,2017-06-26 06:54:53,2913,181,260,2503,377,5,22,1,5,0
111938618893743_1447392792014979,Baltimore rioters caused $13 million worth of damage in 2015 protests,,video,https://www.facebook.com/foxandfriends/videos/1447392792014979/,2017-06-23 07:07:14,3003,802,1117,748,14,393,49,145,1654,0
111938618893743_1447303098690615,Calling for help! Rep. Nancy Pelosi's aides sent Democratic allies a list of suggested tweets supporting the House Minority Leader amid calls for her to resign,,video,https://www.facebook.com/foxandfriends/videos/1447303098690615/,2017-06-23 05:15:52,2284,344,449,710,16,97,1418,17,26,0
111938618893743_1446394312114827,"Trinity College professor calls white people ""inhuman a--holes""",,video,https://www.facebook.com/foxandfriends/videos/1446394312114827/,2017-06-22 07:15:04,3932,1462,1307,1014,14,480,105,156,2161,2
111938618893743_1446374265450165,When will the violent rhetoric stop?! Threatening voicemail left for Rep. Jason Chaffetz (R-UT),,video,https://www.facebook.com/foxandfriends/videos/1446374265450165/,2017-06-22 06:42:44,3552,861,1280,880,10,598,15,248,1800,1
111938618893743_1446316925455899,Democrats devour their own - calling for Rep. Nancy Pelosi to step down after another election loss (via Fox & Friends First),,video,https://www.facebook.com/foxandfriends/videos/1446316925455899/,2017-06-22 05:15:14,9297,955,1965,6117,510,80,2575,8,6,1
111938618893743_1445570025530589,"""Was this a bureaucratic shell game?"" -Judicial Watch's Tom Fitton questions move of Rice unmasking documents from White House to Obama Presidential Library",,video,https://www.facebook.com/foxandfriends/videos/1445570025530589/,2017-06-21 09:06:41,2851,877,838,1186,16,239,13,33,1362,2
111938618893743_1445483812205877,"""The Democrats don't win by trying to make a criminal out of their president."" -Alan M. Dershowitz",,video,https://www.facebook.com/foxandfriends/videos/1445483812205877/,2017-06-21 07:15:00,6507,361,1561,6008,351,23,103,10,12,0
111938618893743_1445454108875514,Arizona court rules 'Dreamers' don't qualify for in-state tuition,,video,https://www.facebook.com/foxandfriends/videos/1445454108875514/,2017-06-21 06:35:32,10857,800,1296,9216,1138,37,449,6,11,0
111938618893743_1444609502293308,"Senator Ted Cruz: The collusion probe is a political circus. It's all reporters will talk about, but people outside of DC care about real policies.",,video,https://www.facebook.com/foxandfriends/videos/1444609502293308/,2017-06-20 08:47:55,5200,376,1182,4820,313,29,12,6,19,1
111938618893743_1444531425634449,"Man accused of beating a 17-year-old Virginia teen to death is in the U.S. illegally, ICE says",,video,https://www.facebook.com/foxandfriends/videos/1444531425634449/,2017-06-20 06:57:59,4907,592,2802,1327,9,179,24,522,2845,1
111938618893743_1444476865639905,"Senate Democrats hold late night 'talk-a-thon,' demanding Republicans hold a hearing on the health care bill",,video,https://www.facebook.com/foxandfriends/videos/1444476865639905/,2017-06-20 05:51:33,2521,2370,350,500,11,59,1176,50,724,1
111938618893743_1443719599048965,Kellyanne Conway: We're starting to waste tens of millions of taxpayer dollars on this investigation.,,video,https://www.facebook.com/foxandfriends/videos/1443719599048965/,2017-06-19 10:22:33,3457,593,648,2633,53,39,18,156,558,0
111938618893743_1443545752399683,Mueller's new hires: Some on special counsel's team have donated thousands to Democratic candidates,,video,https://www.facebook.com/foxandfriends/videos/1443545752399683/,2017-06-19 07:01:00,4702,1440,3400,1044,7,540,43,101,2966,1
111938618893743_1443498235737768,"Shakespeare in the Park's final show interrupted by President Trump supporter saying ""liberal hate kills!""",,video,https://www.facebook.com/foxandfriends/videos/1443498235737768/,2017-06-19 05:17:15,2714,372,204,2287,216,26,119,19,46,1
111938618893743_1440958779325047,"Judge Jeanine Pirro: Until Democratic leaders admit they were wrong to say President Trump is illegitimate and wrong to call for resistance, things won't change.",,video,https://www.facebook.com/foxandfriends/videos/1440958779325047/,2017-06-16 11:44:00,3557,383,789,3213,148,14,14,136,32,0
111938618893743_1439774486110143,"""There's a problem on the left, and they need to acknowledge it."" -Michelle Malkin",,video,https://www.facebook.com/foxandfriends/videos/1439774486110143/,2017-06-15 07:32:10,5274,489,1236,4877,276,56,9,20,35,1
111938618893743_1439757096111882,'Last Man Standing' may get the last laugh! CMT reportedly looking into reviving the Tim Allen sitcom,,video,https://www.facebook.com/foxandfriends/videos/1439757096111882/,2017-06-15 07:15:35,19078,986,3146,16380,2511,36,136,6,7,2
111938618893743_1439729029448022,An unpatriotic 4th of July! New Orleans tradition canceled because the party's founder doesn't like President Trump,,video,https://www.facebook.com/foxandfriends/videos/1439729029448022/,2017-06-15 06:47:52,8874,5048,3036,1089,23,710,627,1150,5272,3
111938618893743_1438691712885087,"""Without the Capitol Hill Police, it would've been a massacre."" -Rand Paul gives an eyewitness account of shooting in Alexandria",,video,https://www.facebook.com/foxandfriends/videos/1438691712885087/,2017-06-14 08:09:08,3788,750,1327,1652,20,195,4,1137,779,1
111938618893743_1437747019646223,Hundreds show up to graduation for Army reservist who was originally barred from walking in the school's ceremony because of his uniform,,video,https://www.facebook.com/foxandfriends/videos/1437747019646223/,2017-06-13 09:55:42,18709,1029,4747,15283,3244,129,18,8,24,3
111938618893743_1437663386321253,"Laura Ingraham slams report that Pres. Trump is looking to fire Mueller: This is fake news and an example of how the establishment media is agenda-driven, lazy and stupid.",,video,https://www.facebook.com/foxandfriends/videos/1437663386321253/,2017-06-13 08:27:31,3363,262,762,3010,63,45,68,13,162,2
111938618893743_1437609869659938,"Secretary Ben Carson: This Cabinet is filled with people who know how to do things. Our work is based on evidence, not on ideology.",,video,https://www.facebook.com/foxandfriends/videos/1437609869659938/,2017-06-13 07:07:34,4187,154,743,3791,370,6,16,1,1,2
111938618893743_1437568056330786,Christopher Bedford: Hypocritical for liberals to decry President Trump's rhetoric as hateful yet defend depictions of violence against him as free speech,,video,https://www.facebook.com/foxandfriends/videos/1437568056330786/,2017-06-13 06:08:34,2942,242,828,2648,80,26,17,18,153,0
111938618893743_1436865383067720,"""They're the 'artist class' and they think this is art. It's not art. It's disgusting."" -Daniel Bongino slams 'Shakespeare in the Park' depiction of Trump assassination",,video,https://www.facebook.com/foxandfriends/videos/1436865383067720/,2017-06-12 13:57:03,3063,466,691,2321,35,35,6,132,533,1
111938618893743_1436808839740041,U.S. Army Reserve Medic barred from walking at his high school graduation because he showed up in his Army uniform,,video,https://www.facebook.com/foxandfriends/videos/1436808839740041/,2017-06-12 12:58:33,4040,1075,955,695,10,144,16,535,2640,0
111938618893743_1436486403105618,"""The Democrats are guilty of obstruction of progress."" -Kellyanne Conway",,video,https://www.facebook.com/foxandfriends/videos/1436486403105618/,2017-06-12 07:37:00,4635,313,880,4259,292,14,40,10,18,2
111938618893743_1433094343444824,Accused NSA leaker Reality Winner denied bail as prosecutors reveal handwritten notes stating she wanted to join the Taliban,,video,https://www.facebook.com/foxandfriends/videos/1433094343444824/,2017-06-09 06:41:06,9221,1835,5333,5189,139,1480,375,88,1948,2
111938618893743_1433072190113706,"Bre Payton blasts James Comey, saying he's a ""spineless weasel who has a history of manipulating the media to cover his own tail.""",,video,https://www.facebook.com/foxandfriends/videos/1433072190113706/,2017-06-09 06:06:33,3984,373,726,3580,205,35,139,3,19,3
111938618893743_1432319396855652,"James Comey says he had a friend, who is a Columbia Law School professor, leak contents of memo to The New York Times",,video,https://www.facebook.com/foxandfriends/videos/1432319396855652/,2017-06-08 10:52:21,3161,1226,995,1184,16,585,84,39,1252,1
111938618893743_1432180043536254,"""I'd like to see Loretta Lynch's notes from the meeting with Bill Clinton."" -Andrew Wilkow/The Wilkow Majority shoots down concerns over Comey memos",,video,https://www.facebook.com/foxandfriends/videos/1432180043536254/,2017-06-08 08:15:37,3040,272,510,2701,124,16,181,1,16,1
111938618893743_1432054763548782,"""The senator will suspend"": Senate Intel Chair stops Sen. Kamala Harris (D-CA) from interrupting Rosenstein during questioning",,video,https://www.facebook.com/foxandfriends/videos/1432054763548782/,2017-06-08 05:21:15,2629,859,379,1809,79,59,453,8,220,1
111938618893743_1431406876946904,"“The theft of American prosperity has come to a screeching halt.”

President Trump makes a personal push for health care reform, focusing on his domestic plans for the U.S.",,video,https://www.facebook.com/foxandfriends/videos/1431406876946904/,2017-06-07 13:53:51,2395,120,175,2125,259,2,8,0,1,0
111938618893743_1431011886986403,Free lawyers for illegals? New York City to spend $26 million of taxpayer dollars on illegal immigrants facing deportation,,video,https://www.facebook.com/foxandfriends/videos/1431011886986403/,2017-06-07 07:56:52,12937,5253,9180,1967,31,1455,432,302,8750,0
111938618893743_1430032753750983,"Laura Ingraham: It’s so important that before you allow people inside your country, they want to be part of the country.",,video,https://www.facebook.com/foxandfriends/videos/1430032753750983/,2017-06-06 12:19:27,3050,214,578,2814,149,55,1,5,26,0
111938618893743_1429770073777251,Today marks the 73rd anniversary of D-Day,,video,https://www.facebook.com/foxandfriends/videos/1429770073777251/,2017-06-06 08:00:46,15009,468,11168,12278,1027,69,0,1627,8,0
111938618893743_1425163404237918,"""It was a transfer of wealth from the most powerful economy in the world to other countries.""  -Vice President Mike Pence defends withdrawal from Paris climate accord",,video,https://www.facebook.com/foxandfriends/videos/1425163404237918/,2017-06-02 08:48:09,9060,608,3229,8115,858,18,9,4,56,0
111938618893743_1425075017580090,Hillary Clinton's blame tour continues...,,video,https://www.facebook.com/foxandfriends/videos/1425075017580090/,2017-06-02 07:11:33,4902,2080,866,1235,27,96,2710,124,710,0
111938618893743_1425007800920145,"Kathy Griffin claims she's the victim of bullying by the Trump family following controversial photo

(Warning: graphic content)",,video,https://www.facebook.com/foxandfriends/videos/1425007800920145/,2017-06-02 06:00:12,13136,9540,1611,2104,54,365,7307,122,3184,0
111938618893743_1423971184357140,Just when you think they can't go lower... Jeopardy contestant Ken Jennings mocks Barron Trump over Kathy Griffin photo,,video,https://www.facebook.com/foxandfriends/videos/1423971184357140/,2017-06-01 06:10:08,4429,1387,869,1066,13,151,18,467,2714,0
111938618893743_1423919871028938,"They've been served! FBI, CIA, and NSA hit with subpoenas in effort to unmask the unmasker (via Fox & Friends First)",,video,https://www.facebook.com/foxandfriends/videos/1423919871028938/,2017-06-01 04:35:52,9959,799,3766,8537,894,118,366,5,39,0
111938618893743_1423579164396342,Stuart Varney: The Paris climate agreement is unequal.,,video,https://www.facebook.com/foxandfriends/videos/1423579164396342/,2017-05-31 17:49:55,1636,160,353,1467,46,48,10,4,61,0
111938618893743_1422127941208131,"President Trump fired this corrupt VA manager, so why is he back at work?",,video,https://www.facebook.com/foxandfriends/videos/1422127941208131/,2017-05-30 07:18:04,1880,334,505,530,14,185,0,34,1117,0
111938618893743_1422083097879282,"Stuart Varney: Americans want news that is about their everyday lives. Instead they're hearing about Russia, Russia, Russia. What's the relevance?",,video,https://www.facebook.com/foxandfriends/videos/1422083097879282/,2017-05-30 06:00:58,5888,751,1472,5335,389,11,101,15,37,0
111938618893743_1421485624605696,"""Angels sent to us by God""

President Trump honors fallen soldiers and Gold Star families in his Memorial Day address at Arlington National Cemetery",,video,https://www.facebook.com/foxandfriends/videos/1421485624605696/,2017-05-29 12:05:13,6113,192,594,5053,984,7,2,62,5,0
111938618893743_1421195951301330,Illegal and entitled! Undocumented immigrant student group at Columbia University demands free health care and guaranteed housing,,video,https://www.facebook.com/foxandfriends/videos/1421195951301330/,2017-05-29 06:32:35,13458,7926,7485,1566,23,625,3670,150,7424,0
111938618893743_1421161911304734,Sen. Tim Kaine's son charged for disrupting a pro-Trump rally,,video,https://www.facebook.com/foxandfriends/videos/1421161911304734/,2017-05-29 05:57:25,5885,1549,1432,3173,103,209,1598,79,723,0
111938618893743_1418575648230027,"""We're not hiding behind a wall."" -Department of Homeland Security Sec. John Kelly hits back at former Pres. Obama's border wall criticism",,video,https://www.facebook.com/foxandfriends/videos/1418575648230027/,2017-05-26 08:37:55,3562,1304,859,2549,171,56,69,13,704,0
111938618893743_1418522538235338,William Bennett: Isn't it ironic that President Trump got a warmer welcome in the Middle East than in Europe?,,video,https://www.facebook.com/foxandfriends/videos/1418522538235338/,2017-05-26 07:28:06,3773,324,691,3331,253,56,108,21,4,0
111938618893743_1417864834967775,Budweiser releases camouflage 'America' beer bottle ahead of Memorial Day to support our troops,,video,https://www.facebook.com/foxandfriends/videos/1417864834967775/,2017-05-25 14:16:00,8847,378,2867,7709,1040,60,14,6,18,0
111938618893743_1416756851745240,"Separation of church and state? Pete Hegseth confronts mayor who delivered 'state of the city' address in a mosque, bashing President Trump",,video,https://www.facebook.com/foxandfriends/videos/1416756851745240/,2017-05-24 06:54:00,6143,2696,2251,1855,32,479,109,138,3530,0
111938618893743_1416751308412461,Report claims NSA under Obama administration spied on Americans' private information for years,,video,https://www.facebook.com/foxandfriends/videos/1416751308412461/,2017-05-24 06:33:19,8251,1433,5982,3280,14,886,73,120,3878,0
111938618893743_1416723518415240,"Nigel Farage: How could the Manchester bomber, known to be associated with ISIS recruiters, have been allowed to leave UK to go to Syria?",,video,https://www.facebook.com/foxandfriends/videos/1416723518415240/,2017-05-24 05:52:00,1846,279,523,1264,13,65,4,109,391,0
111938618893743_1416710375083221,"Volunteers spell out ""Honoring our Heroes"" with 10,000 American flags!",,video,https://www.facebook.com/foxandfriends/videos/1416710375083221/,2017-05-24 05:18:01,7771,94,1837,6345,1286,131,5,1,3,0
