status_id,status_message,link_name,status_type,status_link,status_published,num_reactions,num_comments,num_shares,num_likes,num_loves,num_wows,num_hahas,num_sads,num_angrys,num_special
111938618893743_1533367890084135,6 Dreamers sue the Trump admin over ending the DACA program,,video,https://www.facebook.com/foxandfriends/videos/1533367890084135/,2017-09-19 08:58:26,8652,7320,1136,722,31,170,5794,78,1857,0
111938618893743_1533243140096610,“Just imagine how far you can go”: Croatian school uses Melania Trump to encourage learning how to speak English,,video,https://www.facebook.com/foxandfriends/videos/1533243140096610/,2017-09-19 05:51:39,5423,285,590,4567,774,49,18,4,11,0
111938618893743_1533206106766980,"Protesters swarm Pelosi event, calling the House Minority Leader a ""liar"" over tentative DACA deal with President Trump",,video,https://www.facebook.com/foxandfriends/videos/1533206106766980/,2017-09-19 04:46:52,5081,1582,1052,1942,243,114,2731,22,29,0
111938618893743_1532415193512738,"""God, not government..."" Nick Adams of FLAG - Foundation for Liberty and American Greatness discusses the importance of teaching kids about America's founding documents",,video,https://www.facebook.com/foxandfriends/videos/1532415193512738/,2017-09-18 08:36:41,1889,99,552,1635,249,4,1,0,0,0
111938618893743_1532350636852527,"Kellyanne Conway hits back at Emmy Awards Trump-bashing: 

""They got plucked and polished and waxed, and some of them didn't eat for 2 months, and all for what? ...You're alienating at least 63 million Americans.""",,video,https://www.facebook.com/foxandfriends/videos/1532350636852527/,2017-09-18 07:35:06,18389,2360,3611,15696,1683,40,907,23,40,0
111938618893743_1532263750194549,Chelsea Manning: I'm not an American traitor,,video,https://www.facebook.com/foxandfriends/videos/1532263750194549/,2017-09-18 06:12:37,6425,6992,944,761,22,115,1864,76,3587,0
111938618893743_1529721327115458,FBI will release more Clinton emails as new “pay-to-play” at Clinton State Department exposed,,video,https://www.facebook.com/foxandfriends/videos/1529721327115458/,2017-09-15 07:16:12,3909,1021,2538,2290,124,282,374,20,819,0
111938618893743_1529674467120144,Harvard rescinds Chelsea Manning's fellowship,,video,https://www.facebook.com/foxandfriends/videos/1529674467120144/,2017-09-15 06:25:01,3512,1346,556,2026,372,34,1007,8,65,0
111938618893743_1529673597120231,"“I look at my fellow millennials, those on college campuses right now and I see them actively protesting for fewer rights” - Tomi Lahren",,video,https://www.facebook.com/foxandfriends/videos/1529673597120231/,2017-09-15 06:14:08,382,106,137,231,14,26,11,38,62,0
111938618893743_1528943460526578,"David A. Clarke, Jr.  did not hold back on his statement about 'Antifa goons': ""Once they bring the violence, they need their a** kicked""",,video,https://www.facebook.com/foxandfriends/videos/1528943460526578/,2017-09-14 10:40:54,7689,469,2989,6693,858,25,73,13,27,0
111938618893743_1528194223934835,"Jason Whitlock on Jemele Hill’s tweets on Trump: “Attacking the President is a way to get re-tweeted, and liked, and build your following""",,video,https://www.facebook.com/foxandfriends/videos/1528194223934835/,2017-09-13 14:01:03,1148,734,137,306,8,37,22,78,697,0
111938618893743_1528068067280784,“Christian compassion is not the only consideration in the immigration problem. The Bible says God has ordained government to protect its citizens.” -Dr. Robert Jeffress,,video,https://www.facebook.com/foxandfriends/videos/1528068067280784/,2017-09-13 11:43:19,1726,181,501,1525,174,7,8,1,11,0
111938618893743_1527789360641988,Clay Travis had an interesting take on Jemele Hill getting a wrist slap from ESPN after she called President Trump a ‘white supremacist’ (via Tucker Carlson Tonight),,video,https://www.facebook.com/foxandfriends/videos/1527789360641988/,2017-09-13 05:42:34,1664,421,483,1415,91,78,23,8,49,0
111938618893743_1526858434068414,Judge orders investigation into Clinton lawyers accused of deleting emails,,video,https://www.facebook.com/foxandfriends/videos/1526858434068414/,2017-09-12 06:49:00,7560,559,2541,6517,720,53,257,2,11,0
111938618893743_1526805660740358,Hillary Clinton’s new book “What Happened” comes out today -- and retailers are already dropping prices,,video,https://www.facebook.com/foxandfriends/videos/1526805660740358/,2017-09-12 05:28:47,6576,3039,1296,1473,40,60,4710,27,266,0
111938618893743_1526103517477239,"""Where they left a mark with fire and rubble, Americans defiantly raised the Stars and Stripes."" -President Donald J. Trump",,video,https://www.facebook.com/foxandfriends/videos/1526103517477239/,2017-09-11 09:49:49,6319,215,898,5220,1039,2,1,53,4,0
111938618893743_1523358737751717,Voters voice their opinion in Speaker Ryan’s district | Todd Piro,,video,https://www.facebook.com/foxandfriends/videos/1523358737751717/,2017-09-08 06:21:39,324,114,79,286,4,15,12,0,7,0
111938618893743_1523344494419808,"Data breach could potentially affect 143 million US consumers, Equifax claims",,video,https://www.facebook.com/foxandfriends/videos/1523344494419808/,2017-09-08 05:59:06,554,163,354,103,1,86,6,9,349,0
111938618893743_1523318334422424,"Fox News Alert: Mass evacuations underway in Florida, Governor warns citizens ‘We can’t save you’",,video,https://www.facebook.com/foxandfriends/videos/1523318334422424/,2017-09-08 05:08:31,657,105,335,388,3,91,0,175,0,0
111938618893743_1522613714492886,Polk County Sheriff's Office: Sex offenders and those with warrants are not welcome at Hurricane Irma shelters,,video,https://www.facebook.com/foxandfriends/videos/1522613714492886/,2017-09-07 09:40:15,4610,405,1080,3958,474,95,61,2,20,0
111938618893743_1522532327834358,"A school in Minnesota tried to ban students from flying flags, but patriotic teens fought back and won!",,video,https://www.facebook.com/foxandfriends/videos/1522532327834358/,2017-09-07 07:54:33,32028,1406,14975,26861,4825,100,201,6,35,0
111938618893743_1522491344505123,A victory in the fight for faith as federal court upholds right for county in Michigan to pray before public meetings,,video,https://www.facebook.com/foxandfriends/videos/1522491344505123/,2017-09-07 07:20:00,10540,438,2031,9020,1485,20,3,4,8,0
111938618893743_1521889387898652,"Sen. Menendez corruption trial begins today, but many of the media outlets covering the story fail to mention he's a Democrat",,video,https://www.facebook.com/foxandfriends/videos/1521889387898652/,2017-09-06 13:31:38,2524,448,1549,1741,42,177,426,24,114,0
111938618893743_1521658384588419,"Corey Lewandowski: Left's attacks on White House after DACA decision are ""very disturbing""",,video,https://www.facebook.com/foxandfriends/videos/1521658384588419/,2017-09-06 08:13:30,1131,221,202,951,41,17,4,12,106,0
111938618893743_1521633544590903,"""It's not about doing what's popular. It's about doing what's right. But the right thing is doing it through legislative action."" -Mike Huckabee on DACA",,video,https://www.facebook.com/foxandfriends/videos/1521633544590903/,2017-09-06 07:34:38,4792,290,1269,4463,311,10,6,0,2,0
111938618893743_1520756304678627,“We don’t rule by emotion. We rule by law.” -Laura Ingraham on DACA,,video,https://www.facebook.com/foxandfriends/videos/1520756304678627/,2017-09-05 07:50:38,6100,534,1393,5523,510,16,31,4,16,0
111938618893743_1520699021351022,"Judge Andrew Napolitano: Every president since Reagan has said hands off Dreamers. But Obama put it in writing with DACA, and that can be invalidated.",,video,https://www.facebook.com/foxandfriends/videos/1520699021351022/,2017-09-05 06:43:27,1628,363,479,1433,111,19,15,6,44,0
111938618893743_1520683698019221,Be on time or pay a fine! School issues new policy charging tardy students,,video,https://www.facebook.com/foxandfriends/videos/1520683698019221/,2017-09-05 06:29:10,1130,406,147,840,39,87,100,8,56,0
111938618893743_1520093871411537,"Chad Prather warns looters to think twice about targeting Harvey survivors: ""You don't mess with these folks. Everything is bigger in Texas, and that includes your guns!""",,video,https://www.facebook.com/foxandfriends/videos/1520093871411537/,2017-09-04 14:22:00,15039,427,10118,12413,2133,13,476,3,1,0
111938618893743_1520083678079223,"Cleveland police, EMS union presidents speak out after players protest Star-Spangled Banner:

""We stand for the national anthem, we put our hands over our hearts, and we respect this great nation of ours.""",,video,https://www.facebook.com/foxandfriends/videos/1520083678079223/,2017-09-04 12:43:55,6885,759,1329,5974,804,21,54,9,23,0
111938618893743_1519860768101514,Today we bid farewell to our FOX 'Friend' Clayton Morris. We will miss you! #betterwithfriends,,video,https://www.facebook.com/foxandfriends/videos/1519860768101514/,2017-09-04 07:58:26,6936,1698,378,3443,302,109,26,3040,16,0
111938618893743_1519763831444541,"Texas homeowners hit by Harvey warn “if you loot, we shoot” (via Griff Jenkins)",,video,https://www.facebook.com/foxandfriends/videos/1519763831444541/,2017-09-04 06:11:19,23487,861,11602,21115,1957,84,295,25,11,0
111938618893743_1519729488114642,"Secretary Mattis: We are not looking to annihilate another country, namely North Korea. But we have many options to do so.",,video,https://www.facebook.com/foxandfriends/videos/1519729488114642/,2017-09-04 05:09:23,2263,141,599,1996,218,33,12,2,2,0
111938618893743_1517412018346389,President Trump declares Sunday a national ‘day of prayer’ for Harvey victims,,video,https://www.facebook.com/foxandfriends/videos/1517412018346389/,2017-09-01 12:44:11,16987,688,4966,14094,2818,13,43,9,10,0
111938618893743_1516102628477328,Politico under fire for cartoon mocking Harvey victims' belief in limited government,,video,https://www.facebook.com/foxandfriends/videos/1516102628477328/,2017-08-31 05:35:10,1123,424,151,213,5,57,13,124,711,0
111938618893743_1515266025227655,"First Lady Melania Trump's office fires back at critics: 

""It's sad that we have an active and ongoing natural disaster in Texas, and people are worried about her shoes.""",,video,https://www.facebook.com/foxandfriends/videos/1515266025227655/,2017-08-30 09:37:28,8319,1382,1907,6530,160,131,163,659,676,0
111938618893743_1515126208574970,Univ. of Tampa fires professor who suggested Texas deserves Harvey for voting for GOP,,video,https://www.facebook.com/foxandfriends/videos/1515126208574970/,2017-08-30 06:27:17,8456,1291,1170,6531,695,86,953,32,159,0
111938618893743_1515064618581129,Laura Ingraham: You know Pres. Trump is doing a good job when the best attack the left can come up with is Melania's shoes (via Sean Hannity),,video,https://www.facebook.com/foxandfriends/videos/1515064618581129/,2017-08-30 04:53:54,22172,1071,5469,17819,1479,52,2772,31,19,0
111938618893743_1513163925437865,Busted crossing the border! At least 30 illegal immigrants found in smuggling tunnel,,video,https://www.facebook.com/foxandfriends/videos/1513163925437865/,2017-08-28 07:09:08,3413,476,1090,2228,65,452,60,18,590,0
111938618893743_1513106382110286,Houston Mayor Sylvester Turner defends his decision to not evacuate the city before Harvey hit,,video,https://www.facebook.com/foxandfriends/videos/1513106382110286/,2017-08-28 05:50:07,1104,897,273,495,8,128,17,84,372,0
111938618893743_1509708045783453,Daniel Bongino: President Trump is not to blame for Secret Service’s strained budget. This is a garbage story from the media. The problem's been going on for years.,,video,https://www.facebook.com/foxandfriends/videos/1509708045783453/,2017-08-24 10:42:59,5223,429,2500,4767,229,67,100,20,40,0
111938618893743_1509540449133546,This is what patriotism looks like! 2 young boys brave the rain to take down and fold an American flag,,video,https://www.facebook.com/foxandfriends/videos/1509540449133546/,2017-08-24 08:14:06,12849,429,3848,10411,2371,58,5,1,3,0
111938618893743_1509511259136465,"“I’m not sure we’re prepared for the consequences of eliminating God out of every single thing we do today.” 

Lawrence Billy Jones III speaks out after court rules high school football coach’s on-field prayer not protected by the Constitution",,video,https://www.facebook.com/foxandfriends/videos/1509511259136465/,2017-08-24 07:50:23,4225,839,1830,2219,112,78,2,782,1032,0
111938618893743_1509445475809710,"Jonathan Allen: Hillary Clinton prepared for Trump to be in her space during the debate. It wasn't unexpected, as she portrays in her book.",,video,https://www.facebook.com/foxandfriends/videos/1509445475809710/,2017-08-24 07:01:26,4480,3870,860,1763,18,94,2147,37,421,0
111938618893743_1509385149149076,No room for God on the gridiron? Court rules high school football coach’s on-field prayer is not protected by the Constitution (via Fox & Friends First),,video,https://www.facebook.com/foxandfriends/videos/1509385149149076/,2017-08-24 05:56:36,6320,2087,2547,879,19,219,16,1303,3884,0
111938618893743_1509341599153431,"""We are one people with one home and one great flag."" -President Donald J. Trump",,video,https://www.facebook.com/foxandfriends/videos/1509341599153431/,2017-08-24 05:10:52,4013,225,379,3448,544,6,6,2,7,0
111938618893743_1509312145823043,"More than a thousand protesters rally outside NFL headquarters, demanding Colin Kaepernick gets signed (via Fox & Friends First)",,video,https://www.facebook.com/foxandfriends/videos/1509312145823043/,2017-08-24 04:47:08,24668,22530,5540,6381,404,352,11730,308,5493,0
111938618893743_1508703605883897,Lt. Col. Tony Schaffer slams former DNI James Clapper for questioning Pres. Trump 'fitness for office',,video,https://www.facebook.com/foxandfriends/videos/1508703605883897/,2017-08-23 10:43:40,3021,658,846,2504,230,40,155,6,86,0
111938618893743_1508466945907563,"""He'll never be the same"": Mother of 6-year-old critically injured in crash linked to illegal immigrant gives emotional testimony in court",,video,https://www.facebook.com/foxandfriends/videos/1508466945907563/,2017-08-23 06:32:00,2357,251,855,490,10,18,0,1214,625,0
111938618893743_1508460269241564,David Webb: These leftist protesters show up but never offer solutions,,video,https://www.facebook.com/foxandfriends/videos/1508460269241564/,2017-08-23 06:10:48,2224,302,450,2015,111,12,7,14,65,0
111938618893743_1507764615977796,"Dakota Meyer: If Pres. Trump is going to send more troops to Afghanistan, he has to let them do their jobs, stay focused on killing terrorists, & not worry about politics. I lost my whole team due to politics.",,video,https://www.facebook.com/foxandfriends/videos/1507764615977796/,2017-08-22 10:11:48,5944,435,1071,4973,237,50,4,650,30,0
111938618893743_1506880372732887,“We had a president not too long ago who refused to call radical Islamic terrorism by its name. And I’m glad we finally have a leader who calls evil what it is.” -Liberty University Pres. Jerry Falwell Jr.,,video,https://www.facebook.com/foxandfriends/videos/1506880372732887/,2017-08-21 10:17:29,8706,388,1660,7951,714,8,11,5,17,0
111938618893743_1504129939674597,"Nigel Farage: In wake of Barcelona terror attack, I can't believe Americans see historical statues as the enemy when it's clear Islamic terrorism is",,video,https://www.facebook.com/foxandfriends/videos/1504129939674597/,2017-08-18 04:59:52,5957,452,1979,5464,222,34,9,195,33,0
111938618893743_1503479469739644,Steve Cortes: It’s shortsighted for CEOs to quit President Trump's manufacturing council,,video,https://www.facebook.com/foxandfriends/videos/1503479469739644/,2017-08-17 09:49:14,1740,449,356,1515,99,12,26,59,29,0
111938618893743_1503335816420676,Major victory for the U.S. in the effort to bring accused Benghazi attack ringleader to justice,,video,https://www.facebook.com/foxandfriends/videos/1503335816420676/,2017-08-17 07:02:58,1502,150,220,1376,92,8,5,3,18,0
111938618893743_1503276673093257,Gov. Terry McAuliffe (D) calls for removal of all Confederate statues in Virginia,,video,https://www.facebook.com/foxandfriends/videos/1503276673093257/,2017-08-17 05:23:23,4865,3807,534,453,28,112,58,507,3707,0
111938618893743_1501683493252575,Stuart Varney: Merck CEO Kenneth Frazier is putting his own political views ahead of business and his role on Pres. Trump's manufacturing council,,video,https://www.facebook.com/foxandfriends/videos/1501683493252575/,2017-08-15 12:36:00,1163,415,126,789,20,32,35,69,218,0
111938618893743_1501432773277647,"Corey Lewandowski: When people decide to rip down statues or destroy property, it’s vandalism. It’s not demonstrating free speech.",,video,https://www.facebook.com/foxandfriends/videos/1501432773277647/,2017-08-15 07:15:25,12817,1511,4853,11171,464,74,27,123,958,0
111938618893743_1501331823287742,Sgts. Allen Stigler Jr. and Roshain Brooks of the 82nd Airborne Division were killed in Iraq this weekend. Our thoughts and prayers go out to their loved ones.,,video,https://www.facebook.com/foxandfriends/videos/1501331823287742/,2017-08-15 04:46:01,7983,784,2859,2593,257,13,3,5093,24,0
111938618893743_1500530116701246,Shocking video shows the moment Officer Quincy Smith was shot at point-blank range. Today he opens up about the terrifying attack.,,video,https://www.facebook.com/foxandfriends/videos/1500530116701246/,2017-08-14 07:14:27,992,148,262,491,31,56,1,279,134,0
111938618893743_1497898400297751,Vietnam veterans take honor flight and finally see a long-deserved welcome home,,video,https://www.facebook.com/foxandfriends/videos/1497898400297751/,2017-08-11 10:04:42,7486,353,3280,5965,1430,20,4,66,1,0
111938618893743_1497739833646941,“Tell my family I love them!”: Horrifying video of the moment a South Carolina cop is shot at point blank range,,video,https://www.facebook.com/foxandfriends/videos/1497739833646941/,2017-08-11 06:32:27,6744,1316,3218,1811,72,397,19,2593,1852,0
111938618893743_1496967063724218,"After backlash, Southern Methodist University lets 9/11 memorial return to traditional spot",,video,https://www.facebook.com/foxandfriends/videos/1496967063724218/,2017-08-10 09:11:48,3288,198,435,2898,347,29,10,2,2,0
111938618893743_1496914573729467,"Johnny Joey Jones slams gym owner for banning cops and military personnel who “believe their life is worth giving up for the people around them""",,video,https://www.facebook.com/foxandfriends/videos/1496914573729467/,2017-08-10 07:50:32,1475,501,315,836,27,95,21,46,450,0
111938618893743_1496115033809421,Don't mess with Texas! Video shows employees fighting off armed robbers,,video,https://www.facebook.com/foxandfriends/videos/1496115033809421/,2017-08-09 08:09:36,1539,119,276,1280,133,42,82,0,2,0
111938618893743_1495155897238668,"1,641st victim of 9/11 attack identified nearly 16 years after the tragic day",,video,https://www.facebook.com/foxandfriends/videos/1495155897238668/,2017-08-08 05:43:40,1041,68,309,339,14,85,1,595,7,0
111938618893743_1494343757319882,FOX NEWS ALERT: Officials name person of interest in Missouri cop shooting,,video,https://www.facebook.com/foxandfriends/videos/1494343757319882/,2017-08-07 08:42:14,510,64,264,189,1,11,0,81,228,0
111938618893743_1494236900663901,FOX NEWS ALERT: President Trump answers urgent phone call from South Korean President on North Korean threat,,video,https://www.facebook.com/foxandfriends/videos/1494236900663901/,2017-08-07 06:02:10,1015,127,159,903,61,41,6,2,2,0
111938618893743_1491475410940050,"U.S. added 209k jobs in July, unemployment rate down to 4.3% according to U.S. Bureau of Labor Statistics",,video,https://www.facebook.com/foxandfriends/videos/1491475410940050/,2017-08-04 07:57:22,13581,724,6532,12091,1219,231,38,1,1,0
111938618893743_1491441037610154,“Leaking the phone calls between our president and other heads of state is nothing short of a national disgrace.” -Kellyanne Conway,,video,https://www.facebook.com/foxandfriends/videos/1491441037610154/,2017-08-04 07:23:25,3928,778,652,3023,61,44,19,136,645,0
111938618893743_1491421434278781,Your thoughts on Mueller potentially pursuing financial crimes ‘unrelated’ to the election?,,video,https://www.facebook.com/foxandfriends/videos/1491421434278781/,2017-08-04 07:04:51,5184,4723,750,1152,39,173,94,92,3634,0
111938618893743_1491367780950813,"""I believe that I did the right thing, and I would do it again.""

Debbie Wasserman Schultz defends her decision to keep IT aide on payroll",,video,https://www.facebook.com/foxandfriends/videos/1491367780950813/,2017-08-04 06:12:00,4097,2824,863,600,5,323,788,76,2305,0
111938618893743_1491364410951150,DOJ threatens to cut funding to 4 sanctuary cities,,video,https://www.facebook.com/foxandfriends/videos/1491364410951150/,2017-08-04 05:49:30,9943,1581,1117,8635,1182,12,94,3,17,0
111938618893743_1490696291017962,Gianno Caldwell: For Al Gore to compare civil rights to climate change shows the Dem Party isn’t ready to offer real policy solutions,,video,https://www.facebook.com/foxandfriends/videos/1490696291017962/,2017-08-03 13:44:00,1347,258,355,943,23,58,271,19,33,0
111938618893743_1490477821039809,"Ivanka Trump meets with military spouses, calling them ""our non-uniformed heroes""",,video,https://www.facebook.com/foxandfriends/videos/1490477821039809/,2017-08-03 06:41:11,2819,119,319,2472,336,8,1,0,2,0
111938618893743_1489533017800956,"""I got chipped!""  Wisconsin company throws a party to implant microchips in employees’ hands",,video,https://www.facebook.com/foxandfriends/videos/1489533017800956/,2017-08-02 06:42:11,20653,15684,119108,4187,97,3942,696,2370,9361,0
111938618893743_1489488994472025,“America is on the verge of a golden age for small business.” -President Donald J. Trump,,video,https://www.facebook.com/foxandfriends/videos/1489488994472025/,2017-08-02 05:34:22,3119,148,321,2766,338,2,10,1,2,0
111938618893743_1489452311142360,DOJ reportedly will take on affirmative action at universities (via Fox & Friends First),,video,https://www.facebook.com/foxandfriends/videos/1489452311142360/,2017-08-02 04:58:00,953,120,101,826,100,16,6,2,3,0
111938618893743_1488766611210930,"""The reason why there's nothing new in the Republican healthcare bill is because it's the swamp & they're part of the swamp."" -Eric Bolling",,video,https://www.facebook.com/foxandfriends/videos/1488766611210930/,2017-08-01 11:21:00,3188,325,561,2954,162,15,20,12,25,0
111938618893743_1488737041213887,Eric Bolling: Don't thank President Obama for the record highs in the markets. Thank President Trump.,,video,https://www.facebook.com/foxandfriends/videos/1488737041213887/,2017-08-01 10:26:46,5180,292,805,4691,440,3,38,0,8,0
111938618893743_1488614441226147,“President Trump should take our subsidies away from us as members of Congress if we don’t deliver [on health care].” -Sen. Lindsey Graham,,video,https://www.facebook.com/foxandfriends/videos/1488614441226147/,2017-08-01 08:02:03,8469,1043,1792,7660,643,87,34,4,41,0
111938618893743_1488601664560758,Calling it like they see it! DOJ is now officially using the term 'illegal alien',,video,https://www.facebook.com/foxandfriends/videos/1488601664560758/,2017-08-01 07:44:20,5527,618,1544,4825,466,23,125,12,76,0
111938618893743_1488585374562387,Rep. Marsha Blackburn: The Republican Party hasn't lost its way. Congress has. People are tired of talk and want to see action.,,video,https://www.facebook.com/foxandfriends/videos/1488585374562387/,2017-08-01 07:23:51,2907,323,484,2692,169,11,21,7,7,0
111938618893743_1487670651320526,"Mike Huckabee fires back at Dem lawmaker who slammed General John Kelly as an 'extremist' who will 'militarize' the White House: 

“To somehow blame those incredible qualities of the military, I think, is disrespectful to every single person in uniform.""",,video,https://www.facebook.com/foxandfriends/videos/1487670651320526/,2017-07-31 07:59:12,3970,604,941,3308,324,49,59,18,212,0
111938618893743_1487566487997609,Should health care subsidies be taken away for members of Congress?,,video,https://www.facebook.com/foxandfriends/videos/1487566487997609/,2017-07-31 05:17:39,13175,3367,2638,11838,1177,24,110,0,26,0
111938618893743_1484769188277339,Family of slain ICE agent Jaime Zapata will finally see justice 6 years after his death,,video,https://www.facebook.com/foxandfriends/videos/1484769188277339/,2017-07-28 05:47:21,1603,76,208,1367,78,8,3,142,5,0
111938618893743_1484691284951796,Ted Cruz: Many Americans will feel betrayed by politicians who promised to repeal Obamacare but failed to deliver,,video,https://www.facebook.com/foxandfriends/videos/1484691284951796/,2017-07-28 03:55:20,14616,2702,4944,12583,188,48,58,533,1206,0
111938618893743_1483773828376875,"Hillary Clinton to detail her election loss in new book called ""What Happened""",,video,https://www.facebook.com/foxandfriends/videos/1483773828376875/,2017-07-27 07:34:01,5434,4292,930,893,35,57,4046,30,373,0
111938618893743_1483689071718684,"Trudeau, eh? Rolling Stone wants to know why Canadian PM can’t be our president",,video,https://www.facebook.com/foxandfriends/videos/1483689071718684/,2017-07-27 05:51:50,3347,3187,327,496,30,82,1672,41,1026,0
111938618893743_1482919718462286,Eric Trump: They pile-on my dad with nonsense Russia investigations and then you see the crimes others get away with. It's disheartening.,,video,https://www.facebook.com/foxandfriends/videos/1482919718462286/,2017-07-26 10:45:40,7160,726,1928,6448,414,42,25,65,166,0
111938618893743_1482708601816731,"President Trump took his message ‘straight to the American people’ at a rally in Youngstown, OH last night",,video,https://www.facebook.com/foxandfriends/videos/1482708601816731/,2017-07-26 06:46:07,2300,162,166,1969,313,2,10,1,5,0
111938618893743_1482650508489207,President Trump takes on protester: “He’s going back home to mommy”,,video,https://www.facebook.com/foxandfriends/videos/1482650508489207/,2017-07-26 05:15:07,6052,442,653,3852,544,7,1625,6,18,0
