status_id,status_message,link_name,status_type,status_link,status_published,num_reactions,num_comments,num_shares,num_likes,num_loves,num_wows,num_hahas,num_sads,num_angrys,num_special
131459315949_10154732927190950,HAPPENING NOW: Jury begins deliberations in Bill Cosby trial http://cbsn.ws/1PfaNT5,Jury begins deliberations in Bill Cosby trial,video,https://www.facebook.com/CBSNews/videos/10154732927190950/,2017-06-12 17:05:41,122,93,21,89,6,13,5,5,1,3
131459315949_10154732807105950,"""I think one of the folks behind me has a really good chance of standing where I am today, as a future president,"" President Donald J. Trump says to NCAA champs Clemson Football: http://cbsn.ws/2rjq27L",NCAA football champs Clemson Tigers visit the White House,video,https://www.facebook.com/CBSNews/videos/10154732807105950/,2017-06-12 16:05:41,398,145,30,221,42,5,96,3,30,1
131459315949_10154732277580950,Press Secretary Sean Spicer holds White House press briefing ahead of Attorney General Jeff Sessions' testimony before the Senate Intel Committee on Tuesday: http://cbsn.ws/2ro2x8K,Sean Spicer holds White House press briefing,video,https://www.facebook.com/CBSNews/videos/10154732277580950/,2017-06-12 12:39:39,557,1032,95,217,57,16,37,9,214,7
131459315949_10154729766990950,"What is brain hacking? Tech insiders on why you should care, tonight on 60 Minutes:
http://cbsn.ws/2reT6xo",Brain Hack 60 Minutes,video,https://www.facebook.com/CBSNews/videos/10154729766990950/,2017-06-11 16:00:26,139,50,82,105,1,19,5,6,2,1
131459315949_10154729392165950,"Adam West, the actor known for his role in the 1960s ""Batman"" series, and more recently, ""Family Guy,"" has died. He was 88. http://cbsn.ws/2s0geNa",Adam West dies at age 88,video,https://www.facebook.com/CBSNews/videos/10154729392165950/,2017-06-11 13:41:09,843,38,134,431,53,7,0,351,0,1
131459315949_10154726494370950,"The U.S. Navy commissioned a warship named for former Rep. Gabrielle Giffords, who was wounded in a 2011 shooting, during a ceremony in Texas.  http://cbsn.ws/2rXImAA",Gabrielle Giffords speaks at U.S. Navy ship commissioning,video,https://www.facebook.com/CBSNews/videos/10154726494370950/,2017-06-10 15:15:57,3124,253,366,2375,652,19,9,4,19,46
131459315949_10154726060275950,Hillary Clinton delivers remarks at the commissioning of the USS Gabrielle Giffords: http://cbsn.ws/2k2WwLh,Hillary Clinton delivers remarks at the commissioning of the U...,video,https://www.facebook.com/CBSNews/videos/10154726060275950/,2017-06-10 12:53:49,3947,3112,606,2197,1231,28,64,15,362,50
131459315949_10154723178665950,"Prime Minister May's Conservative Party won more seats than any other, by significant margin -- but not enough to claim a real victory. What does that mean?http://cbsn.ws/2r9ZcPL",5 things you need to know about U.K. election,video,https://www.facebook.com/CBSNews/videos/10154723178665950/,2017-06-09 15:50:40,83,50,13,56,1,6,17,1,2,0
131459315949_10154722994170950,"Reporters: ""Are there tapes?""
President Donald J. Trump: ""Oh, you're going to be very disappointed when you hear the answer."" http://cbsn.ws/2ra8T0s",Trump responds to tape questions,video,https://www.facebook.com/CBSNews/videos/10154722994170950/,2017-06-09 15:02:24,1044,828,151,321,29,36,414,15,225,4
131459315949_10154722024160950,Pressure mounted on British Prime Minister Theresa May to resign after the Conservative Party lost the majority in Parliament. She will instead seek to form a coalition government with a much smaller party from Northern Ireland: http://cbsn.ws/2r9ksVK,British PM May says she will form new government,video,https://www.facebook.com/CBSNews/videos/10154722024160950/,2017-06-09 08:55:56,133,45,31,79,3,16,26,1,8,0
131459315949_10154720528920950,"The internet was very confused by Sen. John McCain's line of questioning during James Comey's testimony, eliciting some ¯\_(ツ)_/¯",What was going on with McCain during Comey's hearing?,video,https://www.facebook.com/CBSNews/videos/10154720528920950/,2017-06-08 18:00:44,2070,1131,686,799,20,301,777,110,61,2
131459315949_10154720019755950,"""The president's new at this. He's new to government,"" says Speaker Paul Ryan while commenting on James Comey's testimony, which, he says explains President Trump's frustrations: http://cbsn.ws/2rR1foJ","President Trump is ""new at this,"" Ryan says",video,https://www.facebook.com/CBSNews/videos/10154720019755950/,2017-06-08 15:15:43,3658,2398,749,906,48,95,1325,59,1221,4
131459315949_10154719986965950,Questions around the Russia investigation swirled during Comey testimony; here are 4 moments that stood out http://cbsn.ws/2r6BqE9,Top 4 moments the Russia investigation was mentioned,video,https://www.facebook.com/CBSNews/videos/10154719986965950/,2017-06-08 15:00:43,404,228,129,324,18,32,23,0,7,0
131459315949_10154719760900950,President Trump's lawyer speaks after former FBI Director James Comey's testimony before the Senate Intel Committee,Trump's lawyer speaks after Comey's testimony,video,https://www.facebook.com/CBSNews/videos/10154719760900950/,2017-06-08 13:29:51,1378,1248,188,387,101,27,271,19,573,0
131459315949_10154719675185950,"“We’re under siege,"" President Donald J. Trump says at a conference amid James Comey's testimony before the Senate Intel Committee cbsn.ws/2rQNZRa",Trump: We’re under siege,video,https://www.facebook.com/CBSNews/videos/10154719675185950/,2017-06-08 12:51:15,3928,1750,924,1345,226,52,1390,50,865,0
131459315949_10154719386490950,"""The administration then chose to defame me, and, more importantly, the FBI,"" says former FBI Director James Comey of his firing: http://cbsn.ws/2rEqYCo",James Comey on being defamed,video,https://www.facebook.com/CBSNews/videos/10154719386490950/,2017-06-08 11:11:39,769,202,117,596,93,18,42,7,13,0
131459315949_10154719350285950,"Sen. Diane Feinstein: ""Why do you believe you were fired?"" 
James Comey: ""I take the president at his word that I was fired because of the Russia investigation"" http://cbsn.ws/2rQbRo1","Sen. Feinstein: ""Why do you believe you were fired?""",video,https://www.facebook.com/CBSNews/videos/10154719350285950/,2017-06-08 10:59:12,386,138,64,298,21,28,33,2,4,0
131459315949_10154719310345950,"""Do you know of any case where a person has been charged for obstruction of justice...where they said or thought they hoped for an outcome?"" Senator James Risch asks James Comey http://cbsn.ws/2rQruM0",Sen. Risch questions James Comey,video,https://www.facebook.com/CBSNews/videos/10154719310345950/,2017-06-08 10:47:02,338,232,86,232,8,24,58,1,15,0
131459315949_10154719278790950,"""I was honestly concerned that [President Trump] might lie about the nature of our meeting,"" says James Comey when asked why he decided to start documenting his conversations with the president: http://cbsn.ws/2rQfLwQ",Comey explains why he started documenting convos with Trump,video,https://www.facebook.com/CBSNews/videos/10154719278790950/,2017-06-08 10:35:55,389,167,78,287,23,32,33,2,12,0
131459315949_10154719073910950,Former FBI Director James Comey testifies before the Senate Intelligence Committee as part of the ongoing investigation into Russia's alleged interference in the 2016 elections: cbsn.ws/2rPrEDo,James Comey testifies before Senate Intel Committee,video,https://www.facebook.com/CBSNews/videos/10154719073910950/,2017-06-08 09:36:04,1393,3149,586,950,269,62,45,13,54,0
131459315949_10154719014130950,"Former U.S. Attorney Preet Bharara, who was also fired by President Donald J. Trump, has a seat at FBI Director James Comey’s hearing — and people on Twitter definitely noticed: http://cbsn.ws/2rPGdqM",Preet Bharara attends James Comey testimony,video,https://www.facebook.com/CBSNews/videos/10154719014130950/,2017-06-08 09:22:17,723,121,132,554,88,13,51,5,12,0
131459315949_10154718922305950,Former FBI Director James Comey testifies before the Senate Intelligence Committee as part of the ongoing investigation into Russia's alleged interference in the 2016 elections: cbsn.ws/2rPrEDo,James Comey testifies before Senate Intel Committee,video,https://www.facebook.com/CBSNews/videos/10154718922305950/,2017-06-08 09:03:17,506,518,305,416,51,13,13,4,9,0
131459315949_10154718873745950,"Former FBI Director James Comey leaves his home, heads to Capitol Hill to testify before the Senate Intelligence Committee. It marks the first time Comey will speak in public since his firing: http://cbsn.ws/2rQb5aA",Former FBI Director Comey leaves his Virginia home,video,https://www.facebook.com/CBSNews/videos/10154718873745950/,2017-06-08 08:47:09,266,97,37,207,32,7,19,0,1,0
131459315949_10154718870515950,"The Senate Intelligence Committee released James Comey's prepared testimony on Wednesday, ahead of Thursday's highly anticipated hearing. What we can expect to hear from the fired FBI director as he faces questioning? http://cbsn.ws/2rPwJeY",Former FBI James Comey's prepared testimony,photo,https://www.facebook.com/CBSNews/photos/a.10154718869450950.1073741835.131459315949/10154718869475950/?type=3,2017-06-08 08:45:19,33,12,16,29,2,1,0,1,0,0
131459315949_10154718824445950,Former FBI Director James Comey is set to testify at 10 a.m. ET about memos he wrote detailing private conversations with President Donald J. Trump http://cbsn.ws/2r5eWTL,What was in Comey's memos?,video,https://www.facebook.com/CBSNews/videos/10154718824445950/,2017-06-08 08:30:48,175,101,28,136,19,3,15,0,2,0
131459315949_10154718795945950,"From praising former FBI Director James Comey for investigating Hillary Clinton's email server to firing him for ""not doing a good job"" — how President Trump's perception of Comey changed over the past year and a half: http://cbsn.ws/2r5GNTO",How President Trump's perception of Comey changed over time,video,https://www.facebook.com/CBSNews/videos/10154718795945950/,2017-06-08 08:21:01,92,81,14,42,1,4,26,7,12,0
131459315949_10154718743055950,Former FBI Director James Comey set to testify before the Senate Intel Committee: http://cbsn.ws/2rEqYCo,SPECIAL REPORT: Former FBI Director James Comey set to testify,video,https://www.facebook.com/CBSNews/videos/10154718743055950/,2017-06-08 08:04:00,579,883,262,439,74,12,16,9,29,0
131459315949_10154717248025950,"TOMORROW: CBS News Special Report to air live coverage of James Comey's testimony, beginning at 10 a.m. ET. http://cbsn.ws/2rZKP0o",How to watch Thursday's Comey hearing,video,https://www.facebook.com/CBSNews/videos/10154717248025950/,2017-06-07 18:26:57,248,217,45,182,26,9,26,2,3,0
131459315949_10154717190965950,Here are 7 takeaways from former FBI Director James Comey's prepared opening remarks for Thursday's hearing: http://cbsn.ws/2sUrslR,7 takeaways from former FBI Director James Comey's prepared op...,video,https://www.facebook.com/CBSNews/videos/10154717190965950/,2017-06-07 18:07:46,363,155,112,278,17,42,19,1,6,0
131459315949_10154716433375950,"""I need loyalty. I expect loyalty,"" President Trump told then-FBI Director Comey during a January dinner, according to Comey's opening statement; MORE http://cbsn.ws/2sUh8tT",James Comey's opening statement for Senate Intel,video,https://www.facebook.com/CBSNews/videos/10154716433375950/,2017-06-07 14:00:54,740,1002,308,453,75,93,50,7,62,0
131459315949_10154716275700950,Senate Intel panel releases former FBI Director Comey's prepared statements: http://cbsn.ws/2sUh8tT,Former FBI Director Comey's opening remarks released,video,https://www.facebook.com/CBSNews/videos/10154716275700950/,2017-06-07 13:05:51,488,461,175,327,52,32,22,5,50,0
131459315949_10154716221440950,"“The Democrats are destroying health care in this country,” says President Donald J. Trump, adding Democrats wouldn’t even vote for the “greatest plan in the history of the world…” http://cbsn.ws/2rMfeMu","Trump says Democrats are ""destroying"" health care",video,https://www.facebook.com/CBSNews/videos/10154716221440950/,2017-06-07 12:48:15,5107,2573,1183,1139,88,111,2243,77,1449,0
131459315949_10154716139840950,"President Trump gives remarks on rebuilding America's infrastructure during visit to Cincinnati, Ohio",Pres. Trump gives remarks on rebuilding America's infrastructure,video,https://www.facebook.com/CBSNews/videos/10154716139840950/,2017-06-07 12:21:56,942,1222,106,371,134,5,58,19,355,0
131459315949_10154716072645950,"President Trump gives remarks on health care during visit to Cincinnati, Ohio",Pres. Trump gives remarks on health care,video,https://www.facebook.com/CBSNews/videos/10154716072645950/,2017-06-07 11:57:43,863,844,72,268,82,9,44,13,447,0
131459315949_10154715800360950,Who is Christopher Wray? President Donald J. Trump's nominee for FBI Director will testify before the Senate Judiciary Committee at his confirmation hearing on Wednesday http://cbsn.ws/2vbGMvt,Who is Christopher Wray?,video,https://www.facebook.com/CBSNews/videos/10154715800360950/,2017-06-07 10:25:50,398,269,56,229,38,16,82,6,27,0
131459315949_10154715442675950,"Almost exactly one month after he was fired by President Donald J. Trump, former FBI director James Comey is set to testify on Thursday about his private conversations with the president. http://cbsn.ws/2rLspxf",Comey testimony: timeline of events,video,https://www.facebook.com/CBSNews/videos/10154715442675950/,2017-06-07 09:00:47,411,142,62,313,52,10,29,1,6,0
131459315949_10154713873660950,"What you need to know about the leaked top-secret NSA report and Reality Winner, the government contractor charged with leaking it: http://cbsn.ws/2rJwDpb",A primer on the leaked top-secret NSA report and Reality Winner,video,https://www.facebook.com/CBSNews/videos/10154713873660950/,2017-06-06 19:51:30,415,229,159,233,14,64,14,10,80,0
131459315949_10154713039925950,"NEW: President Donald J. Trump's message for former FBI director James Comey ahead of his scheduled testimony? ""I wish him luck."" http://cbsn.ws/1UJwwDb",Does Pres. Trump have a message for James Comey,video,https://www.facebook.com/CBSNews/videos/10154713039925950/,2017-06-06 14:39:28,369,199,33,180,15,21,130,2,21,0
131459315949_10154712743950950,Bear breaks into home and discovers its musical talent: http://cbsn.ws/2qYeMh3,Play us a song Piano Bear,video,https://www.facebook.com/CBSNews/videos/10154712743950950/,2017-06-06 12:55:34,345,23,106,237,13,33,62,0,0,0
131459315949_10154712659780950,So you don't have a 401(k)? Here's how to save for the future.,How to save for retirement with no 401(k),video,https://www.facebook.com/CBSNews/videos/10154712659780950/,2017-06-06 12:20:33,287,41,110,256,11,10,4,5,1,0
131459315949_10154712603665950,Amal and George Clooney welcomed their first children -- a set of twins -- on Tuesday http://cbsn.ws/2rI0JJJ,Clooney twins,video,https://www.facebook.com/CBSNews/videos/10154712603665950/,2017-06-06 11:50:30,3018,195,226,2592,363,41,17,1,4,0
131459315949_10154712479875950,There was heavy police presence around Paris' Notre Dame Cathedral after an officer shot a man who attacked him with a hammer on Tuesday http://cbsn.ws/2qXSbRY,Heavy police presences near Notre Dame Cathedral,video,https://www.facebook.com/CBSNews/videos/10154712479875950/,2017-06-06 11:08:41,240,95,74,126,2,18,2,58,34,0
131459315949_10154712069775950,"""We aren't going to allow anybody, whether it's Donald Trump or anybody else, to divide our communities,"" London Mayor Sadiq Khan responds for the first time to President Donald J. Trump's criticism after the recent London terror attack http://cbsn.ws/2rHU1DB",Mayor Khan responds to President Trump,video,https://www.facebook.com/CBSNews/videos/10154712069775950/,2017-06-06 09:30:49,3305,909,484,2498,487,25,81,30,183,1
131459315949_10154492088180950,"These days, we may think we know what it means to be transgender, but there's a lot we still don't know. http://cbsn.ws/2nXOCbY","Gender fluid, agender and the new frontier",video,https://www.facebook.com/CBSNews/videos/10154492088180950/,2017-03-27 11:21:45,125,178,26,72,13,5,28,2,5,0
131459315949_10154491815730950,"In the CBSN Originals documentary, ""Gender: The Space Between,"" Shari Bellia -- the Illinois mother of a genderqueer teen -- offers a glimpse into her child's life and the moment at which she realized her daughter was non-binary. http://cbsn.ws/2nnbGOu","""Never that kind of girl""",video,https://www.facebook.com/CBSNews/videos/10154491815730950/,2017-03-27 09:41:11,142,154,35,95,17,2,19,4,5,0
131459315949_10154488970335950,"At this stage in his life and career, what 72-year-old actor Danny DeVito doesn’t want to do is slow down, or play it safe. http://cbsn.ws/2o6K6VQ","Danny DeVito on ""CBS Sunday""",video,https://www.facebook.com/CBSNews/videos/10154488970335950/,2017-03-26 13:50:21,377,50,48,320,43,4,10,0,0,0
131459315949_10154488676780950,"While the motivations behind gender identifications are different for everyone, CBSN Originals offers a glimpse into why one college freshman identifies as non-binary. http://cbsn.ws/2o6cNlB",Transgender testimonial: What it means to be non-binary,video,https://www.facebook.com/CBSNews/videos/10154488676780950/,2017-03-26 12:02:10,89,172,8,48,7,4,19,0,11,0
131459315949_10154488350520950,"Transgender stories have been more visible in recent years, but decades ago gender non-conforming people had hardly any resources. http://cbsn.ws/2o634Mh",A lost generation of gender,video,https://www.facebook.com/CBSNews/videos/10154488350520950/,2017-03-26 10:02:06,135,151,18,93,14,3,17,1,7,0
131459315949_10154486400670950,WATCH: These parents reunite with their son after he spent nine years in prison. Will he have to return? #48hours http://cbsn.ws/2o48Uxx,"Sneak peek: ""48 Hours"" investigates ""The Alternate Suspects""",video,https://www.facebook.com/CBSNews/videos/10154486400670950/,2017-03-25 20:01:24,64,9,9,54,3,5,0,2,0,0
131459315949_10154486027475950,Prosecutors will have to decide whether to try David Temple again for the murder of his wife. How will it end? #48hours �http://cbsn.ws/2nUuYOA,"Sneak peek: ""48 Hours"" investigates ""The Alternate Suspects""",video,https://www.facebook.com/CBSNews/videos/10154486027475950/,2017-03-25 18:01:23,33,11,9,28,1,3,0,1,0,0
131459315949_10154485386860950,"JUST IN: A man has barricaded himself on a bus in Las Vegas, according to police, and nearby hotel guests are sheltering in place. http://cbsn.ws/2o4973P",Standoff in Las Vegas after man barricades himself on bus,video,https://www.facebook.com/CBSNews/videos/10154485386860950/,2017-03-25 14:57:19,824,221,637,391,7,322,6,77,21,0
131459315949_10154485078135950,Thousands of demonstrators took to the streets of London on Saturday to protest the UK’s looming exit from the European Union. http://cbsn.ws/2nUbTMp,Demonstrators in London protest against Brexit,video,https://www.facebook.com/CBSNews/videos/10154485078135950/,2017-03-25 13:00:43,545,135,121,403,49,60,14,11,8,0
131459315949_10154484913090950,"We may think we know what it means to be transgender, but there is a type of trans person we never hear about. Tune in Monday at 8pm ET for an CBSN Originals. http://cbsn.ws/2nTBtkN",Non-binary: The gender beyond he or she,video,https://www.facebook.com/CBSNews/videos/10154484913090950/,2017-03-25 12:01:51,136,163,35,70,15,7,28,7,9,0
131459315949_10154484606615950,"When you don't feel like you identify with being a man or a woman, it can be a long journey to understanding what your gender identity is. http://cbsn.ws/2nTtd3W",Running from gender,video,https://www.facebook.com/CBSNews/videos/10154484606615950/,2017-03-25 10:01:57,243,365,40,102,25,14,78,13,11,0
131459315949_10154482888495950,"These two newborns — coincidentally named Romeo and Juliet — were born in neighboring rooms at the same hospital, but that's not even the best part... http://cbsn.ws/2nR6c1z🌹","""Star crossed babies"": Newborns named Romeo and Juliet born ho...",video,https://www.facebook.com/CBSNews/videos/10154482888495950/,2017-03-24 21:00:38,173815,6193,139478,124384,46082,2916,404,21,8,0
131459315949_10154482697305950,"""The losers are Nancy Pelosi and Chuck Schumer,"" President Donald J. Trump says from the Oval Office after the GOP health care bill is scuttled by lack of consensus: http://cbsn.ws/2nRdO49",Trump reacts to GOP health care bill being pulled,video,https://www.facebook.com/CBSNews/videos/10154482697305950/,2017-03-24 19:40:34,2656,1649,555,782,64,61,1225,32,492,0
131459315949_10154482163155950,"Meet the kids of Franklin County, Mississippi. They domesticate tarantulas, eat fried rattlesnake and they’re nationally ranked in … chess. Watch Sunday on 60 Minutes  http://cbsn.ws/2nQUd4n",Chess program creates state-championship team in rural Mississ...,video,https://www.facebook.com/CBSNews/videos/10154482163155950/,2017-03-24 16:32:50,90,10,37,62,10,16,1,1,0,0
131459315949_10154481745480950,"President Trump has ""made it clear that this is our moment, this is our opportunity"" to repeal and replace Obamacare, Press Secretary Sean Spicer says. http://cbsn.ws/2nZZqUf",Spicer takes questions on GOP health care vote,video,https://www.facebook.com/CBSNews/videos/10154481745480950/,2017-03-24 14:21:16,513,287,35,126,8,6,270,1,102,0
131459315949_10154481665780950,"""Trumpcare will take away health care from 24 million hard-working Americans,"" House Democratic Leader Nancy Pelosi says ahead of Friday's vote on the GOP health care bill.",Nancy Pelosi speaks out about AHCA ahead of vote,video,https://www.facebook.com/CBSNews/videos/10154481665780950/,2017-03-24 13:50:25,817,457,180,582,47,12,37,22,117,0
131459315949_10154481636385950,"After 30 days of quarantine, American-born giant panda Bao Bao has made her debut at her new home in southwestern China. http://www.cbsnews.com/live/video/bao-bao-returned-to-china-to-her-new-home/",Bao Bao makes first public appearance in China,video,https://www.facebook.com/CBSNews/videos/10154481636385950/,2017-03-24 13:35:41,450,25,44,388,49,6,1,5,1,0
131459315949_10154481327645950,London Mayor Sadiq Khan lays flowers at a memorial for victims of Wednesday's attack near the U.K. Parliament. http://cbsn.ws/2nQ7sCq,London Mayor pays tribute to terror attack victims,video,https://www.facebook.com/CBSNews/videos/10154481327645950/,2017-03-24 11:20:25,690,85,56,397,36,2,3,246,6,0
131459315949_10154481055995950,"Rep. Devin Nunes holds conference on House Intelligence Committee's Russia investigation, says wiretapping of Trump Tower, an unproven claim by President Donald J. Trump, did not happen.",Rep. Devin Nunes holds press availability,video,https://www.facebook.com/CBSNews/videos/10154481055995950/,2017-03-24 09:34:00,535,641,102,236,28,14,21,11,225,0
131459315949_10154479161115950,"Meeting with trucking execs, President Donald J. Trump climbed into this truck, honking the horn: http://cbsn.ws/2nWS9EO",President Trump meets with truckers & CEOs on health care,video,https://www.facebook.com/CBSNews/videos/10154479161115950/,2017-03-23 18:01:27,850,401,172,496,79,8,200,8,59,0
131459315949_10154478534950950,"No vote on GOP health care bill Thursday evening, House leadership announces",GOP delays health care bill vote,video,https://www.facebook.com/CBSNews/videos/10154478534950950/,2017-03-23 14:47:29,918,426,172,455,51,24,218,10,160,0
131459315949_10154478182425950,Press Sec. Spicer holds daily White House press briefing ahead of tonight's presumed vote on new GOP health care bill.,Press Sec. Spicer holds daily White House press briefing,video,https://www.facebook.com/CBSNews/videos/10154478182425950/,2017-03-23 12:40:20,734,1436,46,199,39,9,33,13,441,0
131459315949_10154477800640950,WATCH LIVE: House Minority Leader Nancy Pelosi comments on the GOP health care bill.,Nancy Pelosi speaks on GOP health care bill,video,https://www.facebook.com/CBSNews/videos/10154477800640950/,2017-03-23 10:04:53,549,620,88,335,59,12,23,17,103,0
131459315949_10154475858490950,"Reporter: ""Does the president stand by his statement that President Obama is a 'bad or sick guy'?""
Press Sec. Spicer: ""I think the president's tweets stand for themselves.""
http://cbsn.ws/2nT6G47","Reporter asks Spicer if Trump thinks Obama is ""a bad guy""",video,https://www.facebook.com/CBSNews/videos/10154475858490950/,2017-03-22 18:50:27,1148,493,113,259,24,62,235,27,541,0
131459315949_10154475165420950,"""No, no -- that did not happen,"" House intel chairman Nunes says when asked if Pres. Obama wiretapped Pres. Trump. http://cbsn.ws/2nK17rR","Nunes: Obama wiretapping of Trump ""did not happen""",video,https://www.facebook.com/CBSNews/videos/10154475165420950/,2017-03-22 15:00:27,542,352,192,309,13,32,85,7,96,0
131459315949_10154474990905950,"NYPD is on heightened alert after attack in London, offering additional security to various sites around New York. http://cbsn.ws/2nK2Uxo",New York responds to UK Parliament attack,video,https://www.facebook.com/CBSNews/videos/10154474990905950/,2017-03-22 14:00:32,413,69,152,299,13,39,3,54,5,0
131459315949_10154474844350950,"JUST IN: At least four dead in attack near UK Parliament, Scotland Yard confirms. http://cbsn.ws/2nSmxzP",Scotland Yard gives update on attack near UK Parliament,video,https://www.facebook.com/CBSNews/videos/10154474844350950/,2017-03-22 13:09:30,371,76,121,95,4,11,0,218,43,0
131459315949_10154474750155950,"Footage shows pedestrians rushing over the Westminster Bridge, shortly after an attack near UK Parliament. http://cbsn.ws/2nJNIAi",Pedestrians flee over Westminster Bridge in London,video,https://www.facebook.com/CBSNews/videos/10154474750155950/,2017-03-22 12:37:22,241,50,61,97,0,32,1,100,11,0
131459315949_10154474637195950,"JUST IN: Scotland Yard confirms there ""are a number of casualties"" in the attack outside UK Parliament, and says a ""full counter-terrorism investigation is already underway."" http://cbsn.ws/2nSaAKA",Scotland Yard updates on attack outside UK Parliament,video,https://www.facebook.com/CBSNews/videos/10154474637195950/,2017-03-22 11:56:38,574,90,133,163,1,25,1,311,73,0
