status_id,status_message,link_name,status_type,status_link,status_published,num_reactions,num_comments,num_shares,num_likes,num_loves,num_wows,num_hahas,num_sads,num_angrys,num_special
228735667216_10154693589122217,"The moment 82 ""Chibok girls"" were reunited with their families, 3 years after being kidnapped by Nigeria's Boko Haram. http://bbc.in/2rFDvCO #bringbackourgirls",Chibok girls - 82 reunited with families in Nigeria,video,https://www.facebook.com/bbcnews/videos/10154693589122217/,2017-05-21 10:00:00,9940,223,1517,7611,1753,66,12,491,7,0
228735667216_10154693518077217,Donald Trump joined in a traditional sword dance as he visited Saudi Arabia as part of his first foreign trip as US president. http://bbc.in/2rpYey4,US president joins ceremonial sword dance,video,https://www.facebook.com/bbcnews/videos/10154693518077217/,2017-05-21 06:26:10,32181,6893,9288,17799,767,418,12533,135,529,0
228735667216_10154567181336200,"""Emily is not the shadow defence secretary, I am."" - Nia Griffith overrules the shadow foreign secretary, Emily Thornberry, over Labour's Trident policy. #GE17

http://bbc.in/2qB4RMK",Shadow Defence Secretary Nia Griffith on Trident,video,https://www.facebook.com/bbcnews/videos/10154567181336200/,2017-05-20 01:57:36,646,224,63,551,5,17,66,1,6,0
228735667216_10154687130722217,"We were at the BBC Weather Centre with news of storms in some parts of the world, how rain has transformed areas of the UK - and much more.

Weather presenters Nick Miller and Ben Rich took your questions.",Weather,video,https://www.facebook.com/bbcnews/videos/10154687130722217/,2017-05-19 09:06:59,1754,505,166,1559,103,50,14,13,15,0
228735667216_10154686841567217,Will we see Wikileaks' founder Julian Assange today? We're outside Ecuador's embassy in London where he's been living for five years. Swedish prosecutors have dropped a rape investigation into him. But police say they'll still be obliged to arrest him if he leaves.,Outside Ecuador's Embassy,video,https://www.facebook.com/bbcnews/videos/10154686841567217/,2017-05-19 06:41:59,2514,1176,363,2073,174,137,48,19,63,0
228735667216_1452370668159329,"What would you give up for love? Meet the Japanese princess who has chosen a commoner over a crown. 💕
Read more: bbc.in/2qAAPsV",The Japanese royal marrying for love,video,https://www.facebook.com/bbcnews/videos/1452370668159329/,2017-05-19 06:00:00,32133,1235,4704,27488,3306,1186,78,59,16,0
228735667216_10154686727822217,"Watch LIVE: With the general election less than three weeks away, we've asked professional illustrator Hatti Rex to capture the key events of the last seven days.  #GE2017",,video,https://www.facebook.com/bbcnews/videos/10154686727822217/,2017-05-19 05:21:01,1510,673,104,1257,157,31,25,13,27,0
228735667216_1589373544415099,"'Fish loved me but people didn't' - Why Zafer Kizilkaya won the 2017 Whitley Gold Award for conservation.

(Via BBC World Service)",'Green Oscar' winner on his success,video,https://www.facebook.com/bbcnews/videos/1589373544415099/,2017-05-18 19:00:00,5548,78,1198,4968,466,104,8,2,0,0
228735667216_10154684736147217,An amazing time-lapse video of glaciers in Greenland taken from the cockpit of a NASA - National Aeronautics and Space Administration research aircraft.,Greenland - Operation IceBridge,video,https://www.facebook.com/bbcnews/videos/10154684736147217/,2017-05-18 13:15:21,1505,60,366,1342,57,101,2,3,0,0
228735667216_10154684700262217,"Iran goes to the polls tomorrow - here are the key things you need to know 

Read more: bbc.in/2qQcxvQ",Iran election: six things to know,video,https://www.facebook.com/bbcnews/videos/10154684700262217/,2017-05-18 13:03:56,872,120,162,805,20,26,12,3,6,0
228735667216_10155057668515659,"What would you do if you have terminal cancer? Lisa says it's not going to stop her ""laughing, having a good time (and) having fun.""

(Via BBC Stories)",A time to live - Lisa's story,video,https://www.facebook.com/bbcnews/videos/10155057668515659/,2017-05-18 10:15:30,19283,761,4098,12557,4710,266,13,1733,3,1
228735667216_1794296617253855,"UK Prime Minister Theresa May says ""there is no Mayism"" as she launches the Conservatives' manifesto. #GE2017
http://bbc.in/2pYNdP","""There is no Mayism""",video,https://www.facebook.com/bbcnews/videos/1794296617253855/,2017-05-18 07:57:02,1441,517,135,1039,43,10,160,4,184,1
228735667216_10154681964462217,"""In June last year we voted for a departure but we did not vote for a destination."" 
Tim Farron makes Brexit the centrepiece of the Lib Dem offer to the electorate. #GE2017",,video,https://www.facebook.com/bbcnews/videos/10154681964462217/,2017-05-17 15:31:07,2261,559,297,1877,124,17,198,4,38,3
228735667216_10154681191937217,"""No politician in history...has been treated worse or more unfairly,"" says President Donald J. Trump , speaking at the U.S. Coast Guard Academy as the controversy over his alleged links to Russia continues.",Donald Trump,video,https://www.facebook.com/bbcnews/videos/10154681191937217/,2017-05-17 10:50:27,9312,4748,620,3644,520,132,1147,140,3727,2
228735667216_10154681035267217,US soldier Chelsea Manning has been released from prison after serving seven years for leaking hundreds of thousands of diplomatic cables and military files to Wikileaks. We were #LIVE with the BBC’s Rajini Vaidyanathan at Fort Leavenworth in Kansas.,FB Live:  Chelsea Manning released,video,https://www.facebook.com/bbcnews/videos/10154681035267217/,2017-05-17 09:08:36,2522,511,266,2073,231,48,19,14,135,2
228735667216_1906804909577296,"Meet the woman turning goats into drinking water.

(Via BBC World Hacks)",Turning goats into water: A solution for the desert,video,https://www.facebook.com/bbcnews/videos/1906804909577296/,2017-05-16 14:40:00,8891,407,2754,7966,594,135,27,43,30,96
228735667216_10154678606852217,"The Labour Party has announced its manifesto, including plans to ask higher earners to pay more tax. So who would be affected? #GE2017

Read more: bbc.in/2rnjHEY",Labour's new tax plans: who would pay what?,video,https://www.facebook.com/bbcnews/videos/10154678606852217/,2017-05-16 13:08:01,2234,686,184,1874,128,17,138,6,67,4
228735667216_10154677765682217,"War, famine and disease are wreaking havoc in Yemen. 

The threat of famine looms for around seven million people, the country is in the grip of a major conflict involving rebel groups and a coalition led by Yemen's neighbour Saudi Arabia.  And now there's been a new outbreak of cholera.

A state of emergency has been declared in the capital Sanaa. 

BBC World Service Middle East Analyst Alan Johnston was live answering your questions.",Yemen Crisis,video,https://www.facebook.com/bbcnews/videos/10154677765682217/,2017-05-16 07:45:18,1947,469,474,1235,77,33,4,514,60,24
228735667216_10154677461162217,"Labour launches its manifesto with leader Jeremy Corbyn.  The party says its plans are  'radical and responsible'.
#GE2017",Labour manifesto launch,video,https://www.facebook.com/bbcnews/videos/10154677461162217/,2017-05-16 05:11:32,2430,2075,337,1498,685,27,56,22,115,27
228735667216_10154677339302217,Catch up with the adorable dog who crashed into the BBC last week on a skateboard 🐶.,It's the skateboarding dog who crashed into the BBC,video,https://www.facebook.com/bbcnews/videos/10154677339302217/,2017-05-16 03:47:53,63102,12396,32452,48665,8853,771,4689,2,12,110
228735667216_10154676412257217,The Vancouver Aquarium says Señor Cinco was blinded by a bullet in the eye.,Sea lion recovering after gunshot wound,video,https://www.facebook.com/bbcnews/videos/10154676412257217/,2017-05-15 19:03:14,6661,241,499,2745,137,41,8,2676,1029,25
228735667216_1790913707592146,"""The fat cats get the money and we get nothing.""

Theresa May is challenged about disability allowance and rent-to-buy schemes by voters whilst out campaigning in Abingdon. #GE2017

(Via BBC Politics)",Theresa May challenged by voters,video,https://www.facebook.com/bbcnews/videos/1790913707592146/,2017-05-15 08:47:13,3437,692,783,2968,151,28,165,38,76,11
228735667216_10154671901707217,This 101-year-old D-Day veteran has just become the world's oldest skydiver.,,video,https://www.facebook.com/bbcnews/videos/10154671901707217/,2017-05-14 09:53:00,23718,793,5101,19234,2556,1765,75,5,5,78
228735667216_1355267907890752,"#Eurovision 2017 is under way in Kiev, Ukraine.

What's it like to present the show? Take a look backstage with the Graham Nortons of Europe.
bbc.in/2qgeyOW",Eurovision presenters from around Europe,video,https://www.facebook.com/bbcnews/videos/1355267907890752/,2017-05-13 14:24:31,1158,117,94,1071,51,8,9,1,2,16
228735667216_10154665420072217,NASA astronauts Peggy Whitson and Jack Fischer make the 200th spacewalk at the International Space Station.,Spacewalk,video,https://www.facebook.com/bbcnews/videos/10154665420072217/,2017-05-12 07:05:03,5238,1240,733,4199,534,165,38,9,20,273
228735667216_10154663256952217,"We were #LIVE in Fairbanks, Alaska with BBC Correspondent James Cook at the Arctic Council - A group of 8 countries that meets every two years to discuss climate change and Arctic affairs. He is joined by Professor Amy Lauren Lovecraft.",FB LIVE: Arctic Council,video,https://www.facebook.com/bbcnews/videos/10154663256952217/,2017-05-11 18:46:32,1728,380,195,1378,114,19,11,3,10,193
228735667216_10154762434170787,A skateboarding French bulldog crashes into the front doors of the BBC's Broadcasting House in London. 😆 (via BBC Three),BBC's canine gatecrasher,video,https://www.facebook.com/bbcnews/videos/10154762434170787/,2017-05-11 16:16:00,38790,8892,8375,26219,3061,303,8915,42,6,244
228735667216_10154662509297217,"Labour's draft #GE2017 manifesto includes a pledge to scrap university tuition fees, but what has been the impact on students?",What's been the impact of tuition fees?,video,https://www.facebook.com/bbcnews/videos/10154662509297217/,2017-05-11 15:25:00,897,274,148,792,39,32,9,8,10,7
228735667216_1786521751364675,This is the moment a man confronted former UK PM David Cameron over his decision to call the EU referendum. #GE17 (via BBC Politics),Cameron confronted over Brexit vote,video,https://www.facebook.com/bbcnews/videos/1786521751364675/,2017-05-11 12:15:07,6821,672,1132,6063,213,42,415,11,54,23
228735667216_10154661116267217,Jeremy Corbyn plans to spend an extra £20bn in schools in England by raising business taxes - but can his plan work?,Can corporation tax pay for Labour's education pledge?,video,https://www.facebook.com/bbcnews/videos/10154661116267217/,2017-05-11 03:52:43,1889,953,418,1566,111,26,137,5,43,1
228735667216_10154660214097217,"The Republican divisions over the firing of James Comey as FBI director.

(Your questions on his sacking: http://bbc.in/2r1vszE)",,video,https://www.facebook.com/bbcnews/videos/10154660214097217/,2017-05-10 19:09:53,3478,775,566,2299,53,90,397,29,605,5
228735667216_10154659217717217,"Will The Labour Party scrap tuition fees? Jeremy Corbyn said to ""watch this space"". But footage that's emerged today shows John McDonnell saying tuition fees will be scrapped ""once and for all"".",,video,https://www.facebook.com/bbcnews/videos/10154659217717217/,2017-05-10 13:15:00,978,363,97,793,87,17,71,1,8,1
228735667216_10154659128002217,"Watch #LIVE: US President Donald J. Trump has fired the FBI Director, James Comey. 

We're in Washington with the latest reaction and the full background.

Put your questions to the BBC's Rajini Vaidyanathan and Anthony Zurcher below.",FB Live: Latest reaction to James Comey firing,video,https://www.facebook.com/bbcnews/videos/10154659128002217/,2017-05-10 11:51:04,1889,677,219,1414,97,60,64,25,227,2
228735667216_10154658529752217,"We were #LIVE inside the Eurovision Song Contest venue in Kiev, as Ukraine prepares to host the final this Saturday.

There's tight security and a political edge to the competition this year with frosty relations between Ukraine and Russia. 

Our correspondent Steve Rosenberg was there to take your questions and comments.",Eurovision Venue Tour,video,https://www.facebook.com/bbcnews/videos/10154658529752217/,2017-05-10 07:02:53,1122,244,71,993,82,16,12,5,14,0
228735667216_10154657137837217,"This Leo Messi lookalike caused chaos in Iran because so many fans wanted a photo with him that he had to be taken in by police.

bbc.in/2qY6fao",The Iranian Lionel Messi,video,https://www.facebook.com/bbcnews/videos/10154657137837217/,2017-05-09 23:00:37,33882,2140,7726,27254,409,1307,4855,19,26,12
228735667216_10154656472947217,"President Donald J. Trump has just fired FBI Director #JamesComey. 
We were LIVE when Senator Chuck Schumer spoke to media. The BBC's Anthony Zurcher was commenting below. Follow live updates from the BBC here:

http://bbc.in/2px5bZK",FB LIVE: Trump has fired FBI Director James Comey,video,https://www.facebook.com/bbcnews/videos/10154656472947217/,2017-05-09 18:09:27,5576,1941,1457,3189,225,654,252,82,1172,2
228735667216_10154656260267217,From Eurovision to shoes: UK PM Theresa May & her husband Philip appear on The One Show. #GE2017,Theresa & Philip May on The One Show,video,https://www.facebook.com/bbcnews/videos/10154656260267217/,2017-05-09 16:10:19,2480,922,419,1740,137,18,106,11,468,0
228735667216_10154656181912217,"Six times The Labour Party leader wouldn't say whether he would definitely take Britain out of the EU, if elected. #GE2017",Would PM Corbyn definitely leave EU?,video,https://www.facebook.com/bbcnews/videos/10154656181912217/,2017-05-09 15:33:52,2084,1303,1363,1286,50,38,437,11,261,1
228735667216_10154653807202217,"As President Donald J. Trump cracks down on immigration, one Chicago church promises to protect those facing deportation.",The church that's defying Trump,video,https://www.facebook.com/bbcnews/videos/10154653807202217/,2017-05-08 19:57:52,3259,368,539,2417,340,21,39,345,93,4
228735667216_1349640651786811,Not sure the hailstorm was invited to the MTV Movie & TV Awards red carpet...😳,MTV Movie & TV awards,video,https://www.facebook.com/bbcnews/videos/1349640651786811/,2017-05-08 08:00:00,2659,187,201,2090,27,94,447,1,0,0
228735667216_1440046049391791,"Can you answer these maths question that are meant for 11-year-olds?
National tests, known as SATS, will be taken by primary school children in England this week.",Could you answer these kids' maths questions?,video,https://www.facebook.com/bbcnews/videos/1440046049391791/,2017-05-08 07:20:00,5738,1066,1419,4594,61,155,883,24,18,3
228735667216_10154650507747217,"Emmanuel Macron will be France's new president - here are the election night highlights in 90 seconds.

bbc.in/2qQovSi",Emmanuel Macron will be France's new president,video,https://www.facebook.com/bbcnews/videos/10154650507747217/,2017-05-07 16:05:37,17414,876,2170,15114,1758,94,67,252,120,9
228735667216_10154649439192217,"""A mother gives life and this one gives death.""

Pope Francis criticises the 'mother of all bombs' that the US nicknames its largest non-nuclear explosive.",Pope angered by 'mother of all bombs' name,video,https://www.facebook.com/bbcnews/videos/10154649439192217/,2017-05-07 08:59:31,26428,2646,7184,20853,1713,176,510,2888,284,4
228735667216_1357924680929815,"Extremist city? In Lebanon’s second biggest city, locals say they’re unfairly being targeted & jailed for extremism. Benjamin Zand visited Tripoli for BBC Pop Up.

http://bit.ly/2qLvvQe",Lebanon's extremist city?,video,https://www.facebook.com/bbcnews/videos/1357924680929815/,2017-05-06 09:54:00,1380,179,193,1122,19,77,20,113,29,0
228735667216_10154646177857217,"The moment 10-year-old Kalani Watson asks his mother's husband, Brandon Williamson, a very special question.

It's a bit dusty in here... 😭",Boys pops special question to his mother's husband,video,https://www.facebook.com/bbcnews/videos/10154646177857217/,2017-05-06 03:43:05,47580,1370,7098,29564,16541,150,18,1295,3,9
228735667216_10154644203772217,"""I was known as 'the growler' at school"" - the Duchess of Cornwall told Blondie about her singing voice when they met at BBC Radio 2.",When Camilla met Blondie,video,https://www.facebook.com/bbcnews/videos/10154644203772217/,2017-05-05 09:55:40,3572,331,480,2978,254,16,319,0,5,0
228735667216_1346190032131873,"👑 Adele is rolling in it. 💰💰💰 bbc.in/2q26Bzy
(Via BBC Entertainment News)",,video,https://www.facebook.com/bbcnews/videos/1346190032131873/,2017-05-04 07:45:00,6829,269,449,6057,443,275,43,2,8,1
228735667216_10154639513527217,This rare Amur tigress has been released back into the Russian wilderness.,Tigress goes back to the wild,video,https://www.facebook.com/bbcnews/videos/10154639513527217/,2017-05-03 17:59:37,9829,218,1049,8451,1095,255,11,14,3,0
228735667216_10155008981245659,"The town where the fire department spend more time battling drug overdoses than fighting fires.

http://bbc.in/2oXLA8M","""Most of our callouts now are for drugs""",video,https://www.facebook.com/bbcnews/videos/10155008981245659/,2017-05-03 17:31:00,2066,211,601,971,18,187,9,849,32,0
228735667216_10154639020352217,"Lulu the killer whale was found dead on a beach in Scotland. She's being described as ""the most contaminated animal in the world"".

Read more: bbc.in/toxicwhale",Toxic whale,video,https://www.facebook.com/bbcnews/videos/10154639020352217/,2017-05-03 15:40:49,35971,1205,16877,6842,83,603,8,21479,6956,0
228735667216_10154637821887217,Prime Minister Theresa May has attended an audience with the Queen to mark the dissolution of parliament.,PM speech after audience with the Queen,video,https://www.facebook.com/bbcnews/videos/10154637821887217/,2017-05-03 09:37:26,3183,1414,335,2479,203,90,53,38,320,0
228735667216_10154637522982217,"Lib Dem leader Tim Farron gets heckled – he says it wouldn't happen to UK PM Theresa May because she refuses to meet ""anybody normal"".",Lib Dem leader heckled on campaign trail,video,https://www.facebook.com/bbcnews/videos/10154637522982217/,2017-05-03 07:08:20,10366,1697,1432,8559,344,93,1312,27,31,0
228735667216_1308650325885844,"Crime drama #LineOfDuty is back on British TVs. But is there too much violence against women shown in dramas like #LineOfDuty and #TheFall? Listen to what these celebrities think 👇🔊

(Via BBC Entertainment News)",,video,https://www.facebook.com/bbcnews/videos/1308650325885844/,2017-03-27 07:22:04,527,144,48,485,10,8,17,4,3,0
228735667216_10154886021985659,“I don’t see myself taking off my wedding ring” - Rio Ferdinand opens up about how hard it has been to cope with his wife Rebecca's death.,Rio Ferdinand on his struggle with grief,video,https://www.facebook.com/bbcnews/videos/10154886021985659/,2017-03-27 01:00:00,31155,978,5800,17634,2730,104,21,10651,15,0
228735667216_10154520246347217,"WhatsApp must not be a ""place for terrorists to hide"", says UK Home Secretary Amber Rudd. 

http://bbc.in/2nX6Bj4",WhatsApp can't be terrorists' 'hiding place',video,https://www.facebook.com/bbcnews/videos/10154520246347217/,2017-03-26 11:08:17,3881,583,722,3293,90,38,50,15,395,0
228735667216_10154519612747217,A Hong Kong escalator malfunctions and starts running backwards – leaving people injured. http://bbc.in/2nWjpXc,Hong Kong escalator malfunctions,video,https://www.facebook.com/bbcnews/videos/10154519612747217/,2017-03-26 06:14:18,18738,2964,5202,8398,37,6647,1878,1621,157,0
228735667216_10154886127155659,The little boy who lost his legs while playing at home.,The children of the forgotten war,video,https://www.facebook.com/bbcnews/videos/10154886127155659/,2017-03-25 10:30:01,5273,196,899,1673,45,16,4,3168,367,0
228735667216_1880119902245797,Your phone can unlock thousands of bikes 🚲 (via BBC World Hacks),The bikes you can rent and leave anywhere,video,https://www.facebook.com/bbcnews/videos/1880119902245797/,2017-03-25 07:00:00,7934,412,2776,7152,438,324,16,0,4,0
228735667216_10154514650877217,In solidarity with London.,Famous landmarks around the world,photo,https://www.facebook.com/bbcnews/photos/a.10154514591317217.1073742150.228735667216/10154514650877217/?type=3,2017-03-24 13:24:59,23056,305,1711,20189,1891,33,19,916,8,0
228735667216_10154514021847217,"We were live with award winning photojournalist Pierre Crom.  

Pierre covers Europe, the Middle East and North Africa, with a focus on Eastern Ukraine.",Photojournalist,video,https://www.facebook.com/bbcnews/videos/10154514021847217/,2017-03-24 08:03:48,2124,461,252,1910,133,43,12,19,7,0
228735667216_10154512425112217,The BBC's Matthew Price retraces the route of the London terror attacker. More here: bbc.in/2ni8S7f,,video,https://www.facebook.com/bbcnews/videos/10154512425112217/,2017-03-23 17:46:06,7721,539,2094,4627,45,82,10,2121,836,0
228735667216_10154512329987217,Thousands of people gathered in Trafalgar Square for a vigil to express solidarity after London terror attack.,,video,https://www.facebook.com/bbcnews/videos/10154512329987217/,2017-03-23 17:19:45,145232,1878,23406,112414,13275,201,88,19084,170,0
228735667216_1496528927055466,"The world shows solidarity for London after terror attack.

More here: bbc.in/2mVynrp",Solidarity for London,video,https://www.facebook.com/bbcnews/videos/1496528927055466/,2017-03-23 15:46:12,20443,345,3043,17238,2109,33,14,1034,15,0
228735667216_1373215772759298,"Terror witness ""saw blood everywhere"". Latest on Westminster attack from BBC News http://bbc.in/2mUCkxi",Eyewitness on Westminster Bridge,video,https://www.facebook.com/bbcnews/videos/1373215772759298/,2017-03-23 01:10:00,4346,311,763,1972,20,35,8,1987,324,0
228735667216_10154507702187217,"UK Parliament shooting: This eyewitness was on Westminster Bridge, where a car struck pedestrians.

Latest: bbc.in/2nduQYF",,video,https://www.facebook.com/bbcnews/videos/10154507702187217/,2017-03-22 12:10:25,7888,474,2781,4337,31,415,20,2856,229,0
228735667216_10154506591002217,"Snake on a plane. 🐍 ✈

http://bbc.in/2mP4NDJ",Snake on a plane. 🐍 ✈,video,https://www.facebook.com/bbcnews/videos/10154506591002217/,2017-03-22 04:45:26,4330,1023,810,2697,40,1076,436,30,51,0
228735667216_10154506433577217,"What is free range milk? What is the difference between it and 'ordinary' and organic milk? Emma Simpson was live at Barnhouse Farm, Gloucestershire to see why a group of farmers are now offering it.",Free range milk,video,https://www.facebook.com/bbcnews/videos/10154506433577217/,2017-03-22 04:09:01,2325,602,269,2073,159,21,18,6,48,0
228735667216_381354628904240,"From IRA second-in-command to Northern Ireland deputy first minister: Martin McGuinness dies aged 66.

bbc.in/2n8uC5c",From Provo to Peacemaker,video,https://www.facebook.com/bbcnews/videos/381354628904240/,2017-03-21 17:30:00,1194,243,145,933,22,26,53,135,25,0
228735667216_10154975418362936,"George Clooney, what a guy! 😍 bbc.in/2mIR4OQ",George Clooney surprises 87 year old fan,video,https://www.facebook.com/bbcnews/videos/10154975418362936/,2017-03-21 14:59:50,36080,1029,4246,27920,7744,334,73,4,5,0
228735667216_10154503784797217,"It's maple season in Canada and we were live at Au Pied de Cochon Sugar Shack, with owner and chef Martin Picard.",FB Live: Maple Syrup Season with Chef Martin Picard,video,https://www.facebook.com/bbcnews/videos/10154503784797217/,2017-03-21 12:04:45,1730,310,208,1516,177,15,12,2,8,0
228735667216_10154503136392217,"When Martin McGuinness met the Queen: Moments many thought would never happen.

bbc.in/2nNBRh8",,video,https://www.facebook.com/bbcnews/videos/10154503136392217/,2017-03-21 06:32:26,2913,299,359,2676,104,63,27,7,36,0
228735667216_1302133566537520,JW Anderson's new exhibition at The Hepworth Wakefield mixes fashion and art. 👗🎨,When fashion and art collide,video,https://www.facebook.com/bbcnews/videos/1302133566537520/,2017-03-20 16:40:00,658,75,95,589,34,9,22,1,3,0
228735667216_10154498889612217,It's been three years since Russia took control of Crimea from Ukraine.,Crimea,video,https://www.facebook.com/bbcnews/videos/10154498889612217/,2017-03-19 17:16:00,4035,343,628,2478,66,62,17,1014,398,0
228735667216_10154605283845787,"""I was born without limbs, but that's not stopped me weightlifting."" 

(Via BBC Three).",Living Differently: I Am A Limbless Weightlifter,video,https://www.facebook.com/bbcnews/videos/10154605283845787/,2017-03-19 11:15:00,38243,2080,19157,29293,4316,4438,57,132,7,0
228735667216_10154862398965659,This Nigerian traffic warden is a BIG Michael Jackson fan.,If Michael Jackson was a traffic warden,video,https://www.facebook.com/bbcnews/videos/10154862398965659/,2017-03-18 21:00:00,28732,1383,8396,23760,2198,232,2532,5,5,0
228735667216_10154865958725659,Meet the family leaving Britain because of Brexit. (Via BBC Stories),The family leaving Britain because of Brexit,video,https://www.facebook.com/bbcnews/videos/10154865958725659/,2017-03-18 10:00:00,19638,3391,5435,12154,326,432,1268,5280,178,0
228735667216_10154495288047217,"""He was holding the soldier by her neck"" - eyewitnesses describe the Paris-Orly airport attack. Latest: bbc.in/2mTPmfc",Paris-Orly airport attack,video,https://www.facebook.com/bbcnews/videos/10154495288047217/,2017-03-18 07:36:03,2691,324,531,1818,16,280,6,473,98,0
228735667216_10154493476037217,"William and Kate celebrate St Patrick's Day. ☘

bbc.in/2mY3aXO",,video,https://www.facebook.com/bbcnews/videos/10154493476037217/,2017-03-17 14:45:00,46842,1570,3162,43050,2830,128,767,9,58,0
228735667216_10154490472952217,"Incredible footage of a woman emerging from a mudslide in Peru.

bbc.in/2mU9NKU",,video,https://www.facebook.com/bbcnews/videos/10154490472952217/,2017-03-16 14:30:07,19670,515,4457,10984,259,5350,22,3038,17,0
228735667216_10154490130607217,"The moment a BBC crew get caught up in a volcanic blast on Mount Etna.

bbc.in/2mTKoAY",,video,https://www.facebook.com/bbcnews/videos/10154490130607217/,2017-03-16 12:33:27,45977,3590,32539,27318,268,15996,356,1992,47,0
