status_id,status_message,link_name,status_type,status_link,status_published,num_reactions,num_comments,num_shares,num_likes,num_loves,num_wows,num_hahas,num_sads,num_angrys,num_special
431863377156272_566419557033986,"Media admits: Trump more accessible than Obama, 'not shy' about talking","Media admits: Trump more accessible than Obama, 'not shy' about talking",link,http://www.washingtonexaminer.com/article/2642485,2017-12-04 21:12:28,107,4,15,87,14,1,5,0,0,0
431863377156272_566417690367506,President Returns 'Public' Land,Trump dramatically SHRINKS Bears Ears National Monument,video,http://www.dailymail.co.uk/~/article-5144171/index.html,2017-12-04 21:07:14,144,5,18,110,32,1,0,0,1,0
431863377156272_566400660369209,Anti-Trump Text Messages Show Pattern Of Bias On Mueller’s Team,Anti-Trump Text Messages Show Pattern Of Bias On Mueller’s Team,link,http://dailycaller.com/2017/12/04/anti-trump-text-messages-show-pattern-of-bias-on-muellers-team/?utm_source=site-share,2017-12-04 20:18:31,59,11,6,33,0,1,1,0,24,0
431863377156272_566397613702847,FBI agent dismissed from Mueller probe changed Comey's description of Clinton to 'extremely careless',FBI agent dismissed from Mueller probe changed Comey description of Clinton,link,http://cnn.it/2kpLEwY,2017-12-04 20:08:06,84,11,19,37,0,11,2,1,33,0
431863377156272_566397167036225,Supreme Court allows full enforcement of Trump travel ban,Supreme Court allows full enforcement of Trump travel ban,link,https://www.apnews.com/b8244def36484dfb93fd958962b7d649/Supreme-Court-allows-full-enforcement-of-Trump-travel-ban,2017-12-04 20:05:41,158,14,23,122,35,1,0,0,0,0
431863377156272_565617720447503,Fear in London as acid attacks soar,Fear in London as acid attacks soar,link,https://www.yahoo.com/news/fear-london-acid-attacks-soar-031225830.html?soc_src=community&soc_trk=fb,2017-12-03 06:20:03,89,11,54,38,0,13,0,11,27,0
431863377156272_565616987114243,DOJ files arrest warrant for illegal immigrant acquitted in Kate Steinle case,DOJ files arrest warrant for illegal immigrant acquitted in Kate Steinle case,link,http://fxn.ws/2Ak704z,2017-12-03 06:17:36,75,8,21,64,8,2,0,0,1,0
431863377156272_565597553782853,ABC News suspends Brian Ross for 4 weeks over erroneous Flynn story,ABC News suspends Brian Ross for 4 weeks over erroneous Flynn story,link,http://cnnmon.ie/2jEvLyA,2017-12-03 05:19:20,129,25,29,84,5,3,24,1,12,0
431863377156272_565597030449572,Revealed: Trump hater on Mueller team,"Byron York: Nunes blows up, threatens contempt after FBI stonewalls House on Russia investigator demoted for anti-Trump bias",link,http://www.washingtonexaminer.com/article/2642387,2017-12-03 05:17:07,54,2,13,34,0,8,0,1,11,0
431863377156272_564751897200752,DOJ may bring charges in Steinle's murder,DOJ may bring charges in Steinle's murder,link,http://cnn.it/2kixygR,2017-12-01 13:24:50,65,6,7,60,4,1,0,0,0,0
431863377156272_564681667207775,Flynn to plead guilty for lying to FBI,"Michael Flynn, Trump's ex-national security adviser, is expected to plead guilty Friday to lying to the FBI",link,http://cnb.cx/2ANMGd3,2017-12-01 10:30:57,25,18,2,18,0,0,3,1,3,0
431863377156272_564632777212664,BUST: iHeart Radio Nears Chapter 11,iHeart Creditors Reject Another Offer From Company as They Push for Chapter 11,link,https://www.wsj.com/articles/iheart-creditors-reject-another-offer-from-company-as-they-push-for-chapter-11-1512090362,2017-12-01 08:52:05,16,1,4,11,0,1,0,4,0,0
431863377156272_564627807213161,Want To End Sexual Harassment? AG Hopeful Says ‘Elect Candidate Who Doesn’t Have A Penis’,Want To End Sexual Harassment? AG Hopeful Says 'Elect Candidate Who Doesn't Have A Penis',link,http://detroit.cbslocal.com/2017/11/29/want-to-end-sexual-harassment-ag-hopeful-says-elect-candidate-who-doesnt-have-a-penis/#.WiFcftIl7tw.facebook,2017-12-01 08:43:46,24,19,5,4,0,3,12,0,5,0
431863377156272_564606213881987,"Google, Facebook and Drudge: What the new titans of media mean for America","Google, Facebook and Drudge: What the new titans of media mean for America",link,http://thehill.com/opinion/campaign/362591-google-facebook-and-drudge-what-the-new-titans-of-media-mean-for-america,2017-12-01 08:05:49,10,1,5,10,0,0,0,0,0,0
431863377156272_564246643917944,Campus Newspaper Editorial Tells White Students “Your DNA is an Abomination”,Campus newspaper editorial: 'Your [white] DNA is an abomination',link,http://www.washingtonexaminer.com/article/2641940,2017-11-30 17:21:46,76,22,26,16,1,12,3,5,39,0
431863377156272_564241143918494,Writer Jenny Lumet: Russell Simmons Sexually Violated Me,Writer Jenny Lumet: Russell Simmons Sexually Violated Me (Guest Column),link,https://www.hollywoodreporter.com/news/writer-jenny-lumet-russell-simmons-sexually-violated-me-guest-column-1062934,2017-11-30 16:58:36,19,5,4,11,0,1,3,1,3,0
431863377156272_564236400585635,White House Considering Plan for Relocating Embassy in Israel to an 'undivided' Jerusalem,White House Considering Plan for Relocating Embassy in Israel,link,https://www.wsj.com/articles/white-house-considering-plan-for-relocating-embassy-in-israel-1512070058,2017-11-30 16:35:44,30,0,6,27,3,0,0,0,0,0
431863377156272_564109837264958,Judge to look at files in 1987 deaths of 2 boys found on central Arkansas railroad tracks,Judge to look at files in 1987 deaths of 2 boys found on central Arkansas railroad tracks,link,http://m.arkansasonline.com/news/2017/nov/26/judge-to-look-at-files-in-2-boys-1987-d/,2017-11-30 11:06:54,40,6,13,25,2,8,0,4,1,0
431863377156272_564085367267405,Fifth Woman Fingers Franken: Army veteran says Franken groped her during USO tour in 2003,Army veteran says Franken groped her during USO tour in 2003,link,http://cnn.it/2Ajclt7,2017-11-30 10:04:46,25,10,6,9,0,4,2,1,9,0
431863377156272_564083630600912,"Rep. John Conyers in the hospital, aide says","Rep. John Conyers in the hospital, aide says",link,http://cnn.it/2AmJUbw,2017-11-30 10:01:17,17,17,2,8,0,4,4,0,1,0
431863377156272_564082770600998,Moon Express says first launch is 'definitely' happening in 2018,"Human colonies will be on the moon within 5 years, space entrepreneur says",link,http://cnb.cx/2zQn4MD,2017-11-30 09:58:44,17,5,8,10,2,0,5,0,0,0
431863377156272_564082077267734,Trump has a plan to replace Secretary of State Tillerson with CIA director Pompeo: Reports,Trump has a plan to replace Secretary of State Tillerson with CIA director Pompeo: Reports,link,http://cnb.cx/2zSd5q5,2017-11-30 09:56:51,21,6,2,14,4,2,0,0,1,0
431863377156272_564080800601195,Jewish groups demand Poland explain naked game of tag in Nazi gas chamber,Jewish groups demand Poland explain naked game of tag in Nazi gas chamber,link,https://www.timesofisrael.com/jewish-groups-demand-poland-explain-naked-game-of-tag-in-nazi-gas-chamber/,2017-11-30 09:54:10,26,4,5,10,0,1,3,2,10,0
431863377156272_564078463934762,Senate tax drama enters potentially chaotic 'vote-a-rama' on amendments,Senate tax drama enters potentially chaotic 'vote-a-rama' on amendments,link,http://cnb.cx/2AKugKj,2017-11-30 09:48:59,5,3,0,5,0,0,0,0,0,0
431863377156272_564077667268175,Matt Lauer breaks silence: 'I am truly sorry',Matt Lauer breaks silence: ‘I am truly sorry’,link,http://pge.sx/2BnBtMr,2017-11-30 09:47:06,40,57,9,9,0,2,20,1,8,0
431863377156272_564075413935067,"Dow surges 115 points, breaks above 24,000 ahead of Senate tax vote","Dow surges 100 points, opens at record high ahead of Senate tax-reform vote",link,http://cnb.cx/2zSzMtW,2017-11-30 09:45:38,51,3,11,44,7,0,0,0,0,0
431863377156272_563987283943880,Goldman Warns That Market Valuations Are at Their Highest Since 1900,Goldman Warns That Market Valuations Are at Their Highest Since 1900,link,https://www.bloomberg.com/news/articles/2017-11-29/goldman-warns-highest-valuations-since-1900-mean-pain-is-coming,2017-11-30 06:38:29,14,2,1,13,0,1,0,0,0,0
431863377156272_563986480610627,Scheduling glitch leaves thousands of American Air flights in December pilotless,"Union says over 15,000 American Air flights in December have no pilots assigned",link,https://reut.rs/2AlvkDJ,2017-11-30 06:35:51,11,1,7,7,0,2,2,0,0,0
431863377156272_563540843988524,NBC fires Matt Lauer after complaint about 'inappropriate sexual behavior',Matt Lauer fired from NBC News after complaint about 'inappropriate sexual behavior',link,http://cnnmon.ie/2i0Diax,2017-11-29 09:19:44,107,20,15,60,2,10,35,0,0,0
431863377156272_563479253994683,Uzbekistan incident raises suspicions of Russian involvement in Cuba attacks,Uzbekistan incident raises suspicions of Russian involvement in Cuba attacks,link,https://www.cbsnews.com/news/uzbekistan-incident-raises-suspicions-of-russian-involvement-in-cuba-attacks,2017-11-29 06:57:58,18,1,5,11,0,6,0,0,1,0
431863377156272_562212260788049,"As he investigates Trump's aides, Robert Mueller's record shows surprising flaws","As he investigates Trump's aides, Robert Mueller's record shows surprising flaws",link,http://www.latimes.com/politics/la-na-pol-mueller-record-20171122-story.html,2017-11-26 22:34:14,66,12,21,45,0,5,3,1,12,0
431863377156272_560036694338939,GREAT AGAIN: US jobless claims fall as record run persists,US jobless claims fall as record run persists,link,https://www.yahoo.com/news/us-jobless-claims-fall-record-run-persists-140437347.html?soc_src=community&soc_trk=fb,2017-11-22 17:01:06,50,0,11,46,4,0,0,0,0,0
431863377156272_560033987672543,Sebelius: The Clinton White House doubled down on 'abusive behavior' and it's fair to criticize Hillary Clinton,"Sebelius: Clinton WH ""doubled down"" on ""abusive behavior""",link,http://cnn.it/2zYJ6vg,2017-11-22 16:48:46,54,6,10,44,3,2,5,0,0,0
431863377156272_559064171102858,DOJ Sues To Stop AT&T Takeover of Time Warner,AT&T Sued by U.S. Seeking to Block Merger With Time Warner,link,https://www.bloomberg.com/news/articles/2017-11-20/at-t-is-said-to-face-u-s-antitrust-lawsuit-over-time-warner,2017-11-20 22:36:11,38,2,8,30,6,2,0,0,0,0
431863377156272_559060811103194,FCC plans total repeal of net neutrality rules,FCC plans total repeal of net neutrality rules,link,http://politi.co/2zXnuxh,2017-11-20 22:26:12,36,1,19,29,1,2,1,0,3,0
431863377156272_559059107770031,"Eight women say Charlie Rose sexually harassed them — with nudity, groping and lewd calls","Eight women say Charlie Rose sexually harassed them — with nudity, groping and lewd calls",link,http://wapo.st/2zUL7bN?tid=ss_fb&utm_term=.569820c4edf5,2017-11-20 22:20:16,43,19,15,23,0,6,8,2,4,0
431863377156272_558931131116162,"BofA's Apocalyptic Forecast: Stocks Flash Crash, Bond Bubble Bursts In H1 2018, War May Follow","BofA's Apocalyptic Forecast: Stocks Flash Crash, Bond Bubble Bursts In H1 2018, War May Follow",link,http://www.zerohedge.com/news/2017-11-20/bofas-apocalyptic-forecast-stocks-flash-crash-bond-bubble-bursts-h1-2018,2017-11-20 16:18:38,14,4,7,7,0,4,3,0,0,0
431863377156272_558863311122944,New York Times reporter suspended in harassment probe,New York Times reporter suspended in harassment probe,link,http://www.washingtontimes.com/news/2017/nov/20/new-york-times-reporter-suspended-for-harassment-p/,2017-11-20 13:23:27,15,0,3,12,0,0,3,0,0,0
431863377156272_558826764459932,"Morrissey defends Weinstein and Spacey, blames victims","Morrissey defends Weinstein and Spacey, blames victims",link,http://pge.sx/2zTmaOc,2017-11-20 11:50:05,43,13,7,6,0,5,3,1,28,0
431863377156272_558826141126661,Bitter Hillary fantasizes about leaving Earth to be president on another planet,Bitter Hillary fantasizes about leaving Earth to be president on another planet - The American Mirror,link,http://www.theamericanmirror.com/bitter-hillary-fantasizes-leaving-earth-president-another-planet/,2017-11-20 11:48:34,99,38,32,30,1,5,62,1,0,0
431863377156272_558825591126716,Woman says Franken inappropriately touched her in 2010,Woman says Franken inappropriately touched her in 2010,link,http://cnn.it/2zSwcyO,2017-11-20 11:47:24,17,3,3,10,0,1,1,1,4,0
431863377156272_558299587845983,New Orleans elects first female mayor in city history,New Orleans elects first female mayor in city history,link,http://thehill.com/blogs/blog-briefing-room/news/361074-new-orleans-elects-first-female-mayor-in-city-history#ampshare=http://thehill.com/blogs/blog-briefing-room/news/361074-new-orleans-elects-first-female-mayor-in-city-history,2017-11-19 10:58:08,23,10,3,20,0,2,1,0,0,0
431863377156272_558294431179832,100 full moons: Blazing fireball lights up Arctic sky,100 full moons: Blazing fireball lights up Arctic sky,link,https://www.yahoo.com/news/finns-scramble-calculate-path-blazing-arctic-meteorite-105131001.html?soc_src=community&soc_trk=fb,2017-11-19 10:48:22,14,0,2,10,0,3,1,0,0,0
431863377156272_558292484513360,Harvey Weinstein had secret hitlist of names to quash sex scandal,Harvey Weinstein had secret hitlist of names to quash sex scandal,link,https://www.theguardian.com/film/2017/nov/18/harvey-weinstein-secret-hitlist-sex-scandal?CMP=share_btn_fb,2017-11-19 10:43:53,49,6,17,14,0,24,0,1,10,0
431863377156272_558290971180178,Ex-NFL star takes stand against national anthem protests,Ex-NFL star takes stand against national anthem protests,link,http://nyp.st/2hKip6V,2017-11-19 10:41:28,73,1,13,60,12,1,0,0,0,0
431863377156272_558289164513692,INFECTED FUGITIVES | Black Death patients are ESCAPING hospital and refusing treatment sparking fears it may spread,Black Death patients are ESCAPING hospital and refusing treatment sparking fears it may spread,link,https://www.thesun.co.uk/news/4943288/black-death-patients-are-escaping-hospital-and-refusing-treatment-sparking-fears-it-may-spread/,2017-11-19 10:37:21,53,2,29,15,0,19,0,4,15,0
431863377156272_558285527847389,"'Stop saying Christmas', Priest warns Christians to abandon the word",'Stop saying Christmas' Priest warns Christians to abandon the word,link,http://shr.gs/2xB4kPK,2017-11-19 10:30:53,71,26,19,10,0,9,3,3,46,0
431863377156272_558283751180900,GOLDMAN SACHS: 2018 is going to be a great year,"Goldman Sachs says if you thought 2017 was surprisingly good, just wait for 2018",link,http://cnb.cx/2A7T8uW,2017-11-19 10:27:12,24,0,7,20,3,1,0,0,0,0
431863377156272_558037117872230,"Enormous number' of parasites in North Korean defector's body, doctors say","'Enormous number' of parasites in North Korean defector's body, doctors say",link,http://fxn.ws/2zMfnFP,2017-11-19 00:07:31,26,1,10,7,0,14,0,5,0,0
431863377156272_557863667889575,The Kochs Are Inching Closer to Becoming Media Moguls,The Kochs Are Inching Closer to Becoming Media Moguls,link,https://www.nytimes.com/2017/11/17/business/media/koch-brothers-time-meredith.html?smid=fb-share,2017-11-18 14:55:39,15,2,2,10,2,3,0,0,0,0
431863377156272_557862811222994,"Murdoch's Fox in talks with multiple buyers for TV, film assets","Murdoch's Fox in talks with multiple buyers for TV, film assets",link,https://www.yahoo.com/news/murdochs-fox-talks-multiple-buyers-tv-film-assets-185439424.html?soc_src=hl-viewer&soc_trk=fb,2017-11-18 14:52:14,16,0,3,12,0,4,0,0,0,0
431863377156272_557834631225812,Trump reverses elephant trophy ban,Trump reverses elephant trophy decision post public outcry,video,http://www.dailymail.co.uk/news/article-5095077/Trump-reverses-elephant-trophy-decision-post-public-outcry.html,2017-11-18 13:22:15,82,22,20,71,9,1,0,0,1,0
431863377156272_557470367928905,Massive US military social media spying archive left wide open,Massive US military social media spying archive left wide open in AWS S3 buckets,link,https://www.theregister.co.uk/2017/11/17/us_military_spying_archive_exposed/,2017-11-17 23:51:27,16,2,5,8,0,5,0,0,3,0
431863377156272_557220067953935,KIM’S SEA MONSTER: Satellite images reveal North Korea is dangerously close to finishing new ballistic missile submarine,Satellites reveal tyrant is close to finishing new ballistic missile sub,link,https://www.thesun.co.uk/news/4933856/north-korea-ballistic-missile-submarine-satellite-images/,2017-11-17 10:41:17,31,5,23,9,0,9,0,0,13,0
431863377156272_557219237954018,Black Death Pandemic: Expert warns of ETERNAL plague outbreaks,Black Death Pandemic: Expert warns of ETERNAL plague outbreaks,link,http://shr.gs/C7xjtuf,2017-11-17 10:39:43,22,1,15,9,0,12,0,0,1,0
431863377156272_557216841287591,Report: Polar vortex to bring 'extended period of severe winter weather',Report: Polar vortex to bring 'extended period of severe winter weather',link,http://buffalonews.com/2017/11/16/polar-vortex-to-bring-extended-period-of-severe-winter-weather-in-2017-18/,2017-11-17 10:35:52,56,11,33,33,2,12,5,4,0,0
431863377156272_557216207954321,GRAPHIC: NAVY ADMITS TO BEING INVOLVED IN OBSCENE SKYDRAWINGS SPOTTED IN OKANOGAN CO.,Graphic: Navy admits to being involved in obscene skydrawings spotted in Okanogan Co.,link,http://www.wtsp.com/mobile/article/news/graphic-navy-admits-to-being-involved-in-obscene-skydrawings-spotted-in-okanogan-co/67-492521457,2017-11-17 10:34:34,19,5,5,9,1,3,6,0,0,0
431863377156272_557214244621184,Dark Money: Private memo gives inside look at Democracy Alliance's latest secret donor meeting,"Resistance Royalty: Pelosi, Soros Headline Left's Biggest Dark Money Conference",link,http://freebeacon.com/politics/resistance-royalty-pelosi-soros-headline-lefts-biggest-dark-money-conference/,2017-11-17 10:31:18,51,4,34,11,0,9,0,2,29,0
431863377156272_556940657981876,House Republicans pass tax reform bill,House Republicans pass tax reform bill,link,http://cnb.cx/2A5cmBz,2017-11-16 21:11:23,51,3,5,44,5,1,1,0,0,0
431863377156272_556940374648571,EXCLUSIVE: Saudi Arabia king to step down and hand over the crown to his 32-year-old son,Saudi Arabia's King Salman set to hand over the crown to his son,video,http://www.dailymail.co.uk/~/article-5089229/index.html,2017-11-16 21:10:11,28,4,8,19,0,9,0,0,0,0
431863377156272_556939604648648,Democratic Senator Al Franken apologizes for forcibly kissing former Playboy model and GROPING her while she slept during 2006 USO tour in Afghanistan,"Radio host, former Playboy model: Dem. Senator Al Franken GROPED me",video,http://www.dailymail.co.uk/~/article-5089713/index.html,2017-11-16 21:07:02,35,19,6,13,0,4,3,2,13,0
431863377156272_556938941315381,"Senator Al Franken Kissed and Groped Me Without My Consent, And There’s Nothing Funny About It","Leeann Tweeden: Senator Al Franken Kissed and Groped Me Without My Consent, And There’s Nothing Funny About It",music,http://audioboom.com/posts/6493582-leeann-tweeden-senator-al-franken-kissed-and-groped-me-without-my-consent-and-there-s-nothing-funny-about-it?utm_campaign=embed&utm_content=retweet&utm_medium=social&utm_source=facebook,2017-11-16 21:05:18,13,2,2,5,0,1,0,1,6,0
431863377156272_556316434710965,Pentagon to pay for surgery for transgender soldier,Pentagon will pay for gender transition surgery for an active-duty soldier,link,https://www.nbcnews.com/news/us-news/pentagon-oks-surgery-transgender-soldier-military-hospital-n820721?cid=sm_npd_nn_tw_ma,2017-11-15 12:48:08,66,30,33,8,0,5,1,1,51,0
431863377156272_556309574711651,Alaska urged to prepare for North Korean nuclear attack as residents told to stockpile Prussian Blue anti-radiation pills,Alaska told stockpile anti-radiation pills in case of North Korea nuclear attack,link,http://www.mirror.co.uk/news/world-news/alaska-urged-prepare-north-korean-11526461#ICID=sharebar_facebook,2017-11-15 12:29:46,32,2,20,8,0,19,1,4,0,0
431863377156272_556307551378520,Man Killed In Year’s 600th Homicide Among 5 Shot Tuesday In Chicago,Man Killed In Year’s 600th Homicide Among 5 Shot Tuesday In Chicago,link,http://chicago.cbslocal.com/2017/11/15/tuesday-shootings-600-homicides/#.Wgx4K4kHU7M.facebook,2017-11-15 12:24:19,27,6,24,10,1,5,1,9,1,0
431863377156272_556305844712024,SpaceX is launching a secret mission to space Thursday. Here's what we know so far.,SpaceX is launching a secret mission to space Wednesday. Here's what we know so far.,link,http://mashable.com/2017/11/14/spacex-zuma-launch-and-landing-secret-mission/#Sh2R2jDgF3qU,2017-11-15 12:18:30,4,1,6,3,0,1,0,0,0,0
431863377156272_556305301378745,Southern California smog worsens for second straight year despite reduced emissions,Southern California smog worsens for second straight year despite reduced emissions,link,http://www.latimes.com/local/lanow/la-me-ln-bad-air-days-20171115-story.html,2017-11-15 12:16:34,19,2,2,5,0,2,11,1,0,0
431863377156272_556304601378815,When Pigs Fly: Woman kicked off flight after emotional support PIG became rowdy,Woman kicked off flight after emotional support PIG became disruptive,link,https://www.thesun.co.uk/news/4920381/woman-kicked-off-us-airways-flight-emotional-support-pig-disruptive/,2017-11-15 12:14:19,33,7,13,6,0,1,26,0,0,0
431863377156272_556300028045939,15 Million in Taxpayer Money Has Been Paid Out to Settle Congressional Sexual Harassment Suits,$15 Million in Taxpayer Money Has Been Paid Out to Settle Congressional Sexual Harassment Suits,link,http://ntknetwork.com/15-million-in-taxpayer-money-has-been-paid-out-to-settle-congressional-sexual-harassment-suits/,2017-11-15 12:05:05,91,12,79,24,0,15,0,4,48,0
431863377156272_556297588046183,"ICE agents rebel, say Trump ‘betrayed’ them by retaining Obama’s people","ICE agents rebel, say Trump ‘betrayed’ them by leaving Obama’s people in place",link,http://www.washingtontimes.com/news/2017/nov/14/ice-agents-rebel-say-trump-betrayed-them/?utm_campaign=shareaholic&utm_medium=facebook&utm_source=socialnetwork,2017-11-15 11:59:39,28,2,6,15,0,2,2,8,1,0
431863377156272_555635944779014,WATCH: Joe Biden Says Man Who Stopped Texas Church Shooter Never Should Have Had That Gun,WATCH: Joe Biden Says Man Who Stopped Texas Church Shooter Never Should Have Had That Gun,link,http://www.dailywire.com/news/23528/watch-joe-biden-says-man-who-stopped-texas-church-ryan-saavedra,2017-11-14 08:26:25,90,44,34,24,0,6,13,1,46,0
431863377156272_555604201448855,Michael Savage leaps into faith with new book,Inside the Beltway: Michael Savage leaps into faith with new book,link,http://www.washingtontimes.com/news/2017/nov/13/inside-the-beltway-michael-savage-leaps-into-faith/?utm_campaign=shareaholic&utm_medium=facebook&utm_source=socialnetwork,2017-11-14 07:53:15,45,6,8,37,8,0,0,0,0,0
431863377156272_555602958115646,"Savage: God is not dead, man is dead to God
New book invites skeptics into talk-radio host’s ‘spiritual odyssey’",REVIEW: New book invites skeptics into talk-radio host’s ‘spiritual odyssey’,link,https://michaelsavage.com/2017/11/13/review-new-book-invites-skeptics-into-talk-radio-hosts-spiritual-odyssey/,2017-11-14 07:50:04,24,1,5,24,0,0,0,0,0,0
431863377156272_555600004782608,Missouri Attorney General Launches Probe Into Google,Missouri Attorney General Launches Probe Into Google’s Business Practices,link,https://www.wsj.com/articles/missouri-attorney-general-launches-probe-into-googles-business-practices-1510592964,2017-11-14 07:43:01,40,3,5,33,7,0,0,0,0,0
431863377156272_555599031449372,Earthquake swarm,Earthquake swarm hits Monterey County; biggest felt in SF,link,http://m.sfgate.com/bayarea/article/Swarm-of-earthquakes-hit-Monterey-County-felt-in-12354131.php?utm_campaign=facebook-mobile&utm_source=CMS+Sharing+Button&utm_medium=social,2017-11-14 07:40:24,23,1,14,11,0,8,3,1,0,0
431863377156272_555143708161571,Washington Post Offered Money To Roy Moore Accusers While Getting “Tips” From Mitch McConnell,Washington Post Offered Money To Roy Moore Accusers While Getting “Tips” From Mitch McConnell,link,https://squawker.org/politics/wprm/,2017-11-13 10:07:55,157,28,155,60,1,37,1,0,58,0
431863377156272_553621161647159,Trump and Putin shake hands at APEC summit dinner,Trump and Putin shake hands at APEC summit dinner,link,https://ca.news.yahoo.com/white-house-says-trump-putin-not-separate-meeting-055641777.html?soc_src=social-sh&soc_trk=fb,2017-11-10 12:35:00,46,8,8,36,7,1,2,0,0,0
431863377156272_553540568321885,Homeland Security bulletin warns of weaponized drones and threat to aviation,Homeland Security bulletin warns of weaponized drones and threat to aviation,link,http://abcnews.go.com/US/homeland-security-bulletin-warns-weaponized-drones-threat-aviation/story?id=51050621&cid=share_facebook_widget,2017-11-10 09:54:03,8,0,11,3,0,2,0,1,2,0
431863377156272_553538658322076,Psychologists say more and more young people are entitled,Psychologists say more and more young people are entitled,link,https://www.indy100.com/article/young-people-entitlement-disappointed-narcissism-psychology-research-7867961,2017-11-10 09:51:20,39,13,17,21,0,3,5,8,2,0
431863377156272_553536258322316,Are The Rich Panicking? Hoarding Cash..,Are The Rich Panicking?,link,http://www.zerohedge.com/news/2017-11-09/are-rich-panicking,2017-11-10 09:46:02,7,0,7,3,1,2,1,0,0,0
431863377156272_553532234989385,Radioactive cloud over Europe may have come from nuclear accident in Russia or Kazakhstan,'Harmless' radioactive cloud over Europe may have come from nuclear accident in Russia or Kazakhstan,link,http://www.telegraph.co.uk/news/2017/11/10/harmless-radioactive-cloud-europe-may-have-come-nuclear-accident/?WT.mc_id=tmg_share_fb,2017-11-10 09:36:27,10,1,10,5,0,5,0,0,0,0
431863377156272_553530138322928,TRUMP DELIVERS: 37 major deals US firms signed with Chinese entities during Trump's visit,These are the 37 major deals US firms signed with Chinese entities during Trump's visit,link,http://cnb.cx/2zLw3y3,2017-11-10 09:32:52,59,5,30,51,7,1,0,0,0,0
431863377156272_553300668345875,Judge Roy Moore Responds to WaPo Smears: ‘I Will Never Give Up’,Judge Roy Moore Responds to WaPo Smears: 'I Will Never Give Up' - Breitbart,link,http://bit.ly/2zrhVtl,2017-11-09 21:24:14,20,12,2,17,3,0,0,0,0,0
