status_id,status_message,link_name,status_type,status_link,status_published,num_reactions,num_comments,num_shares,num_likes,num_loves,num_wows,num_hahas,num_sads,num_angrys,num_special
431863377156272_611856569156951,Antarctica: Previously unknown 'supercolony' of penguins discovered...,Previously unknown 'supercolony' of 1.5 million penguins discovered in Antarctica,video,https://t.co/KrQ1hYwpxR,2018-03-02 06:06:38,309,21,105,226,18,62,3,0,0,0
431863377156272_611125495896725,HOPE LEAVES WHITE HOUSE,"In blow to Trump, top aide Hope Hicks to leave White House",link,https://t.co/2Ofgj0zOwK,2018-02-28 21:09:30,30,11,2,15,3,1,3,5,3,0
431863377156272_611125389230069,STOCKS LOSE SPELL IN FEB...,"Dow closes 380 points lower, snaps longest monthly win streak since 1959",link,https://t.co/jBozm6lcit,2018-02-28 21:09:17,11,2,0,11,0,0,0,0,0,0
431863377156272_611125295896745,Unseen Power...,The unseen power of Hope Hicks,link,https://t.co/MZu4sKTV8q,2018-02-28 21:09:04,28,8,2,23,1,1,2,0,1,0
431863377156272_611033255905949,ROSE MCGOWAN:  Someone connected to Weinstein planted cocaine on me...,"Rose McGowan Wants Drug Charge Dropped, Suggests Weinstein Set Her Up",link,https://t.co/3DcMZcg7iF,2018-02-28 16:24:11,35,19,4,17,0,5,12,0,1,0
431863377156272_611032919239316,YOUTUBE 'Mistakenly' Pulls Right-Wing Channels...,YouTube's New Moderators Mistakenly Pull Right-Wing Channels,link,https://t.co/AhJXZqUUOH,2018-02-28 16:23:36,169,34,43,45,1,9,23,3,88,0
431863377156272_611031692572772,"OPRAH: IF GOD SAYS RUN, I'LL RUN...",Oprah Winfrey Reveals the One Thing That Could Make Her Run for President,link,https://t.co/RW34UPqKlL,2018-02-28 16:20:14,62,78,7,6,1,1,48,1,5,0
431863377156272_611031555906119,Intense Nor'easter Could Have Major Coastal Impacts...,"Strong Nor'easter Could Bring Damaging Winds, Major Coastal Flooding, Beach Erosion to New England Friday and Saturday | The Weather Channel",link,https://t.co/bXTMxa4HDl,2018-02-28 16:19:53,50,3,36,32,0,13,2,3,0,0
431863377156272_611031239239484,Saudi crown prince set for DC visit...,Saudi crown prince to visit Washington on March 19,link,https://t.co/bxW5KvqZRb,2018-02-28 16:19:21,17,4,3,15,0,1,0,0,1,0
431863377156272_611030622572879,Divided Over Vow To Repeal Tax Cuts...,Echo of Obamacare: Dems divided over vow to repeal tax law,link,https://t.co/vZzSwsZnHl,2018-02-28 16:18:06,13,11,6,8,0,0,1,0,4,0
431863377156272_611030532572888,PBS launching new conservative political talk show...,PBS launching new conservative political talk show,link,https://t.co/B8Cke9m6Cc,2018-02-28 16:17:49,67,13,11,44,1,9,13,0,0,0
431863377156272_611030182572923,Penske said to get $200M investment from Saudi fund...,Jay Penske said to get $200M investment from Saudi fund,link,https://t.co/gPY5c0VT2e,2018-02-28 16:17:01,14,2,1,7,0,4,1,0,2,0
431863377156272_611029735906301,Pesticides put bees at risk...,"Pesticides put bees at risk, European watchdog confirms",link,https://t.co/cWhet2D4jv,2018-02-28 16:16:22,15,7,5,10,0,1,0,1,3,0
431863377156272_611029609239647,SESSIONS IN THE DOGHOUSE...,Trump rips Sessions's 'DISGRACEFUL' decision on probe of alleged FISA abuses,link,https://t.co/mWhEavdQmq,2018-02-28 16:16:08,66,39,9,58,2,0,0,0,6,0
431863377156272_611029262573015,Germany confirms hack of government computers...,Germany says its government computers secure after 'isolated' hack,link,https://t.co/xpMF6zP161,2018-02-28 16:15:35,10,0,0,6,0,3,1,0,0,0
431863377156272_611028882573053,Meet Community Organizers Fighting Against -- Obama...,Meet the Community Organizers Fighting Against … Barack Obama,link,https://t.co/g7Vnof4jaL,2018-02-28 16:14:48,5,0,6,5,0,0,0,0,0,0
431863377156272_610124435996831,Air Force Chief Warns of Space War 'in Matter of Years'...,US Air Force Chief Warns of Space War ‘in a Matter of Years’,link,https://t.co/S50S7QieGk,2018-02-26 23:36:10,68,12,27,48,0,18,0,1,1,0
431863377156272_610123862663555,YORK: Hard to say Obama tougher than Trump on Russia...,Byron York: Trump and Obama: Who's really tougher on Russia?,link,https://t.co/WRmFYpXCrV,2018-02-26 23:34:55,16,9,2,13,0,0,3,0,0,0
431863377156272_610123442663597,"University Shrugs After White Student Called 'Mayonnaise Monster', Photoshopped on Cracker...",University Shrugs Its Shoulders After White Student Gets Called ‘Mayonnaise Monster Lookin A**’,link,https://t.co/8r1TnxeEnJ,2018-02-26 23:33:59,28,7,4,6,0,2,2,1,17,0
431863377156272_610123142663627,PAYBACK: NFL Expected to Fine COWBOYS Owner Millions After Messing With Goodell Contract...,Roger Goodell Expected to Demand Millions of Dollars From Jerry Jones,link,https://t.co/pkwMcXuNw6,2018-02-26 23:33:13,22,8,6,5,0,1,3,1,12,0
431863377156272_610122932663648,Georgia Senate blocks DELTA tax break after spat with NRA...,Delta’s tax break may not take flight after Georgia Senate blocks it,link,https://t.co/52A0TnpqdM,2018-02-26 23:32:47,215,12,24,180,13,3,18,1,0,0
431863377156272_610122495997025,TRUMP ORG donates foreign profits to USA...,Trump’s Company Won’t Disclose Size of Donation of Foreign Profits to U.S.,link,https://t.co/H8I7uG3bBA,2018-02-26 23:31:43,41,6,9,34,7,0,0,0,0,0
431863377156272_608449492830992,Music videos lead to arrest of rapper on federal firearms charges...,Music videos lead to arrest of Dallas rapper on federal firearms charges,link,https://t.co/WTUSFQKXLE,2018-02-23 19:07:00,107,19,16,63,7,1,34,1,1,0
431863377156272_607946612881280,Social media 'causing mental health crisis'...,Social media websites are 'causing a mental health crisis',video,https://t.co/Y2uePNNbja,2018-02-22 19:42:51,32,2,11,24,0,1,5,1,1,0
431863377156272_607946282881313,"TRUMP:  Maybe Video Games, Movies Too Violent...",Trump: ‘Maybe They Have to Put a Rating System’ on Movies,link,https://t.co/ClTyGwTzQT,2018-02-22 19:41:57,144,26,30,119,16,1,7,1,0,0
431863377156272_607927819549826,CHARGES DOUBLED,Mueller more than doubles criminal charges against Manafort and Gates,link,https://t.co/ehGXXjiJKH,2018-02-22 18:38:48,28,14,6,10,0,7,4,1,6,0
431863377156272_607927679549840,MUELLER INDICTS MANAFORT AGAIN https://t.co/hgJWlCu2yw,"Mueller adds new tax, bank fraud charges against Manafort, Gates",link,https://t.co/hgJWlCu2yw,2018-02-22 18:38:15,15,6,2,7,0,3,4,0,1,0
431863377156272_607896442886297,Blacks labeled racist for opposing Obama Library plans...,"As Obama Presidential Center comes closer to reality, tensions on race, class surface",link,https://t.co/AWv95MM0Dg,2018-02-22 16:34:18,48,13,19,19,0,2,17,1,9,0
431863377156272_607890746220200,People keep dying from flu. When will it end?,People in NC keep dying from the flu. When will it end?,link,https://t.co/6QYXaP0hy1,2018-02-22 16:16:35,11,14,6,5,0,2,0,3,1,0
431863377156272_607890526220222,HALF of parents worry child addicted to phones...,Exclusive: Nearly half of parents worry their child is addicted to mobile devices,link,https://t.co/YEi1AZ6csv,2018-02-22 16:16:04,26,21,8,19,0,0,1,5,1,0
431863377156272_607841912891750,"White Student Attacked In Philly School, Family Says Targeted Because Of Race...",EXCLUSIVE: Boy Bullied At School Wakes Up To Racist Graffiti On Home,link,https://t.co/ljqCjkLWUc,2018-02-22 14:10:29,96,14,31,27,1,3,0,17,48,0
431863377156272_607841289558479,"Dems want gun control, but worry it could cost them midterms...","Dems want gun control, but worry it could cost them midterms",link,https://t.co/IWOaZ5Y36I,2018-02-22 14:09:30,32,12,12,22,0,0,10,0,0,0
431863377156272_607840736225201,"Trudeau ridiculed by Indians for 'fake, annoying' traditional outfits...",Justin Trudeau ridiculed by Indians for 'fake and annoying' outfits,video,https://t.co/XEGBkxsn3G,2018-02-22 14:08:23,210,39,53,61,0,6,140,1,2,0
431863377156272_607840452891896,Texas to build police substation at school...,Wealthy Texas suburb to build police substation on school campus,link,https://t.co/pLRXzgv4sF,2018-02-22 14:07:49,72,7,14,61,10,1,0,0,0,0
431863377156272_607529336256341,Moderator Tapper Sits Back as Student Equates Rubio to School Shooter...,CNN’s Tapper Sits Back as Student Equates Rubio to School Shooter,link,https://t.co/2UPMZqq3lI,2018-02-22 00:23:06,72,34,8,20,0,7,3,3,39,0
431863377156272_607510842924857,Couple rescued from remote desert island after writing massive HELP sign in sand...,Couple rescued from remote desert island after writing massive HELP sign in the sand,link,https://t.co/hrFKYjZnfk,2018-02-21 23:29:05,21,1,1,18,1,1,1,0,0,0
431863377156272_607510076258267,"Israel, Iran on collision course over Syria...","Israel, Iran head toward military clash over Syria",link,https://t.co/Svq0NdIqpa,2018-02-21 23:26:53,12,0,1,10,1,1,0,0,0,0
431863377156272_607509876258287,GUCCI models walk runway with 'SEVERED heads'...,Severed heads hold a sneaky feminist meaning at Gucci,link,https://t.co/tehAJHCRyn,2018-02-21 23:26:15,47,29,11,6,0,14,1,4,22,0
431863377156272_607509459591662,WILD WEATHER: Boston 70° today -- snow tomorrow...,"It could hit 70 degrees today, then snow tomorrow - The Boston Globe",link,https://t.co/6FgMiGk8W5,2018-02-21 23:24:55,8,0,1,5,0,1,2,0,0,0
431863377156272_607433892932552,Woman Receives Violent Threats After CNN Shames for Sharing 'Russian' Event Online...,"Woman Receives Abuse, Violent Threats After CNN Tracks Down, Publicly Shames Her for Sharing 'Russian' Event on Facebook | Breitbart",link,https://t.co/UcyWDA6z5u,2018-02-21 19:41:23,38,12,16,9,0,3,0,1,25,0
431863377156272_607432842932657,Bipartisan bill to make baggy pants ILLEGAL in SCarolina?,Bill Would Ban Saggy Pants in South Carolina,link,https://t.co/s75e8XLR6S,2018-02-21 19:38:24,247,57,44,193,20,3,26,1,4,0
431863377156272_607432549599353,TINDER traffic skyrockets...,"Winter Olympics get steamy as traffic on Tinder, PornHub skyrockets",link,https://t.co/0ZlU43guYJ,2018-02-21 19:37:05,11,0,2,4,0,1,6,0,0,0
431863377156272_607431512932790,Trump's Republican Critics Find Sudden Need for His Support...,Trump’s Republican Critics Find a Sudden Need for His Support,link,https://t.co/4HtdO6oeTh,2018-02-21 19:34:29,22,2,4,12,0,0,10,0,0,0
431863377156272_607429739599634,HARVARD slammed for picking 'white male' as next president... https://t.co/NgGySxoCF0,Harvard's Next President Finds a Teaching Moment Even Before Taking Office,link,https://t.co/NgGySxoCF0,2018-02-21 19:29:07,12,3,0,5,1,3,1,2,0,0
431863377156272_607429586266316,Postal Service spent $16M on TV show about inspectors... https://t.co/uXLYioePby,Stamping out crime: Postal Service spends millions on TV show about its crime-fighting inspectors,link,https://t.co/uXLYioePby,2018-02-21 19:28:52,24,3,3,9,0,10,2,1,2,0
431863377156272_607429009599707,Venezuelans lost 24-lbs on average last year as hunger spread... https://t.co/YsCC3UyPYo,Venezuelans report big weight losses in 2017 as hunger hits,link,https://t.co/YsCC3UyPYo,2018-02-21 19:27:37,25,10,11,10,0,2,0,13,0,0
431863377156272_607428842933057,MEDIUM suspends right-wing commentators... https://t.co/vxKokdEw9b,Publishing platform Medium suspends far-right figures,link,https://t.co/vxKokdEw9b,2018-02-21 19:27:08,9,0,1,2,0,0,0,1,6,0
431863377156272_607428259599782,Border Wall construction begins -- to replace existing sliver,Border wall work begins in downtown Calexico,link,"http://www.sandiegouniontribune.com/news/california/la-me-border-wall-20180221-story,amp.html?__twitter_impression=true",2018-02-21 19:25:45,61,3,7,53,8,0,0,0,0,0
431863377156272_607427729599835,'SOFT TARGETS NEED TO BE FORTIFIED',Broward Sheriff: Deputies To Carry Rifles On School Grounds,link,http://cbsloc.al/2CB6mgJ#.Wo4NS-c2ZyY.facebook,2018-02-21 19:23:05,95,10,15,79,14,2,0,0,0,0
431863377156272_607427009599907,33 Days: Cops Frustrated As Drug Dealer Refuses to Poo 'Swallowed' Evidence,Suspected Harlow drug dealer has now gone 33 days without pooing out his drugs,link,https://www.essexlive.news/news/suspected-harlow-drug-dealer-now-1235801#ICID=sharebar_facebook,2018-02-21 19:19:50,48,31,10,13,0,9,26,0,0,0
431863377156272_607426382933303,"NYU under fire for watermelon, collards 'Black History' meal",NYU served ‘racially insensitive’ Black History Month meal,link,http://nyp.st/2Fkei8N,2018-02-21 19:16:59,39,34,6,11,0,1,25,1,1,0
431863377156272_607351842940757,Porn Offers Hollywood Help Taking Down 'Deepfake' Videos... https://t.co/A0dIFzOjFT,Porn Producers Offer to Help Hollywood Take Down Deepfake Videos,link,https://t.co/A0dIFzOjFT,2018-02-21 14:55:16,16,2,2,10,0,1,5,0,0,0
431863377156272_607351606274114,Gaza to pump sewage straight into sea as crisis worsens... https://t.co/qAkzj5k41R,Gaza to pump sewage straight into sea as crisis worsens,link,https://t.co/qAkzj5k41R,2018-02-21 14:54:46,31,11,3,12,0,1,2,3,13,0
431863377156272_607350899607518,'JEOPARDY!' host Trebek to moderate gubernatorial debate... https://t.co/BWo3X8SIOM,'Jeopardy!' host Alex Trebek to moderate a Pa. gubernatorial debate - Philly,link,https://t.co/BWo3X8SIOM,2018-02-21 14:52:26,27,7,7,17,0,1,8,0,1,0
431863377156272_607349626274312,"Shooter always in trouble, never expelled. Why didn't school system do more? https://t.co/hmlgcSSU8N","Parkland shooter always in trouble, never expelled. Why didn’t school system do more?",link,https://t.co/hmlgcSSU8N,2018-02-21 14:48:30,86,21,32,57,0,4,0,3,22,0
431863377156272_607348489607759,China vows crack down on funeral strippers... https://t.co/gvjw9ymytJ,China vows to crack down on funeral strippers,link,https://t.co/gvjw9ymytJ,2018-02-21 14:44:57,55,19,52,18,0,16,19,0,2,0
431863377156272_607345889608019,Layoffs at VOX... https://t.co/zUdbLgvEEK,EXCLUSIVE: Employees Sound Off After Cuts At Vox Media,link,https://t.co/zUdbLgvEEK,2018-02-21 14:36:58,12,2,2,9,0,0,3,0,0,0
431863377156272_607345346274740,ANOTHER DISNEY Exec Accused of Sex Misconduct... https://t.co/Ffi9bqcK07,"At Straitlaced Disney, a Star Producer’s R-Rated Behavior Draws Complaints",link,https://t.co/Ffi9bqcK07,2018-02-21 14:35:09,24,5,8,14,0,1,5,3,1,0
431863377156272_607308796278395,TV Ready for Trump-Loving Comic With 'Nothing Left to Prove'? https://t.co/KWGEXMDCHc,"Roseanne Returns: Is TV Ready for a Trump-Loving Comic With ""Nothing Left to Prove""?",link,https://t.co/KWGEXMDCHc,2018-02-21 12:44:06,298,43,35,264,26,5,1,1,1,0
431863377156272_607308662945075,MS-13 spreads to 22 states... https://t.co/Ekqms4qRXM,"MS-13 spreads to 22 states, fed by 300,000 illegals, DACA recipients, tied to 207 murders",link,https://t.co/Ekqms4qRXM,2018-02-21 12:43:51,107,8,92,39,0,5,0,9,54,0
431863377156272_607307696278505,UPDATE: Brazil's senate approves military intervention in Rio... https://t.co/uwHqidVoRU,Brazil's senate approves military intervention in Rio,link,https://t.co/uwHqidVoRU,2018-02-21 12:40:35,6,2,0,3,0,0,2,1,0,0
431863377156272_607307469611861,Rand Paul bids to mold GOP in his image... https://t.co/bLrQpnNz85,Rand Paul bids to mold the GOP in his image,link,https://t.co/bLrQpnNz85,2018-02-21 12:39:49,25,0,2,21,1,0,3,0,0,0
431863377156272_607306712945270,SHERIFF CLARKE: Student gun control push has 'Soros fingerprints all over it'... https://t.co/QV096qg7MU,David Clarke: Fla. students' gun control push has 'George Soros' fingerprints all over it',link,https://t.co/QV096qg7MU,2018-02-21 12:37:57,296,25,135,263,5,7,3,1,17,0
431863377156272_607051856304089,"Delaware may let students ‘choose’ their race, gender without parental consent","Delaware may let students ‘choose’ their race, gender without parental consent",link,http://fxn.ws/2ollQAj,2018-02-21 01:49:33,145,35,79,32,1,9,31,11,61,0
431863377156272_607009596308315,Top experts warn against 'malicious use' of AI... https://t.co/AA4MN3ektl,Top experts warn against 'malicious use' of AI,link,https://t.co/AA4MN3ektl,2018-02-20 23:33:22,19,5,10,15,0,4,0,0,0,0
431863377156272_607004832975458,"TV evangelist Jim Bakker persists, preaching Apocalypse... https://t.co/tCcHFstK2p",Fallen PTL preacher Jim Bakker is back with a new message about the Apocalypse,link,https://t.co/tCcHFstK2p,2018-02-20 23:16:32,23,20,2,11,0,2,8,0,2,0
431863377156272_606999229642685,Teen sentenced to 6 months for smuggling tiger cub across border... https://t.co/0pCe6Np3nd,Teen gets 6 months for smuggling Bengal tiger cub into US,link,https://t.co/0pCe6Np3nd,2018-02-20 22:57:01,21,4,3,14,0,0,2,1,4,0
431863377156272_606998916309383,"Bezos reveals massive 10,000-year clock being built inside mountain... https://t.co/dFr4xmj4wN","Jeff Bezos just revealed video of the massive 10,000 year clock being built inside a Texas mountain",link,https://t.co/dFr4xmj4wN,2018-02-20 22:55:56,20,10,5,15,0,1,4,0,0,0
431863377156272_606996049643003,"'BLACK PANTHER' packed with action, diversity --  but no gays... https://t.co/F5lnXz0dE0","‘Black Panther,’ hailed for diversity, has no gay characters",link,https://t.co/F5lnXz0dE0,2018-02-20 22:47:28,73,42,15,28,4,4,36,0,1,0
431863377156272_606995916309683,NBC Glorifies Gun Owners Destroying Their Weapons on Social Media... https://t.co/sbSPSLIHtL,NBC Glorifies Gun Owners Destroying Their Weapons on Social Media,link,https://t.co/sbSPSLIHtL,2018-02-20 22:47:04,25,20,2,3,0,0,13,0,9,0
431863377156272_606995759643032,FL Shooting Survivor: Media Using Tragedy To Push Controls... https://t.co/uKLzP8WGm9,Survivor Of School Shooting Eviscerates Media For Using Tragedy To Push Gun Control,link,https://t.co/uKLzP8WGm9,2018-02-20 22:46:44,46,2,9,41,4,0,0,0,1,0
431863377156272_606995649643043,Witness: Teacher Caught Telling Parkland Students to Attend Anti-Second Amendment Rally... https://t.co/pnFcgoAHUW,Witness: Teacher Caught Telling Parkland Students to Attend Anti-Second Amendment Rally,link,https://t.co/pnFcgoAHUW,2018-02-20 22:46:29,17,0,9,7,0,1,0,1,8,0
431863377156272_606995426309732,FIGHT BACK:  Tavis Smiley Sues PBS for Firing Over Harassment Allegations... https://t.co/HwzTITYyef,Tavis Smiley Sues PBS for 'Trumped-Up' Firing Over Harassment Allegations,link,https://t.co/HwzTITYyef,2018-02-20 22:45:45,8,0,1,5,0,0,3,0,0,0
431863377156272_606995016309773,"NEWSWEEK Staffers Threaten to Resign, Claiming Company Tried to Silence Investigation of Owners... https://t.co/MwPGrn4T33","Newsweek Staffers Threaten to Resign, Claiming Company Tried to Silence Investigation of Owners",link,https://t.co/MwPGrn4T33,2018-02-20 22:44:20,21,4,1,16,0,0,5,0,0,0
431863377156272_606906989651909,France considers jailing illegals using fake IDs for 5 years,France considers jailing illegal immigrants for up to five years for fake ID,link,http://www.telegraph.co.uk/news/2018/02/20/france-considers-jailing-illegal-immigrants-five-years-fake/,2018-02-20 18:17:21,258,24,58,211,23,17,7,0,0,0
431863377156272_606905719652036,Nancy Heckled: 'How Much Are You Worth!?',"Heckler confronts Pelosi over her wealth: 'How much are you worth, Nancy?' - The American Mirror",link,http://www.theamericanmirror.com/heckler-confronts-pelosi-wealth-much-worth-nancy/,2018-02-20 18:13:37,111,20,17,62,2,2,44,1,0,0
431863377156272_606898499652758,Deleted emails...,Mueller charges lawyer with false statements in Russia probe,link,https://www.yahoo.com/news/mueller-charges-lawyer-false-statements-russia-probe-144410929.html?soc_src=community&soc_trk=fb,2018-02-20 17:43:50,42,17,3,17,0,3,15,0,7,0
431863377156272_606894976319777,Trump tells Sessions to ban devices that turn weapons into machine guns,Trump pushes ban on 'bump stocks' — devices that turn weapons into 'machine guns',link,https://www.cnbc.com/amp/2018/02/20/trump-signs-a-memo-telling-attorney-general-sessions-to-ban-devices-that-turn-weapons-into-machine-guns.html?__twitter_impression=true,2018-02-20 17:28:21,103,35,30,64,1,2,0,6,30,0
431863377156272_606892916319983,Attorney Accused of Making False Statements,Mueller team reveals plea deal of Russia oligarch's son-in-law,link,http://www.nydailynews.com/news/politics/mueller-team-reveals-plea-deal-russia-oligarch-son-in-law-article-1.3830985,2018-02-20 17:19:46,17,7,2,13,0,0,2,0,2,0
431863377156272_606842239658384,German War Planes Grounded By Eco-Gas,German War Planes Grounded By Eco-Gas,link,http://freebeacon.com/national-security/german-war-planes-grounded-eco-gas/amp/?__twitter_impression=true,2018-02-20 14:31:36,25,0,8,11,0,4,10,0,0,0
431863377156272_605942139748394,Pro golfers turn on raucous crowds,Rory McIlroy turns on fans and says 'circus' around Tiger Woods puts American at 'two-shot disadvantage',link,http://www.telegraph.co.uk/golf/2018/02/17/rory-mcilroy-turns-raucous-fans-says-circus-around-tiger-woods/,2018-02-18 23:11:51,28,8,5,19,0,1,8,0,0,0
431863377156272_605941519748456,TIGER: They've cost me trophies,Rory McIlroy: Crazy golf galleries cost Tiger Woods two shots every tournament,link,https://www.cbssports.com/golf/news/rory-mcilroy-crazy-golf-galleries-cost-tiger-woods-two-shots-every-tournament/,2018-02-18 23:10:44,27,12,1,16,0,4,6,1,0,0
431863377156272_605940199748588,Fergie Roasted for Anthem at NBA All-Star Game: 'Worst Ever!',"Viewers Slam Fergie for ""Worst Rendition Ever"" of National Anthem",link,https://www.hollywoodreporter.com/news/viewers-slam-fergies-national-anthem-performance-at-nba-all-star-game-as-worst-rendition-ever-1086009,2018-02-18 23:08:26,135,45,25,75,0,7,38,11,4,0
431863377156272_605895366419738,Hungary's Orban calls for global anti-migrant alliance,Hungary's Orban calls for global anti-migrant alliance with eye on 2018 elections,link,https://ca.news.yahoo.com/news/hungarys-orban-calls-global-anti-migrant-alliance-eye-172952366--business.html?soc_src=community&soc_trk=fb,2018-02-18 20:55:35,80,8,12,74,5,1,0,0,0,0
431863377156272_604726679869940,Soros Calls For Social Media Regulation to Fight Populism,Soros Calls on EU to Regulate Social Media to Fight Populism,link,http://www.breitbart.com/london/2018/02/16/soros-calls-eu-regulate-social-media-fight-populism/,2018-02-16 17:27:19,150,57,77,18,0,7,16,3,106,0
431863377156272_604720853203856,Repeal gun-free zones,Repeal gun-free zones,link,https://www.usatoday.com/story/opinion/2018/02/15/repeal-gun-free-zones-erich-pratt-editorials-debates/110464412/,2018-02-16 17:09:28,135,13,46,124,9,0,0,2,0,0
431863377156272_604664436542831,Record Minnesotans Own Guns; Crime Rate 50-YEAR LOW,"Reality Check: More Minnesotans Own Guns, Violent Crime Remains Low",link,https://wp.me/p14KOW-3m4U,2018-02-16 14:09:28,161,7,87,146,9,5,0,1,0,0
431863377156272_604218723254069,DNC Fundraises Off Florida Shooting,DNC Fundraises Off Florida Shooting,link,http://amp.dailycaller.com/2018/02/15/florida-shooting-dnc-nra/,2018-02-15 20:45:34,101,34,38,17,0,6,0,8,70,0
431863377156272_604167429925865,Senate defeats president's immigration plan,Senate set for face-plant on immigration,link,http://politi.co/2Gf2QL0,2018-02-15 17:41:16,29,14,1,16,0,0,4,1,8,0
431863377156272_604166653259276,Recycling innovator faces prison for trying to extend computers' lives,Electronics-recycling innovator faces prison for trying to extend computers' lives,link,http://www.latimes.com/business/technology/la-fi-microsoft-restore-disc-20180215-story.html,2018-02-15 17:39:09,62,4,18,13,0,23,2,3,21,0
431863377156272_604105446598730,SHACKLED AND COWERING,Florida school shooter is booked into jail on 17 counts of murder,video,http://www.dailymail.co.uk/news/article-5394229/Florida-high-school-shooting-plunges-city-mourning.html,2018-02-15 14:36:54,49,15,3,31,0,1,0,1,16,0
431863377156272_604097786599496,Grandmother Stops Another School Shooting Day Before Florida Massacre,Grandmother Stops Another School Shooting Day Before Florida Massacre,link,http://dfw.cbslocal.com/2018/02/15/grandmother-stops-school-shooting/amp/?__twitter_impression=true,2018-02-15 14:12:22,107,1,38,80,2,22,0,3,0,0
431863377156272_604094346599840,DOJ official hid FUSION GPS payments,EXCLUSIVE: DOJ Official Bruce Ohr Hid Wife’s Fusion GPS Payments From Ethics Officials,link,http://amp.dailycaller.com/2018/02/14/exclusive-doj-official-bruce-ohr-hid-wifes-fusion-gps-payments-from-ethics-officials/,2018-02-15 14:02:15,90,14,32,32,0,23,0,0,35,0
431863377156272_604094119933196,DEM REP PREDICTS PELOSI DEMISE,Dem Rep Predicts Pelosi Will Not Be Party Leader in 2019,link,http://freebeacon.com/politics/dem-rep-predicts-pelosi-not-party-leader-2019/amp/?__twitter_impression=true,2018-02-15 14:01:45,43,22,2,28,0,0,14,0,1,0
431863377156272_603660669976541,Parents storm meeting as school board dumps Valentine's Day,Changes to Valentine’s Day celebration at Bethel School District spark unlovely reaction,link,http://registerguard.com/rg/news/local/36443897-75/changes-to-valentines-day-celebration-at-bethel-school-district-spark-unlovely-reaction.html.csp,2018-02-14 19:11:29,50,11,9,33,0,2,0,1,14,0
431863377156272_603654376643837,Horrifying phone footage captures moment gunfire erupts,Horrifying cell phone footage inside Florida high school,link,http://www.dailymail.co.uk/news/article-5392929/Horrifying-cell-phone-footage-inside-Florida-high-school.html,2018-02-14 18:46:33,46,10,9,12,1,4,0,22,7,0
431863377156272_603650729977535,Mayor accused of offering speed bumps in exchange for sex,NEW: Woman says Lantana mayor offered speed bumps in exchange for sex,link,http://www.mypalmbeachpost.com/news/local/woman-says-lantana-mayor-offered-speed-bumps-exchange-for-sex/xeM0Y6IDNcTdG6k5p9ZcfO/amp.html?__twitter_impression=true,2018-02-14 18:33:21,40,21,5,13,0,9,12,0,6,0
431863377156272_603650483310893,Web readies for GOOGLE 'CHROME' ad-blocking,This is why Google Chrome will start blocking a bunch of ads tomorrow,link,https://www.cnet.com/news/how-chrome-ad-blocking-already-is-changing-web-publishing/,2018-02-14 18:32:30,33,8,15,22,0,1,1,0,9,0
431863377156272_603650176644257,MAG: Push to tighten web strangehold,What Is Google Really Up To?,link,https://www.popularmechanics.com/culture/web/a17887424/google-chrome-ad-blocking-amp-pages/,2018-02-14 18:31:27,7,1,4,7,0,0,0,0,0,0
